0,1,label2,summary_sentences
"We consider different LM smoothing methods including Kneser-Ney (KN), improved Kneser-Ney (IKN), and Witten-Bell (WB).",4.3 Baseline System without Typo Correction,[0],[0]
"All of the three smoothing methods for bigram and trigram LMs are examined both using back-off mod-
2We only work on the PTC conversion part of IME, thus we are unable to use existing evaluation systems (Jia and Zhao, 2013) for full Chinese IME functions.
",4.3 Baseline System without Typo Correction,[0],[0]
"3Other evaluation metrics are also proposed by (Zheng et al., 2011a) which is only suitable for their system since our system uses a joint model
els and interpolated models.",4.3 Baseline System without Typo Correction,[0],[0]
The number of N - best candidates for PTC conversion is set to 10.,4.3 Baseline System without Typo Correction,[0],[0]
The results on D are shown in Figure 7 in which the “-i” suffix indicates using interpolated model.,4.3 Baseline System without Typo Correction,[0],[0]
"According to the results, we then choose the trigram LM using Kneser-Ney smoothing with interpolation.
",4.3 Baseline System without Typo Correction,[0],[0]
The choice of the number of N -best candidates for PTC conversion also has a strong impact on the results.,4.3 Baseline System without Typo Correction,[0],[0]
"Figure 8 shows the results onDwith differentNs, of which theN axis is drawn in logarithmic scale.",4.3 Baseline System without Typo Correction,[0],[0]
"We can observe that MIU-Acc slightly decreases while N goes up, but Ch-Acc largely increases.",4.3 Baseline System without Typo Correction,[0],[0]
"We therefore chooseN = 10 as trade-off.
",4.3 Baseline System without Typo Correction,[0],[0]
The parameter γ determines emission probability.,4.3 Baseline System without Typo Correction,[0],[0]
"Results with different γ on D is shown in Figure 9, of which the γ axis is drawn in logarithmic scale.",4.3 Baseline System without Typo Correction,[0],[0]
"γ = 0.03 is chosen at last.
",4.3 Baseline System without Typo Correction,[0],[0]
We compare our baseline system with several practical pinyin IMEs including sunpinyin and Google Input Tools (Online version)4.,4.3 Baseline System without Typo Correction,[0],[0]
"The results on D are shown in Table 2.
4http://www.google.com/inputtools/try/",4.3 Baseline System without Typo Correction,[0],[0]
"Based upon the baseline system, we build the joint system of PTC conversion with typo correction.
",4.4 PTC Conversion with Typo Correction,[0],[0]
We simulate user typos by randomly generating errors automatically on the corpus.,4.4 PTC Conversion with Typo Correction,[0],[0]
The typo rate is set according to previous Human-Computer Interaction (HCI) studies.,4.4 PTC Conversion with Typo Correction,[0],[0]
"Due to few works have been done on modeling Chinese text entry, we have to refer to those corresponding results on English (Wobbrock and Myers, 2006; MacKenzie and Soukoreff, 2002; Clarkson et al., 2005), which show that the average typo rate is about 2%.",4.4 PTC Conversion with Typo Correction,[0],[0]
"(Zheng et al., 2011a) performed an experiment that 2,000 sentences of 11,968 Chinese words were entered by 5 native speakers.",4.4 PTC Conversion with Typo Correction,[0],[0]
"The collected data consists of 775 mistyped pinyin words caused by one edit operation, and 85 caused by two edit operations.",4.4 PTC Conversion with Typo Correction,[0],[0]
"As we observe on T that the average pinyin word length is 5.24, then typo rate in the experiment of (Zheng et al., 2011a) can be roughly estimated as:
775 + 85× 2 11968× 5.24 = 1.51%,
which is similar to the conclusion on English.",4.4 PTC Conversion with Typo Correction,[0],[0]
"Thus we generate corpora from D with typo rate of 0% (0-P), 2% (2-P), and 5% (5-P) to evaluate the system.
",4.4 PTC Conversion with Typo Correction,[0],[0]
"According to (Zheng et al., 2011a) most mistyped pinyin words are caused by one edit operation.",4.4 PTC Conversion with Typo Correction,[0],[0]
"Since pinyin syllable is much shorter than
pinyin word, this ratio can be higher for pinyin syllables.",4.4 PTC Conversion with Typo Correction,[0],[0]
"From our statistics on T, with 2% randomly generated typos, Pr(L(S′, S) < 2) = 99.86%.",4.4 PTC Conversion with Typo Correction,[0],[0]
"Thus we set the threshold T for L to 2.
",4.4 PTC Conversion with Typo Correction,[0],[0]
We first set K-shortest paths filter to K = 10 and tune β.,4.4 PTC Conversion with Typo Correction,[0],[0]
Results with different β are shown in Figure 10.,4.4 PTC Conversion with Typo Correction,[0],[0]
"With β = 3.5, we select K. Re-
sults with different K are shown in Figure 11.",4.4 PTC Conversion with Typo Correction,[0],[0]
"We choose K = 20 since there is no significant improvement when K > 20.
",4.4 PTC Conversion with Typo Correction,[0],[0]
The selection of K also directly guarantees the running time of the joint model.,4.4 PTC Conversion with Typo Correction,[0],[0]
"With K = 20, on a normal PC with Intel Pentium Dual-Core E6700 CPU, the PTC conversion rate is over 2000 characters-per-minute (cpm), which is much faster than the normal typing rate of 200 cpm.
",4.4 PTC Conversion with Typo Correction,[0],[0]
"With all parameters optimized, results on T
using the proposed joint model are shown in Table 3 and Table 4.",4.4 PTC Conversion with Typo Correction,[0],[0]
Our results are compared to the baseline system without typo correction and Google Input Tool.,4.4 PTC Conversion with Typo Correction,[0],[0]
"Since sunpinyin does not have typo correction module and performs much poorer than our baseline system, we do not include it in the comparison.",4.4 PTC Conversion with Typo Correction,[0],[0]
"Though no direct proofs can be found to indicate if Google Input Tool has an independent typo correction component, its outputs show that such a component is unlikely available.
",4.4 PTC Conversion with Typo Correction,[0],[0]
Since Google Input Tool has to be accessed through a web interface and the network connection cannot be guaranteed.,4.4 PTC Conversion with Typo Correction,[0],[0]
"we only take a subset of 10K sentences of T to perform the experiments, and the results are shown in Table 3.
",4.4 PTC Conversion with Typo Correction,[0],[0]
"The scores reported in (Zheng et al., 2011a) are not listed in Table 4 since the data set is different.",4.4 PTC Conversion with Typo Correction,[0],[0]
"They reported a ConvER of 53.56%, which is given here for reference.
",4.4 PTC Conversion with Typo Correction,[0],[0]
"Additionally, to further inspect the robustness of ourmodel, performance with typo rate ranges from 0% to 5% is shown in Figure 12.",4.4 PTC Conversion with Typo Correction,[0],[0]
"Although the performance decreases while typo rate goes up, it is still quite satisfying around typo rate of 2% which is assumed to be the real world situation.",4.4 PTC Conversion with Typo Correction,[0],[0]
"In this paper, we have developed a joint graph model for pinyin-to-Chinese conversion with typo correction.",5 Conclusion,[0],[0]
This model finds a joint global optimal for typo correction and PTC conversion on the entire input pinyin sequence.,5 Conclusion,[0],[0]
The evaluation results show that our model outperforms both previous academic systems and existing commercial products.,5 Conclusion,[0],[0]
"In addition, the joint model is efficient enough for practical use.",5 Conclusion,[0],[0]
"It is very import for Chinese language processing with the aid of an efficient input method engine (IME), of which pinyinto-Chinese (PTC) conversion is the core part.",abstractText,[0],[0]
"Meanwhile, though typos are inevitable during user pinyin inputting, existing IMEs paid little attention to such big inconvenience.",abstractText,[0],[0]
"In this paper, motivated by a key equivalence of two decoding algorithms, we propose a joint graph model to globally optimize PTC and typo correction for IME.",abstractText,[0],[0]
The evaluation results show that the proposed method outperforms both existing academic and commercial IMEs.,abstractText,[0],[0]
A Joint Graph Model for Pinyin-to-Chinese Conversion with Typo Correction,title,[0],[0]
"Proceedings of NAACL-HLT 2013, pages 888–896, Atlanta, Georgia, 9–14 June 2013. c©2013 Association for Computational Linguistics
In a meeting, it is often desirable to extract keywords from each utterance as soon as it is spoken. Thus, this paper proposes a just-intime keyword extraction from meeting transcripts. The proposed method considers two major factors that make it different from keyword extraction from normal texts. The first factor is the temporal history of preceding utterances that grants higher importance to recent utterances than old ones, and the second is topic relevance that forces only the preceding utterances relevant to the current utterance to be considered in keyword extraction. Our experiments on two data sets in English and Korean show that the consideration of the factors results in performance improvement in keyword extraction from meeting transcripts.",text,[0],[0]
A meeting is generally accomplished by a number of participants and a wide range of subjects are discussed.,1 Introduction,[0],[0]
"Therefore, it would be helpful to meeting participants to provide them with some additional information related to the current subject.",1 Introduction,[0],[0]
"For instance, assume that a participant is discussing a specific topic with other participants at a meeting.",1 Introduction,[0],[0]
"The summary of previous meetings on the topic is then one of the most important resources for her discussion.
",1 Introduction,[0],[0]
"In order to provide information on a topic to participants, keywords should be first generated for the topic since keywords are often representatives of a topic.",1 Introduction,[0],[0]
"A number of techniques have been proposed
for automatic keyword extraction (Frank et al., 1999; Turney, 2000; Mihalcea and Tarau, 2004; Wan et al., 2007), and they are designed to extract keywords from a written document.",1 Introduction,[0],[0]
"However, they are not suitable for meeting transcripts.",1 Introduction,[0],[0]
"In a meeting, it is often desirable to extract keywords at the time at which a new utterance is made for just-in-time service of additional information.",1 Introduction,[0],[0]
"Otherwise, the extracted keywords become just the important words at the end of the meeting.
",1 Introduction,[0],[0]
Two key factors for just-in-time keyword extraction from meeting transcripts are time of preceding utterances and topic of current utterance.,1 Introduction,[0],[0]
"First, current utterance is affected by temporal history of preceding utterances.",1 Introduction,[0],[0]
"That is, when a new utterance is made it is likely to be related more closely with latest utterances than old ones.",1 Introduction,[0],[0]
"Second, the preceding utterances which carry similar topics to current utterance are more important than irrelevant utterances.",1 Introduction,[0],[0]
"Since a meeting consists of several topics, the utterances that have nothing to do with current utterance are inappropriate as a history of the current utterance.
",1 Introduction,[0],[0]
This paper proposes a graph-based keyword extraction to reflect these factors.,1 Introduction,[0],[0]
The proposed method represents an utterance as a graph of which nodes are candidate keywords.,1 Introduction,[0],[0]
The preceding utterances are also expressed as a history graph in which the weight of an edge is the temporal importance of the keywords connected by the edge.,1 Introduction,[0],[0]
"To reflect the temporal history of utterances, forgetting curve (Wozniak, 1999) is adopted in updating the weights of edges in the history graph.",1 Introduction,[0],[0]
"It expresses effectively not only the reciprocal relation between memory re-
888
tention and time, but also active recall that makes frequent words more consequential in keyword extraction.",1 Introduction,[0],[0]
"Then, a subgraph that is relevant to the current utterance is derived from the history graph, and used as an actual history of the current utterance.",1 Introduction,[0],[0]
"The keywords of the current utterance are extracted by TextRank (Mihalcea and Tarau, 2004) from the merged graph of the current utterance and the history graphs.
",1 Introduction,[0],[0]
"The proposed method is evaluated with two kinds of data sets: the National Assembly transcripts in Korean and the ICSI meeting corpus (Janin et al., 2003) in English.",1 Introduction,[0],[0]
"The experimental results show that it outperforms both the TFIDF framework (Frank et al., 1999; Liu et al., 2009) and the PageRank-based graph model (Wan et al., 2007).",1 Introduction,[0],[0]
One thing to note is that the proposed method improves even the supervised methods that do not reflect utterance time and topic relevance for the ICSI corpus.,1 Introduction,[0],[0]
"This proves that it is critical to consider time and content of utterances simultaneously in keyword extraction from meeting transcripts.
",1 Introduction,[0],[0]
The rest of the paper is organized as follows.,1 Introduction,[0],[0]
Section 2 reviews the related studies on keyword extraction.,1 Introduction,[0],[0]
"Section 3 explains the overall process of the proposed method, and Section 4 addresses its detailed description how to reflect meeting characteristics.",1 Introduction,[0],[0]
Experimental results are presented in Section 5.,1 Introduction,[0],[0]
"Finally, Section 6 draws some conclusions.",1 Introduction,[0],[0]
"Keyword extraction has been of interest for a long time in various fields such as information retrieval, document clustering, summarization, and so on.",2 Related Work,[0],[0]
"Thus, there have been many studies on automatic keyword extraction.",2 Related Work,[0],[0]
"The frequency-based keyword extraction with TFIDF weighting (Frank et al., 1999) and the graph-based keyword extraction (Mihalcea and Tarau, 2004) are two base models for this task.",2 Related Work,[0],[0]
"Many studies recently tried to extend them by incorporating specific information such as linguistic knowledge (Hulth, 2003), web-based resource (Turney, 2003), and semantic knowledge (Chen et al., 2010).",2 Related Work,[0],[0]
"As a result, they show good performance on written text.",2 Related Work,[0],[0]
"However, it is difficult to use them directly for spoken genres, since spoken genres have significantly different characteristics from written
text.
",2 Related Work,[0],[0]
There have been a few studies focused on keyword extraction from spoken genres.,2 Related Work,[0],[0]
"Among them, the extraction from meetings has attracted more concern, since the need for grasping important points of a meeting or an opinion of each participant has increased.",2 Related Work,[0],[0]
The studies on meetings focused on the exterior features of meeting dialogues such as unstructured and ill-formed sentences.,2 Related Work,[0],[0]
"Liu et al. (2009) used some knowledge sources such as Partof-Speech (POS) filtering, word clustering, and sentence salience to reflect dialogue features, and they found out that a simple TFIDF-based keyword extraction using these knowledge sources works reasonably well.",2 Related Work,[0],[0]
"They also extended their work by adopting various features such as decision making sentence features, speech-related features, and summary features that reflect meeting transcripts better (Liu et al., 2011).",2 Related Work,[0],[0]
Chen et al. (2010) extracted keywords from spoken course lectures.,2 Related Work,[0],[0]
"In this study, they considered prosodic information from HKT forced alignment and topics in a lecture generated by Probabilistic Latent Semantic Analysis (pLSA).",2 Related Work,[0],[0]
"These studies focused on the exterior characteristics of spoken genres, since they assumed that entire scripts are given in advance and then they extracted keywords that best describe the scripts.",2 Related Work,[0],[0]
"However, to the best of our knowledge, there is no previous study considered time of utterances which is an intrinsic element of spoken genres.
",2 Related Work,[0],[0]
The relevance between current utterance and preceding utterances is also a critical feature in keyword extraction from meeting transcripts.,2 Related Work,[0],[0]
The study that considers this relevance explicitly is CollabRank proposed by Wan and Xiao (2008).,2 Related Work,[0],[0]
This is collaborative approach to extract keywords in a document.,2 Related Work,[0],[0]
"In this study, it is assumed that a few neighbor documents close to a current document can help extract keywords.",2 Related Work,[0],[0]
"Therefore, they applied a clustering algorithm to a document set and then extracted words that are reinforced by the documents within a cluster.",2 Related Work,[0],[0]
"However, this method also does not consider the utterance time, since it is designed to extract keywords from normal documents.",2 Related Work,[0],[0]
"As a result, if it is applied to meeting transcripts, all preceding utterances would affect the current utterance uniformly, which leads to a poor performance.",2 Related Work,[0],[0]
Figure 1 depicts the overall process of extracting keywords from an utterance as soon as it is spoken.,3 Just-In-Time Keyword Extraction for a Meeting,[0],[0]
We represent all the components in a meeting as graphs.,3 Just-In-Time Keyword Extraction for a Meeting,[0],[0]
"This is because graphs are effective to express the relationship between words, and the graph operations that are required for keyword extraction are also efficiently performed.",3 Just-In-Time Keyword Extraction for a Meeting,[0],[0]
"That is, whenever an utterance is spoken, it is represented as a graph (G1) of which nodes are the potential keywords in the utterance.",3 Just-In-Time Keyword Extraction for a Meeting,[0],[0]
"This graph is named as current utterance graph.
",3 Just-In-Time Keyword Extraction for a Meeting,[0],[0]
The summary of all preceding utterances is also represented as a history graph (G2).,3 Just-In-Time Keyword Extraction for a Meeting,[0],[0]
We assume that only the preceding utterances that are directly related with the current utterance are important for extracting keywords from the current utterance.,3 Just-In-Time Keyword Extraction for a Meeting,[0],[0]
"Therefore, a subgraph of G2 that maximally covers the current utterance graph (G1) is extracted.",3 Just-In-Time Keyword Extraction for a Meeting,[0],[0]
This subgraph is labeled as G3 in Figure 1.,3 Just-In-Time Keyword Extraction for a Meeting,[0],[0]
"Then, the current utterance graph G1 is expanded by merging it and G3.",3 Just-In-Time Keyword Extraction for a Meeting,[0],[0]
"This expanded graph (G4) is a combined representation of the current and preceding utterances,
and then the keywords of the current utterance is extracted from this graph.",3 Just-In-Time Keyword Extraction for a Meeting,[0],[0]
"The keywords are so-called hub nodes of G4.
",3 Just-In-Time Keyword Extraction for a Meeting,[0],[0]
"After keywords are extracted from the current utterance, the current utterance becomes a part of the history graph for the next utterance.",3 Just-In-Time Keyword Extraction for a Meeting,[0],[0]
"For this, the extracted keywords are also represented as a graph (G5), and it is merged into the current history G2.",3 Just-In-Time Keyword Extraction for a Meeting,[0],[0]
This merged graph becomes a new history graph for the next utterance.,3 Just-In-Time Keyword Extraction for a Meeting,[0],[0]
"In merging two graphs, the weight of each edge in G2 is updated to reflect the temporal history.",3 Just-In-Time Keyword Extraction for a Meeting,[0],[0]
"If an edge is connecting two nouns from an old utterance, its weight becomes small.",3 Just-In-Time Keyword Extraction for a Meeting,[0],[0]
"In the same way, the weights for the edges from recent utterances get large.",3 Just-In-Time Keyword Extraction for a Meeting,[0],[0]
"The weights of the edges from G5 are 1, the largest possible value.",3 Just-In-Time Keyword Extraction for a Meeting,[0],[0]
Current utterance graph is a graph-representation of the current utterance.,4.1 Current Utterance Graph and History Graph,[0],[0]
"When current utterance consists of m words, we first extract the potential key-
words from the current utterance.",4.1 Current Utterance Graph and History Graph,[0],[0]
"Since all words within the current utterance are not keywords, some words are filtered out.",4.1 Current Utterance Graph and History Graph,[0],[0]
"For this filtering out, we follow the POS filtering approach proposed by Liu et al. (2009).",4.1 Current Utterance Graph and History Graph,[0],[0]
This approach filters out non-keywords using a stop-word list and POS tags of the words.,4.1 Current Utterance Graph and History Graph,[0],[0]
"Assume that n words remain after the filtering out, where n ≤",4.1 Current Utterance Graph and History Graph,[0],[0]
"m. These n words become the vertices of the current utterance graph.
",4.1 Current Utterance Graph and History Graph,[0],[0]
"Formally, the current utterance graph G1 = (V1, E1) is an undirected graph, where |V1| = n. E1 is a set of edges and each edge implies that the nouns connected by the edge co-occur within a window sizedW .",4.1 Current Utterance Graph and History Graph,[0],[0]
"For each e1ij ∈ E1 that connects nodes v1i and v 1 j , its weight is given by
w1ij =
{ 1 if v1i &v 1 j cooccur within the window,
0 otherwise.",4.1 Current Utterance Graph and History Graph,[0],[0]
"(1)
In a meeting, preceding utterances affect the current utterance.",4.1 Current Utterance Graph and History Graph,[0],[0]
We assume that only the keywords of preceding utterances are effective.,4.1 Current Utterance Graph and History Graph,[0],[0]
"Therefore, the history graph G2 = (V2, E2) is an undirected graph of keywords in the preceding utterances.",4.1 Current Utterance Graph and History Graph,[0],[0]
"That is, all vertices in V2 are keywords extracted from one or more previous utterances, and the edge between two keywords implies that they co-occurred at least once.",4.1 Current Utterance Graph and History Graph,[0],[0]
"Every edge in E2 has a weight that represents its temporal importance.
",4.1 Current Utterance Graph and History Graph,[0],[0]
The history graph is updated whenever keywords are extracted from a new utterance.,4.1 Current Utterance Graph and History Graph,[0],[0]
This is because the current utterance becomes a part of the history graph for the next utterance.,4.1 Current Utterance Graph and History Graph,[0],[0]
"As a history, old utterances are less important than recent ones.",4.1 Current Utterance Graph and History Graph,[0],[0]
"Thus, the temporal importance should decrease gradually according to the passage of time.",4.1 Current Utterance Graph and History Graph,[0],[0]
"In addition, the keywords which occur frequently at a meeting are more important than those mentioned just once or twice.",4.1 Current Utterance Graph and History Graph,[0],[0]
"Since the frequently-mentioned keywords are normally major topics of the meeting, their influence should last for a long time.
",4.1 Current Utterance Graph and History Graph,[0],[0]
"To model these characteristics, the forgetting curve (Wozniak, 1999) is adopted in updating the history graph.",4.1 Current Utterance Graph and History Graph,[0],[0]
It models the decline of memory retention in time.,4.1 Current Utterance Graph and History Graph,[0],[0]
Figure 2 shows a typical representation of the forgetting curve.,4.1 Current Utterance Graph and History Graph,[0],[0]
The X-axis of this figure is time and the Y-axis is memory retention.,4.1 Current Utterance Graph and History Graph,[0],[0]
"As shown in this figure, memory retention of new
information decreases gradually by the exponential nature of forgetting.",4.1 Current Utterance Graph and History Graph,[0],[0]
"However, whenever the information is repeated, it is recalled longer.",4.1 Current Utterance Graph and History Graph,[0],[0]
"This is formulated as
R = e− t S ,
where R is memory retention, t is time, and S is the relative strength of memory.
",4.1 Current Utterance Graph and History Graph,[0],[0]
"Based on the forgetting curve, the weight of each edge e2ij ∈ E2 between keywords v2i and v2j is set as
w2ij = exp − t f(vi,vj) , (2)
where t is the elapse of utterance time and f(vi, vj) is the frequency that vi and vj co-occur from the beginning of the meeting to now.",4.1 Current Utterance Graph and History Graph,[0],[0]
"According to this equation, the temporal importance between keywords decreases gradually as time passes by, but the keyword relations repeated during the meeting are remembered for a long time in the history graph.",4.1 Current Utterance Graph and History Graph,[0],[0]
All words within the history graph are not equally important in extracting keywords from the current utterance.,4.2 Keyword Extraction by Merging Current Utterance and History Graphs,[0],[0]
"In general, many participants discuss a wide range of topics in a meeting.",4.2 Keyword Extraction by Merging Current Utterance and History Graphs,[0],[0]
"Therefore, some preceding utterances that shares topics with the current utterance are more significant.",4.2 Keyword Extraction by Merging Current Utterance and History Graphs,[0],[0]
We assume that the preceding utterances that contain the nouns in the current utterance share topics with the current utterance.,4.2 Keyword Extraction by Merging Current Utterance and History Graphs,[0],[0]
"Thus, only a subgraph of G2 that contain words in G1 is relevant for keyword extraction from G1.
",4.2 Keyword Extraction by Merging Current Utterance and History Graphs,[0],[0]
