0,1,label2,summary_sentences
"Attempts to address these issues often involve task-specific approaches (Rothe and Schütze, 2015; Iacobacci et al., 2015; Pagliardini et al., 2018) or extensively tuning existing architectures such as skip-gram (Poliak et al., 2017; Herbelot and Baroni, 2017).
",1 Introduction,[0],[0]
"For computational efficiency it is desirable that methods be able to induce embeddings for only those features (e.g. bigrams or synsets) needed by the downstream task, rather than having to pay a computational prix fixe to learn embeddings for all features occurring frequently-enough in a corpus.",1 Introduction,[0],[0]
"We propose an alternative, novel solution via à la carte embedding, a method which bootstraps existing high-quality word vectors to learn a feature representation in the same semantic space via a linear transformation of the average word embeddings in the feature’s available contexts.",1 Introduction,[1.0],"['We propose an alternative, novel solution via à la carte embedding, a method which bootstraps existing high-quality word vectors to learn a feature representation in the same semantic space via a linear transformation of the average word embeddings in the feature’s available contexts.']"
"This can be seen as a shallow extension of the distributional hypothesis (Harris, 1954), “a feature is characterized by the words in its context,” rather than the computationally more-expensive “a feature is characterized by the features in its context” that has been used implicitly by past work (Rothe and Schütze, 2015; Logeswaran and Lee, 2018).
",1 Introduction,[1.0000000813907224],"['This can be seen as a shallow extension of the distributional hypothesis (Harris, 1954), “a feature is characterized by the words in its context,” rather than the computationally more-expensive “a feature is characterized by the features in its context” that has been used implicitly by past work (Rothe and Schütze, 2015; Logeswaran and Lee, 2018).']"
"Despite its elementary formulation, we demonstrate that the à la carte method can learn faithful word embeddings from single examples and feature vectors improving performance on important downstream tasks.",1 Introduction,[0],[0]
"Furthermore, the approach is resource-efficient, needing only pretrained embed-
dings of common words and the text corpus used to train them, and easy to implement and compute via vector addition and linear regression.",1 Introduction,[0],[0]
"After motivating and specifying the method, we illustrate these benefits through several applications:
• Embeddings of rare words: we introduce a dataset1 for few-shot learning of word vectors and achieve state-of-the-art results on the task of representing unseen words using only the definition (Herbelot and Baroni, 2017).
",1 Introduction,[0],[0]
"• Synset embeddings: we show how the method can be applied to learn more finegrained lexico-semantic representations and give evidence of its usefulness for standard word-sense disambiguation tasks (Navigli et al., 2013; Moro and Navigli, 2015).
",1 Introduction,[0],[0]
"• n-gram embeddings: we build seven million n-gram embeddings from large text corpora and use them to construct document embeddings that are competitive with unsupervised deep learning approaches when evaluated on linear text classification.
",1 Introduction,[0],[0]
Our experimental results2 clearly demonstrate the advantages of à la carte embedding.,1 Introduction,[0],[0]
"For word embeddings, the approach is an easy way to get a good vector for a new word from its definition or a few examples in context.",1 Introduction,[1.0],"['For word embeddings, the approach is an easy way to get a good vector for a new word from its definition or a few examples in context.']"
"For feature embeddings, the method can embed anything that does not need labeling (such as a bigram) or occurs in an annotated corpus (such as a word-sense).",1 Introduction,[1.0],"['For feature embeddings, the method can embed anything that does not need labeling (such as a bigram) or occurs in an annotated corpus (such as a word-sense).']"
"Our document embeddings, constructed directly using à la carte n-gram vectors, compete well with recent deep neural representations; this provides further evidence that simple methods can outperform modern deep learning on many NLP benchmarks (Arora et al., 2017; Mu and Viswanath, 2018; Arora et al., 2018a,b; Pagliardini et al., 2018).",1 Introduction,[1.0],"['Our document embeddings, constructed directly using à la carte n-gram vectors, compete well with recent deep neural representations; this provides further evidence that simple methods can outperform modern deep learning on many NLP benchmarks (Arora et al., 2017; Mu and Viswanath, 2018; Arora et al., 2018a,b; Pagliardini et al., 2018).']"
"Many methods have been proposed for extending word embeddings to semantic feature vectors, with the aim of using them as interpretable and structure-aware building blocks of NLP pipelines (Kiros et al., 2015; Yamada et al., 2016).",2 Related Work,[0],[0]
"Many exploit the structure and resources available for specific feature types, such as methods for sense, synsets, and lexemes (Rothe and Schütze, 2015; 1Dataset: nlp.cs.princeton.edu/CRW 2Code: www.github.com/NLPrinceton/ALaCarte
Iacobacci et al., 2015) that make heavy use of the graph structure of the Princeton WordNet (PWN) and similar resources (Fellbaum, 1998).",2 Related Work,[0],[0]
"By contrast, our work is more general, with incorporation of structure left as an open problem.",2 Related Work,[0],[0]
Embeddings of n-grams are of special interest because they do not need annotation or expert knowledge and can often be effective on downstream tasks.,2 Related Work,[0],[0]
"Their computation has been studied both explicitly (Yin and Schutze, 2014; Poliak et al., 2017) and as an implicit part of models for document embeddings (Hill et al., 2016; Pagliardini et al., 2018), which we use for comparison.",2 Related Work,[0],[0]
"Supervised and multitask learning of text embeddings has also been attempted (Wang et al., 2017; Wu et al., 2017).
",2 Related Work,[0],[0]
"A main motivation of our work is to learn good embeddings, of both words and features, from only one or a few examples.",2 Related Work,[0],[0]
"Efforts in this area can in many cases be split into contextual approaches (Lazaridou et al., 2017; Herbelot and Baroni, 2017) and morphological methods (Luong et al., 2013; Bojanowski et al., 2016; Pado et al., 2016).",2 Related Work,[0],[0]
"The current paper provides a more effective formulation for context-based embeddings, which are often simpler to implement, can improve with more context information, and do not require morphological annotation.",2 Related Work,[0],[0]
"Subword approaches, on the other hand, are often more compositional and flexible, and we leave the extension of our method to handle subword information to future work.",2 Related Work,[0],[0]
"Our work is also related to some methods in domain adaptation and multi-lingual correlation, such as that of Bollegala et al. (2014).
",2 Related Work,[0],[0]
"Mathematically, this work builds upon the linear algebraic understanding of modern word embeddings developed by Arora et al. (2018b) via an extension to the latent-variable embedding model of Arora et al. (2016).",2 Related Work,[0],[0]
"Although there have been several other applications of this model for natural language representation (Arora et al., 2017; Mu and Viswanath, 2018), ours is the first to provide a general approach for learning semantic features using corpus context.",2 Related Work,[0],[0]
"We begin by assuming a large text corpus CV consisting of contexts c of words w in a vocabulary V , with the contexts themselves being sequences of words in V (e.g. a fixed-size window around the word or feature).",3 Method Specification,[1.0],"['We begin by assuming a large text corpus CV consisting of contexts c of words w in a vocabulary V , with the contexts themselves being sequences of words in V (e.g. a fixed-size window around the word or feature).']"
"We further assume that we have trained word embeddings vw ∈ Rd on this collo-
cation information using a standard algorithm (e.g. word2vec / GloVe).",3 Method Specification,[0],[0]
Our goal is to construct a good embedding vf ∈ Rd of a text feature f given a set Cf of contexts it occurs in.,3 Method Specification,[1.0],['Our goal is to construct a good embedding vf ∈ Rd of a text feature f given a set Cf of contexts it occurs in.']
Both f and its contexts are assumed to arise via the same process that generates the large corpus CV .,3 Method Specification,[0],[0]
"In many settings below, the number |Cf | of contexts available for a feature f of interest is much smaller than the number |Cw| of contexts that the typical word w ∈ V occurs in.",3 Method Specification,[0],[0]
"This could be because the feature is rare (e.g. unseen words, n-grams) or due to limited human annotation (e.g. word senses, named entities).",3 Method Specification,[0],[0]
"A naive first approach to construct feature embeddings using context is additive, i.e. taking the average over all contexts of a feature f of the average word vector in each context:
vadditivef",3.1 A Linear Approach,[0],[0]
"= 1 |Cf | ∑ c∈Cf 1 |c| ∑ w∈c vw (1)
",3.1 A Linear Approach,[0],[0]
"This formulation reflects the training of commonly used embeddings, which employs additive composition to represent the context (Mikolov et al., 2013; Pennington et al., 2014).",3.1 A Linear Approach,[0],[0]
"It has proved successful in the bag-of-embeddings approach to sentence representation (Wieting et al., 2016; Arora et al., 2017), which can compete with LSTM representations, and has also been given theoretical justification as the maximum a posteriori (MAP) context vector under a generative model related to popular embedding objectives (Arora et al., 2016).",3.1 A Linear Approach,[1.0],"['It has proved successful in the bag-of-embeddings approach to sentence representation (Wieting et al., 2016; Arora et al., 2017), which can compete with LSTM representations, and has also been given theoretical justification as the maximum a posteriori (MAP) context vector under a generative model related to popular embedding objectives (Arora et al., 2016).']"
"Lazaridou et al. (2017) use this approach to learn embeddings of unknown word amalgamations, or chimeras, given a few context examples.
",3.1 A Linear Approach,[0],[0]
The additive approach has some limitations because the set of all word vectors is seen to share a few common directions.,3.1 A Linear Approach,[1.0],['The additive approach has some limitations because the set of all word vectors is seen to share a few common directions.']
"Simple addition amplifies the component in these directions, at the expense of less common directions that presumably carry more “signal.”",3.1 A Linear Approach,[0],[0]
"Stop-word removal can help to ameliorate this (Lazaridou et al., 2017; Herbelot and Baroni, 2017), but does not deal with the fact that content-words also have significant components in the same direction as these deleted words.",3.1 A Linear Approach,[0],[0]
"Another mathematical framework to address this lacuna is to remove the top one or top few principal components, either from the word embeddings themselves (Mu and Viswanath, 2018) or from their summations (Arora et al., 2017).",3.1 A Linear Approach,[0],[0]
"However, this approach is liable to either not remove
enough noise or cause too much information loss without careful tuning (c.f. Figure 1).
",3.1 A Linear Approach,[0],[0]
We now note that removing the component along the top few principal directions is tantamount to multiplying the additive composition by a fixed (but data-dependent) matrix.,3.1 A Linear Approach,[1.0],['We now note that removing the component along the top few principal directions is tantamount to multiplying the additive composition by a fixed (but data-dependent) matrix.']
"Thus a natural extension is to use an arbitrary linear transformation which will be learned from the data, and hence guaranteed to do at least as well as any of the above ideas.",3.1 A Linear Approach,[0],[0]
"Specifically, we find the transform that can best recover existing word vectors vw —which are presumed to be of high quality— from their additive context embeddings vadditivew .",3.1 A Linear Approach,[0],[0]
"This can be posed as the following linear regression problem
vw ≈ Avadditivew = A
( 1
|Cw| ∑ c∈Cw ∑ w′∈c vw′
) (2)
where A ∈ Rd×d is learned and we assume for simplicity that 1|c| is constant (e.g. if c has a fixed window size) and is thus subsumed by the transform.",3.1 A Linear Approach,[0],[0]
"After learning the matrix, we can embed any text feature in the same semantic space as the word embeddings via the following expression:
vf = Av additive f = A  1 |Cf | ∑ c∈Cf ∑ w∈c vw  (3) Note that A is fixed for a given corpus and set of pretrained word embeddings and so does not need to be re-computed to embed different features or feature types.
",3.1 A Linear Approach,[0.9999999477112833],"['After learning the matrix, we can embed any text feature in the same semantic space as the word embeddings via the following expression: vf = Av additive f = A  1 |Cf | ∑ c∈Cf ∑ w∈c vw  (3) Note that A is fixed for a given corpus and set of pretrained word embeddings and so does not need to be re-computed to embed different features or feature types.']"
Algorithm 1: The basic à la carte feature embedding induction method.,3.1 A Linear Approach,[1.0],['Algorithm 1: The basic à la carte feature embedding induction method.']
All contexts c consist of sequences of words drawn from the vocabulary V .,3.1 A Linear Approach,[0],[0]
"Data: vocabulary V , corpus CV , vectors vw ∈",3.1 A Linear Approach,[0],[0]
"Rd ∀ w ∈ V , feature f , corpus Cf of contexts of f Result:",3.1 A Linear Approach,[0],[0]
"feature embedding vf ∈ Rd
1 for w ∈ V do 2 let Cw ⊂ CV be the subcorpus of contexts of w 3 uw",3.1 A Linear Approach,[0],[0]
"← 1|Cw| ∑ c∈Cw ∑ w′∈c vw′ // compute each word’s context embedding uw 4 A← argmin A∈Rd×d ∑ w∈V ‖vw −Auw‖22 // compute context-to-feature transform A
5 uf ← 1|Cf | ∑ c∈Cf ∑ w∈c vw // compute feature’s context embedding uf 6 vf ← Auf // transform feature’s context embedding
Theoretical Justification: As shown by Arora et al. (2018b, Theorem 1), the approximation (2) holds exactly in expectation for some matrix A when contexts c ∈ C are generated by sampling a context vector vc ∈ Rd from a zero-mean Gaussian with fixed covariance and drawing |c| words using P(w|vc) ∝ exp〈vc,vw〉.",3.1 A Linear Approach,[0],[0]
The correctness (again in expectation) of (3) under this model is a direct extension.,3.1 A Linear Approach,[0],[0]
"Arora et al. (2018b) use large text corpora to verify their model assumptions, providing theoretical justification for our approach.",3.1 A Linear Approach,[0],[0]
"We observe that the best linear transform A can recover vectors with mean cosine similarity as high as 0.9 or more with the embeddings used to learn it, thus also justifying the method empirically.",3.1 A Linear Approach,[1.0],"['We observe that the best linear transform A can recover vectors with mean cosine similarity as high as 0.9 or more with the embeddings used to learn it, thus also justifying the method empirically.']"
"The basic à la carte method, as motivated in Section 3.1 and specified in Algorithm 1, is straightforward and parameter-free (the dimension d is assumed to have been chosen beforehand, along with the other parameters of the original word embeddings).",3.2 Practical Details,[0],[0]
In practice we may wish to modify the regression step in an attempt to learn a better transformation matrix A.,3.2 Practical Details,[1.0],['In practice we may wish to modify the regression step in an attempt to learn a better transformation matrix A.']
"However, the standard first approach of using `2-regularized (Ridge) regression instead of simple linear regression gives little benefit, even when we have more parameters than word embeddings (i.e. when d2 > |V|).
",3.2 Practical Details,[0],[0]
"A more useful modification is to weight each point by some non-decreasing function α of each word’s corpus count cw, i.e. to solve
A = argmin A∈Rd×d ∑ w∈V α(cw)‖vw −Auw‖22 (4)
where uw is the additive context embedding.",3.2 Practical Details,[1.0000000012754848],"['A more useful modification is to weight each point by some non-decreasing function α of each word’s corpus count cw, i.e. to solve A = argmin A∈Rd×d ∑ w∈V α(cw)‖vw −Auw‖22 (4) where uw is the additive context embedding.']"
"This reflects the fact that more frequent words likely
have better pretrained embeddings.",3.2 Practical Details,[0],[0]
In settings where |V| is large we find that a hard threshold (α(c) = 1c≥τ for some τ ≥ 1) is often useful.,3.2 Practical Details,[0],[0]
"When we do not have many embeddings we can still give more importance to words with better embeddings via a function such as α(c) = log c, which we use in Section 5.1.",3.2 Practical Details,[0],[0]
"While we can use our method to embed any type of text feature, its simplicity and effectiveness is rooted in word-level semantics: the approach assumes pre-existing high quality word embeddings and only considers collocations of features with words rather than with other features.",4 One-Shot and Few-Shot Learning of Word Embeddings,[0],[0]
"Thus to verify that our approach is reasonable we first check how it performs on word representation tasks, specifically those where word embeddings need to be learned from very few examples.",4 One-Shot and Few-Shot Learning of Word Embeddings,[0],[0]
"In this section we first investigate how representation quality varies with number of occurrences, as measured by performance on a similarity task that we introduce.",4 One-Shot and Few-Shot Learning of Word Embeddings,[0],[0]
"We then apply the à la carte method to two tasks measuring the ability to learn new or synthetic words from context, achieving strong results on the nonce task of Herbelot and Baroni (2017).",4 One-Shot and Few-Shot Learning of Word Embeddings,[0],[0]
"Performance on pairwise word similarity tasks is a standard way to evaluate word embeddings, with success measured via the Spearman correlation between a human score and the cosine similarity between word vectors.",4.1 Similarity Correlation vs. Sample Size,[0],[0]
An overview of widely used datasets is given by Faruqui and Dyer (2014).,4.1 Similarity Correlation vs. Sample Size,[0],[0]
"However, none of these datasets can be used directly to measure the effect of word frequency on
embedding quality, which would help us understand the data requirements of our approach.",4.1 Similarity Correlation vs. Sample Size,[0.999999966146097],"['However, none of these datasets can be used directly to measure the effect of word frequency on embedding quality, which would help us understand the data requirements of our approach.']"
"We address this issue by introducing the Contextual Rare Words (CRW) dataset, a subset of 562 pairs from the Rare Word (RW) dataset (Luong et al., 2013) supplemented by 255 sentences (contexts) for each rare word sampled from the Westbury Wikipedia Corpus (WWC) (Shaoul and Westbury, 2010).",4.1 Similarity Correlation vs. Sample Size,[0],[0]
In addition we provide a subset of the WWC from which all sentences containing these rare words have been removed.,4.1 Similarity Correlation vs. Sample Size,[0],[0]
"The task is to use embeddings trained on this subcorpus to induce rare word embeddings from the sampled contexts.
",4.1 Similarity Correlation vs. Sample Size,[0],[0]
"More specifically, the CRW dataset is constructed using all pairs from the RW dataset where the rarer word occurs between 512 and 10000 times in WWC; this yields a set of 455 distinct rare words.",4.1 Similarity Correlation vs. Sample Size,[0],[0]
"The lower bound ensures that we have a sufficient number of rare word contexts, while the upper bound ensures that a significant fraction of the sentences from the original WWC remain in the subcorpus we provide.",4.1 Similarity Correlation vs. Sample Size,[0],[0]
"In CRW, the first word in every pair is the more frequent word and occurs in the subcorpus, while the second word occurs in the 255 sampled contexts but not in the subcorpus.",4.1 Similarity Correlation vs. Sample Size,[1.0],"['In CRW, the first word in every pair is the more frequent word and occurs in the subcorpus, while the second word occurs in the 255 sampled contexts but not in the subcorpus.']"
"We provide word2vec embeddings trained on all words occurring at least 100 times in the WWC subcorpus; these vectors include those assigned to the first (non-rare) words in the evaluation pairs.
",4.1 Similarity Correlation vs. Sample Size,[0],[0]
"Evaluation: For every rare word the method under consideration is given eight disjoint subsets containing 1, 2, 4, . . .",4.1 Similarity Correlation vs. Sample Size,[0],[0]
", 128 example contexts.",4.1 Similarity Correlation vs. Sample Size,[0],[0]
"The method induces an embedding of the rare word for each subset, letting us track how the quality of rare word vectors changes with more examples.",4.1 Similarity Correlation vs. Sample Size,[0],[0]
"We report the Spearman ρ (as described above) at each sample size, averaged over 100 trials obtained by shuffling each rare word’s 255 contexts.
",4.1 Similarity Correlation vs. Sample Size,[0.9999999279279295],"['We report the Spearman ρ (as described above) at each sample size, averaged over 100 trials obtained by shuffling each rare word’s 255 contexts.']"
"The results in Figure 2 show that our à la carte method significantly outperforms the additive baseline (1) and its variants, including stopword removal, SIF-weighting (Arora et al., 2017), and top principal component removal (Mu and Viswanath, 2018).",4.1 Similarity Correlation vs. Sample Size,[0],[0]
"We find that combining SIFweighting and top component removal also beats these baselines, but still does worse than our method.",4.1 Similarity Correlation vs. Sample Size,[0],[0]
These experiments consolidate our intuitions from Section 3 that removing common components and frequent words is important and that learning a data-dependent transformation is an effective way to do this.,4.1 Similarity Correlation vs. Sample Size,[0],[0]
"However, if we train
word2vec embeddings from scratch on the subcorpus together with the sampled contexts we achieve a Spearman correlation of 0.45; this gap between word2vec and our method shows that there remains room for even better approaches for fewshot learning of word embeddings.",4.1 Similarity Correlation vs. Sample Size,[1.000000023798921],"['However, if we train word2vec embeddings from scratch on the subcorpus together with the sampled contexts we achieve a Spearman correlation of 0.45; this gap between word2vec and our method shows that there remains room for even better approaches for fewshot learning of word embeddings.']"
"We now evaluate our work directly on the tasks posed by Herbelot and Baroni (2017), who developed simple datasets and methods to “simulate the process by which a competent speaker encounters a new word in known contexts.”",4.2 Learning Embeddings of New Concepts: Nonces and Chimeras,[0],[0]
"The general goal will be to construct embeddings of new concepts in the same semantic space as a known embedding vocabulary using contextual information consisting of definitions or example sentences.
",4.2 Learning Embeddings of New Concepts: Nonces and Chimeras,[0],[0]
"Nonces: We first discuss the definitional nonce dataset made by the authors themselves, which has a test-set consisting of 300 single-word concepts and their definitions.",4.2 Learning Embeddings of New Concepts: Nonces and Chimeras,[0],[0]
The task of learning each concept’s embedding is simulated by removing or randomly re-initializing its vector and requiring the system to use the remaining embeddings and the definition to make a new vector that is close to the original.,4.2 Learning Embeddings of New Concepts: Nonces and Chimeras,[0],[0]
"Because the embeddings were constructed using data that includes these concepts, an implicit assumption is made that including or excluding one word does not greatly affect the se-
mantic space; this assumption is necessary in order to have a good target vector for the system to be evaluated against.
Using 259,376 word2vec embeddings trained on Wikipedia as the base vectors, Herbelot and Baroni (2017) heavily modify the skip-gram algorithm to successfully learn on one definition, creating the nonce2vec system.",4.2 Learning Embeddings of New Concepts: Nonces and Chimeras,[0],[0]
"The original skipgram algorithm and vadditivew are used as baselines, with performance measured as the mean reciprocal rank and median rank of the concept’s original vector among the nearest neighbors of the output.
",4.2 Learning Embeddings of New Concepts: Nonces and Chimeras,[0],[0]
"To compare directly to their approach, we use their word2vec embeddings along with contexts from the Wikipedia corpus to construct context vectors uw for all words w apart from the 300 nonces.",4.2 Learning Embeddings of New Concepts: Nonces and Chimeras,[0],[0]
"We then learn the à la carte transform A, weighting the data points in the regression (4) using a hard threshold of at least 1000 occurrences in Wikipedia.",4.2 Learning Embeddings of New Concepts: Nonces and Chimeras,[0],[0]
