0,1,label2,summary_sentences
"The hierarchies
5The deviation is not a theoretically motivated choice, and was chosen as a good empirical balance between reasonable parameter convergence (improved by smaller σ2) and good model log-probability (improved by larger σ2).
are headed by a normal distribution centered at 0, except for the ηbase hierarchy, which has a Cauchy(0, 2.5) distribution.6
",4 Model: An Extended WHAM Framework,[0],[0]
Message and reply length can affect alignment estimates; the WHAM model was developed in part to reduce this effect.,4 Model: An Extended WHAM Framework,[0],[0]
"As different employees had different email length distributions, we further accounted for length by dividing all replies into five quintile length bins, and treated each bin as separate observations for each employee.",4 Model: An Extended WHAM Framework,[0],[0]
"This design choice adds an additional control factor, but results were qualitatively similar without it.",4 Model: An Extended WHAM Framework,[0],[0]
"All of our analyses are based on parameter estimates from RStan fits of WHAM with 500 iterations over four chains.
",4 Model: An Extended WHAM Framework,[0],[0]
"While previous research on cultural fit has emphasized either its internalization (O’Reilly et al., 1991) or self-regulation (Goldberg et al., 2016) components, our extension to the WHAM framework helps disentangle them by estimating them as separate baseline and alignment trajectories.",4 Model: An Extended WHAM Framework,[0],[0]
"For example, we can distinguish between an archetypal individual who initially aligns to her colleagues and then internalizes this style of communication such that her baseline use also shifts and another archetypal person who aligns to her colleagues but does not change her baseline usage.",4 Model: An Extended WHAM Framework,[0],[0]
"The former exhibits high correspondence between internalization and self-regulation, whereas the latter demonstrates an ability to decouple them.",4 Model: An Extended WHAM Framework,[0],[0]
We perform three analyses on this data.,5 Analyses,[0],[0]
"First, we examine the qualitative behaviors of pronoun alignment and how they map onto employee outcomes in the data.",5 Analyses,[0],[0]
"Second, we show that these qualitative differences in early enculturation are meaningful, with alignment behaviors predicting employment outcome above chance.",5 Analyses,[0],[0]
"Lastly, we consider lexical versus referential levels of alignment and show that predictions are improved under the referential formulation, suggesting that alignment is not limited to low-level wordrepetition effects.
",5 Analyses,[0],[0]
"6As ηbase is the log-odds of each word in a reply being a part of the category c, it is expected to be substantially negative.",5 Analyses,[0],[0]
"For example, second person pronouns (you), are around 2% of the words in replies, approximately −4 in log-odds space.",5 Analyses,[0],[0]
We follow Gelman et al. (2008)’s recommendation of the Cauchy prior as appropriate for parameter estimation in logistic regression.,5 Analyses,[0],[0]
"We begin with descriptive analyses of the behavior of pronouns, which are likely to reflect incorporation into the company.",5.1 Analysis 1: Dynamic Qualitative Changes,[0],[0]
"In particular, we look at first-person singular (I), first-person plural (we), and second-person pronouns (you).",5.1 Analysis 1: Dynamic Qualitative Changes,[0],[0]
"We expect that increases in we usage will occur as the employee is integrated into the group, while I and you usage will decrease, and want to understand whether these changes manifest on baseline usage (i.e., internalization), alignment (i.e., self-regulation), or both.
",5.1 Analysis 1: Dynamic Qualitative Changes,[1.0000000120551955],"['We expect that increases in we usage will occur as the employee is integrated into the group, while I and you usage will decrease, and want to understand whether these changes manifest on baseline usage (i.e., internalization), alignment (i.e., self-regulation), or both.']"
"Design We divided each employee’s emails by calendar month, and separated them into the employee’s first six months, their last six months (if an employee left the company within the observation period), and the middle of their tenure.",5.1 Analysis 1: Dynamic Qualitative Changes,[1.0],"['Design We divided each employee’s emails by calendar month, and separated them into the employee’s first six months, their last six months (if an employee left the company within the observation period), and the middle of their tenure.']"
"Employees with fewer than twelve months at the company were excluded from this analysis, so that their first and last months did not overlap.
",5.1 Analysis 1: Dynamic Qualitative Changes,[0],[0]
We fit two WHAM models in this analysis.,5.1 Analysis 1: Dynamic Qualitative Changes,[0],[0]
"The first aggregated all employees, regardless of employment outcome, to minimize noise; the second separated them by outcome to analyze cultural fit differences.
",5.1 Analysis 1: Dynamic Qualitative Changes,[0],[0]
"Outcome-aggregated model We start with the aggregated behavior of all employees, shown in Figure 3.",5.1 Analysis 1: Dynamic Qualitative Changes,[0],[0]
"For baselines, we see decreased use of I
and you over the first six months, with we usage increasing over the same period, confirming the expected result that incorporating into the group is accompanied by more inclusive pronoun usage.",5.1 Analysis 1: Dynamic Qualitative Changes,[0],[0]
"Despite the baseline changes, alignment is fairly stable through the first six months.",5.1 Analysis 1: Dynamic Qualitative Changes,[0],[0]
"Alignment on first-person singular and second-person pronouns is lower than first-person plural pronouns, likely due to the fact that I or you have different referents when used by the two conversants, while both conversants could use we to refer to the same group.",5.1 Analysis 1: Dynamic Qualitative Changes,[0],[0]
We will consider this referential alignment in more detail in Analysis 3.,5.1 Analysis 1: Dynamic Qualitative Changes,[0],[0]
"Since employees with different outcomes have much different experiences over their last six months, we will not discuss them in aggregate, aside from noting the sharp decline in we alignment near the end of the employees’ tenures.
",5.1 Analysis 1: Dynamic Qualitative Changes,[0.9999999363645566],"['Since employees with different outcomes have much different experiences over their last six months, we will not discuss them in aggregate, aside from noting the sharp decline in we alignment near the end of the employees’ tenures.']"
"Outcome-separated model Figure 4 shows outcome-specific trajectories, with green lines showing involuntary leavers (i.e., those who are fired or downsized), blue showing voluntary leavers, and orange showing employees who remained at the company through the final month of the data.",5.1 Analysis 1: Dynamic Qualitative Changes,[0],[0]
"The use of I and you is similar to the aggregates in Figure 3, regardless of group.",5.1 Analysis 1: Dynamic Qualitative Changes,[0],[0]
"The last six months of I usage show an interesting difference, where involuntary leavers align more on I but retain a stable baseline while voluntary leavers retain a stable alignment but increase I overall, which is consistent with group separation.
",5.1 Analysis 1: Dynamic Qualitative Changes,[0],[0]
"The most compelling result we see here, though, is the changes in we usage by different groups of employees.",5.1 Analysis 1: Dynamic Qualitative Changes,[0],[0]
"Employees who eventually leave the
company involuntarily show signs of more selfregulation than internalization over the first six months, increasing their alignment while decreasing their baseline use (though they return to more similar levels as other employees later in their tenure).",5.1 Analysis 1: Dynamic Qualitative Changes,[0.9999999944508733],"['Employees who eventually leave the company involuntarily show signs of more selfregulation than internalization over the first six months, increasing their alignment while decreasing their baseline use (though they return to more similar levels as other employees later in their tenure).']"
"Employees who stay at the company, as well as those who later leave voluntarily, show signs of internalization, increasing their baseline usage to the company average, as well as adapting their alignment levels to the mean.",5.1 Analysis 1: Dynamic Qualitative Changes,[1.0],"['Employees who stay at the company, as well as those who later leave voluntarily, show signs of internalization, increasing their baseline usage to the company average, as well as adapting their alignment levels to the mean.']"
"This finding suggests that how quickly the employees internalize culturally-standard language use predicts their eventual employment outcome, even if they eventually end up near the average.",5.1 Analysis 1: Dynamic Qualitative Changes,[0],[0]
"This analysis tests the hypothesis that there are meaningful differences in employees’ initial enculturation, captured by alignment behaviors.",5.2 Analysis 2: Predicting Outcomes,[0],[0]
We examine the first six months of communications and attempt to predict whether the employee will leave the company.,5.2 Analysis 2: Predicting Outcomes,[0],[0]
"We find that, even with a simple classifier, alignment behaviors are predictive of employment outcome.
",5.2 Analysis 2: Predicting Outcomes,[0],[0]
Design We fit the WHAM model to only the first six months of email correspondence for all employees who had at least six months of email.,5.2 Analysis 2: Predicting Outcomes,[0],[0]
"The model estimated the initial level of baseline use (ηbase) and alignment (ηalign) for each employee, as well as the slope (α, β) for baseline and alignment over those first six months, over all 11 word categories mentioned in Section 3.
",5.2 Analysis 2: Predicting Outcomes,[0],[0]
"We then created logistic regression classifiers, using the parameter estimates to predict whether an employee would leave the company.",5.2 Analysis 2: Predicting Outcomes,[1.0],"['We then created logistic regression classifiers, using the parameter estimates to predict whether an employee would leave the company.']"
We fit separate classifiers for leaving voluntarily or involuntarily.,5.2 Analysis 2: Predicting Outcomes,[0],[0]
"Our results show that early alignment behaviors are better at identifying employees who will leave involuntarily than voluntarily, consistent with Srivastava et al.’s (forthcoming) findings that voluntary leavers are similar to stayers until late in their tenure.",5.2 Analysis 2: Predicting Outcomes,[1.0],"['Our results show that early alignment behaviors are better at identifying employees who will leave involuntarily than voluntarily, consistent with Srivastava et al.’s (forthcoming) findings that voluntary leavers are similar to stayers until late in their tenure.']"
"We fit separate classifiers using the alignment parameters and the baseline parameters to investigate their relative informativity.
",5.2 Analysis 2: Predicting Outcomes,[0],[0]
"For each model, we report the area under the curve (AUC).",5.2 Analysis 2: Predicting Outcomes,[0],[0]
"This value is estimated from the receiver operating characteristic (ROC) curve, which plots the true positive rate against the false positive rate over different classification thresholds.",5.2 Analysis 2: Predicting Outcomes,[0],[0]
An AUC of 0.5 represents chance performance.,5.2 Analysis 2: Predicting Outcomes,[0],[0]
"We use balanced, stratified cross-
validation to reduce AUC misestimation due to unbalanced outcome frequencies and high noise (Parker et al., 2007).
",5.2 Analysis 2: Predicting Outcomes,[0],[0]
"Results The left column of Figure 5 shows the results over 10 runs of 10-fold balanced logistic classifiers with stratified cross-validation in R. The alignment-based classifiers are both above chance at predicting that an employee will leave the company, whether involuntarily or voluntarily.",5.2 Analysis 2: Predicting Outcomes,[0],[0]
"The baseline-based classifiers perform worse, especially on voluntary leavers.",5.2 Analysis 2: Predicting Outcomes,[0],[0]
"This finding is consistent with the idea that voluntary leavers resemble stayers (who form the bulk of the employees) until late in their tenure when their cultural fit declines.
",5.2 Analysis 2: Predicting Outcomes,[0],[0]
"We fit a model using both alignment and baseline parameters, but this model yielded an AUC value below the alignment-only classifier.",5.2 Analysis 2: Predicting Outcomes,[0],[0]
"This suggests that where alignment and baseline behaviors are both predictive, they do not provide substantially different predictive power and lead to overfitting.",5.2 Analysis 2: Predicting Outcomes,[0],[0]
A more sophisticated classifier may overcome these challenges; our goal here was not to achieve maximal classification performance but to test whether alignment provided any useful information about employment outcomes.,5.2 Analysis 2: Predicting Outcomes,[0],[0]
"Our final analysis investigates the nature of linguistic alignment: specifically, whether there is an effect of referential alignment beyond that of the more commonly used lexical alignment.
",5.3 Analysis 3: Types of Alignment,[0],[0]
Testing this hypothesis requires a small change to the alignment calculations.,5.3 Analysis 3: Types of Alignment,[0],[0]
"Lexical alignment is based on the conditional probability of the replier using a word category c given that the preceding message used that same category c. For referential alignment, we examine the conditional probability of the replier using a word category cj given that the preceding message used the category ci, where ci and cj are likely to be referentially linked.",5.3 Analysis 3: Types of Alignment,[0],[0]
"We also consider cases where ci is likely to transition to cj throughout the course of the conversation, such as present tense verbs turning into past tense as the event being described recedes into the past.",5.3 Analysis 3: Types of Alignment,[0],[0]
"The pairs of categories that are likely to be referentially or transitionally linked are: (you, I); (we, I); (you, we); (past, present); (present, future); and (certainty, tentativity).",5.3 Analysis 3: Types of Alignment,[1.0],"['The pairs of categories that are likely to be referentially or transitionally linked are: (you, I); (we, I); (you, we); (past, present); (present, future); and (certainty, tentativity).']"
"We include both directions of these pairs, so this provides approximately the same number of predictor variables for both situa-
tions to maximize comparability (12 for the referential alignments, 11 for the lexical).",5.3 Analysis 3: Types of Alignment,[0],[0]
"This modification does not change the structure of the WHAM model, but rather changes its C and N counts by reclassifying replies between the baseline or alignment pathways.
",5.3 Analysis 3: Types of Alignment,[1.0000000483811244],"['This modification does not change the structure of the WHAM model, but rather changes its C and N counts by reclassifying replies between the baseline or alignment pathways.']"
Results Figure 5 plots the differences in predictive model performance using lexical versus referential alignment parameters.,5.3 Analysis 3: Types of Alignment,[1.0],['Results Figure 5 plots the differences in predictive model performance using lexical versus referential alignment parameters.']
We find that the semantic parameters provide more accurate classification than the lexical both for voluntarily and involuntarily-leaving employees.,5.3 Analysis 3: Types of Alignment,[1.0],['We find that the semantic parameters provide more accurate classification than the lexical both for voluntarily and involuntarily-leaving employees.']
"This suggests that while previous work looking at lexical alignment successfully captures social structure, referential alignment may reflect a deeper and more accurate representation of the social structure.",5.3 Analysis 3: Types of Alignment,[0],[0]
"It is unclear if this behavior holds in less formal situations or with weaker organizational structure and shared goals, but these results suggest that the traditional alignment approach of only measuring lexical alignment should be augmented with referential alignment measures for a more complete analysis.",5.3 Analysis 3: Types of Alignment,[0],[0]
"A key finding from this work is that pronoun usage behaviors in employees’ email communication are consistent with social integration into the group; employees use “I” pronouns less and
“we” pronouns more as they integrate.",6 Discussion,[0],[0]
"Furthermore, we see the importance of using an alignment measure such as WHAM for distinguishing the base rate and alignment usage of words.",6 Discussion,[0],[0]
"Employees who leave the company involuntarily show increased “we” usage through greater alignment, using “we” more when prompted by a colleague, but introducing it less of their own accord.",6 Discussion,[0],[0]
"This suggests that these employees do not feel fully integrated into the group, although they are willing to identify as a part of it when a more fully-integrated group member includes them, corresponding to self-regularization over internalization.",6 Discussion,[1.0],"['This suggests that these employees do not feel fully integrated into the group, although they are willing to identify as a part of it when a more fully-integrated group member includes them, corresponding to self-regularization over internalization.']"
"The fact that these alignment measures alone, without any job productivity or performance metrics, have some predictive capability for employees’ leaving the company suggests the potential for support or intervention programs to help highperforming but poorly-integrated employees integrate into the company better.
",6 Discussion,[0],[0]
"More generally, the prominence of pronominally-driven communication changes suggest that alignment analyses can provide insight into a range of social integration settings.",6 Discussion,[0],[0]
"This may be especially helpful in cases where there is great pressure to integrate smoothly, and people would be likely to adopt a self-regulating approach even if they do not internalize their group membership.",6 Discussion,[0],[0]
"Such settings not only include the high-stakes situation of keeping one’s job, but of transitioning from high school to college or moving to a new country or region.",6 Discussion,[0],[0]
Maximizing the chances for new members to become comfortable within a group is critical both for spreading useful aspects of the group’s existing culture to new members and for integrating new ideas from the new members’ knowledge and practices.,6 Discussion,[0],[0]
Alignment-based approaches can be a useful tool in separating effective interventions that cause internalization of the group dynamics from those that lead to more superficial self-regularization changes.,6 Discussion,[0],[0]
This paper described an effort to use directed linguistic alignment as a measure of cultural fit within an organization.,7 Conclusions,[0],[0]
"We adapted a hierarchical alignment model from previous work to estimate fit within corporate email communications, focusing on changes in language during employees’ entry to and exit from the company.",7 Conclusions,[1.0],"['We adapted a hierarchical alignment model from previous work to estimate fit within corporate email communications, focusing on changes in language during employees’ entry to and exit from the company.']"
"Our results
showed substantial changes in the use of pronouns, with pronoun patterns varying by employees’ outcomes within the company.",7 Conclusions,[0],[0]
The use of the firstperson plural “we” during an employee’s first six months is particularly instructive.,7 Conclusions,[0],[0]
"Whereas stayers exhibited increased baseline use, indicating internalization, those eventually departing involuntarily were on the one hand decreasingly likely to introduce “we” into conversation, but increasingly responsive to interlocutors’ use of the pronoun.",7 Conclusions,[0],[0]
"While not internalizing a shared identity with their peers, involuntarily departed employees were overly self-regulating in response to its invocation by others.
",7 Conclusions,[0],[0]
"Quantitatively, rates of usage and alignment in the first six months of employment carried information about whether employees left involuntarily, pointing towards fit within the company culture early on as an indicator of eventual employment outcomes.",7 Conclusions,[0],[0]
"Finally, we saw ways in which the application of alignment to cultural fit might help to refine ideas about alignment itself: preliminary analysis suggested that referential, rather than lexical, alignment was more predictive of employment outcomes.",7 Conclusions,[0],[0]
"More broadly, these results suggest ways that quantitative methods can be used to make precise application of concepts like “cultural fit” at scale.",7 Conclusions,[0],[0]
"This work was supported by NSF Grant #1456077; The Garwood Center for Corporate Innovation at the Haas School of Business, University of California, Berkeley; the Stanford Data Science Initiative; and the Stanford Graduate School of Business.",8 Acknowledgments,[0],[0]
Cultural fit is widely believed to affect the success of individuals and the groups to which they belong.,abstractText,[0],[0]
"Yet it remains an elusive, poorly measured construct.",abstractText,[0],[0]
Recent research draws on computational linguistics to measure cultural fit but overlooks asymmetries in cultural adaptation.,abstractText,[0],[0]
"By contrast, we develop a directed, dynamic measure of cultural fit based on linguistic alignment, which estimates the influence of one person’s word use on another’s and distinguishes between two enculturation mechanisms: internalization and selfregulation.",abstractText,[0],[0]
"We use this measure to trace employees’ enculturation trajectories over a large, multi-year corpus of corporate emails and find that patterns of alignment in the first six months of employment are predictive of individuals downstream outcomes, especially involuntary exit.",abstractText,[0],[0]
Further predictive analyses suggest referential alignment plays an overlooked role in linguistic alignment.,abstractText,[0],[0]
Alignment at Work: Using Language to Distinguish the Internalization and Self-Regulation Components of Cultural Fit in Organizations,title,[0],[0]
