0,1,label2,summary_sentences
"We presented an AMR parser which applies methods from supertagging and dependency parsing to map a string into a well-typed AM term, which it then evaluates into an AMR.",8 Conclusion,[0],[0]
"The AM term represents the compositional semantic structure of the AMR explicitly, allowing us to use standard treebased parsing techniques.
",8 Conclusion,[0],[0]
The projective parser currently computes the complete parse chart.,8 Conclusion,[0],[0]
"In future work, we will speed it up through the use of pruning techniques.",8 Conclusion,[0],[0]
We will also look into more principled methods for splitting the AMRs into elementary as-graphs to replace our hand-crafted heuristics.,8 Conclusion,[0],[0]
"In particular, advanced methods for alignments, as in Lyu and Titov (2018), seem promising.",8 Conclusion,[0],[0]
"Overcoming the need for heuristics also seems to be a crucial ingredient for applying our method to other semantic representations.
",8 Conclusion,[0],[0]
Acknowledgements We would like to thank the anonymous reviewers for their comments.,8 Conclusion,[0],[0]
"We thank Stefan Grünewald for his contribution to our PyTorch implementation, and want to acknowledge the inspiration obtained from Nguyen et al. (2017).",8 Conclusion,[0],[0]
We also extend our thanks to the organizers and participants of the Oslo CAS Meaning Construction workshop on Universal Dependencies.,8 Conclusion,[0],[0]
This work was supported by the DFG grant KO 2916/2-1 and a Macquarie University Research Excellence Scholarship for Jonas Groschwitz.,8 Conclusion,[0],[0]
We present a semantic parser for Abstract Meaning Representations which learns to parse strings into tree representations of the compositional structure of an AMR graph.,abstractText,[0],[0]
"This allows us to use standard neural techniques for supertagging and dependency tree parsing, constrained by a linguistically principled type system.",abstractText,[0],[0]
"We present two approximative decoding algorithms, which achieve state-of-the-art accuracy and outperform strong baselines.",abstractText,[0],[0]
AMR Dependency Parsing with a Typed Semantic Algebra,title,[0],[0]
"Proceedings of the 55th Annual Meeting of the Association for Computational Linguistics (Short Papers), pages 7–13 Vancouver, Canada, July 30 - August 4, 2017. c©2017 Association for Computational Linguistics
https://doi.org/10.18653/v1/P17-2002
AMR-to-text Generation with Synchronous Node Replacement Grammar
Linfeng Song, Xiaochang Peng, Yue Zhang, Zhiguo Wang and Daniel Gildea Department of Computer Science, University of Rochester, Rochester, NY 14627
IBM T.J. Watson Research Center, Yorktown Heights, NY 10598 Singapore University of Technology and Design
Abstract
This paper addresses the task of AMR-totext generation by leveraging synchronous node replacement grammar. During training, graph-to-string rules are learned using a heuristic extraction algorithm. At test time, a graph transducer is applied to collapse input AMRs and generate output sentences. Evaluated on a standard benchmark, our method gives the state-of-the-art result.",text,[0],[0]
"Abstract Meaning Representation (AMR) (Banarescu et al., 2013) is a semantic formalism encoding the meaning of a sentence as a rooted, directed graph.",1 Introduction,[0],[0]
"AMR uses a graph to represent meaning, where nodes (such as “boy”, “want-01”) represent concepts, and edges (such as “ARG0”, “ARG1”) represent relations between concepts.",1 Introduction,[0],[0]
"Encoding many semantic phenomena into a graph structure, AMR is useful for NLP tasks such as machine translation (Jones et al., 2012; Tamchyna et al., 2015), question answering (Mitra and Baral, 2015), summarization (Takase et al., 2016) and event detection (Li et al., 2015).
",1 Introduction,[0],[0]
"AMR-to-text generation is challenging as function words and syntactic structures are abstracted away, making an AMR graph correspond to multiple realizations.",1 Introduction,[0],[0]
"Despite much literature so far on text-to-AMR parsing (Flanigan et al., 2014; Wang et al., 2015; Peng et al., 2015; Vanderwende et al., 2015; Pust et al., 2015; Artzi et al., 2015; Groschwitz et al., 2015; Goodman et al., 2016; Zhou et al., 2016; Peng et al., 2017), there has been little work on AMR-to-text generation (Flanigan et al., 2016; Song et al., 2016; Pourdamghani et al., 2016).
",1 Introduction,[0],[0]
"Flanigan et al. (2016) transform a given AMR graph into a spanning tree, before translating it to a sentence using a tree-to-string transducer.",1 Introduction,[0],[0]
"Their method leverages existing machine translation techniques, capturing hierarchical correspondences between the spanning tree and the surface string.",1 Introduction,[0],[0]
"However, it suffers from error propagation since the output is constrained given a spanning tree due to the projective correspondence between them.",1 Introduction,[0],[0]
Information loss in the graph-to-tree transformation step cannot be recovered.,1 Introduction,[0],[0]
Song et al. (2016) directly generate sentences using graphfragment-to-string rules.,1 Introduction,[0],[0]
"They cast the task of finding a sequence of disjoint rules to transduce an AMR graph into a sentence as a traveling salesman problem, using local features and a language model to rank candidate sentences.",1 Introduction,[0],[0]
"However, their method does not learn hierarchical structural correspondences between AMR graphs and strings.
",1 Introduction,[0],[0]
We propose to leverage the advantages of hierarchical rules without suffering from graph-to-tree errors by directly learning graph-to-string rules.,1 Introduction,[0],[0]
"As shown in Figure 1, we learn a synchronous node replacement grammar (NRG) from a corpus of aligned AMR and sentence pairs.",1 Introduction,[0],[0]
"At test time, we apply a graph transducer to collapse input
7
AMR graphs and generate output strings according to the learned grammar.",1 Introduction,[0],[0]
"Our system makes use of a log-linear model with real-valued features, tuned using MERT (Och, 2003), and beam search decoding.",1 Introduction,[0],[0]
"It gives a BLEU score of 25.62 on LDC2015E86, which is the state-of-the-art on this dataset.",1 Introduction,[0],[0]
"A synchronous node replacement grammar (NRG) is a rewriting formalism: G = 〈N,Σ,∆, P, S〉, where N is a finite set of nonterminals, Σ and ∆ are finite sets of terminal symbols for the source and target sides, respectively.",2.1 Grammar Definition,[0],[0]
"S ∈ N is the start symbol, and P is a finite set of productions.",2.1 Grammar Definition,[0],[0]
"Each instance of P takes the form Xi → (〈F,E〉,∼), where Xi ∈ N is a nonterminal node, F is a rooted, connected AMR fragment with edge labels over Σ and node labels over N ∪ Σ, E is a corresponding target string over N ∪∆ and ∼ denotes the alignment of nonterminal symbols between F and E. A classic NRG (Engelfriet and Rozenberg, 1997, Chapter 1) also defines C, which is an embedding mechanism defining how F is connected to the rest of the graph when replacing Xi with F on the graph.",2.1 Grammar Definition,[0],[0]
Here we omit defining C and allow arbitrary connections.1,2.1 Grammar Definition,[0],[0]
"Following Chiang
1This may over generate, but does not affect our case, as in our bottom-up decoding procedure (section 3) when F is replaced with Xi, nodes previously connected to F are reconnected to Xi
Data:",2.1 Grammar Definition,[0],[0]
"training corpus C Result: rule instances R
1 R←",2.1 Grammar Definition,[0],[0]
"[]; 2 for (Sent,AMR,∼) in C do 3 Rcur ← FRAGMENTEXTRACT(Sent,AMR,∼); 4 for ri in Rcur do 5 R.APPEND(ri) ; 6 for rj in Rcur/{ri} do 7 if ri.CONTAINS(rj) then 8 rij ← ri.COLLAPSE(rj); 9 R.APPEND(rij) ;
10 end 11 end 12 end 13 end
Algorithm 1: Rule extraction
(2005), we use only one nonterminal X in addition to S, and use subscripts to distinguish different non-terminal instances.
",2.1 Grammar Definition,[0],[0]
Figure 2 shows an example derivation process for the sentence “the boy wants to go” given the rule set in Table 1.,2.1 Grammar Definition,[0],[0]
"Given the start symbol S, which is first replaced with X1, rule (c) is applied to generate “X2 to go” and its AMR counterpart.",2.1 Grammar Definition,[0],[0]
Then rule (b) is used to generate “X3 wants” and its AMR counterpart from X2.,2.1 Grammar Definition,[0],[0]
"Finally, rule (a) is used to generate “the boy” and its AMR counterpart from X3.",2.1 Grammar Definition,[0],[0]
"Our graph-to-string rules are inspired by synchronous grammars for machine translation (Wu, 1997; Yamada and Knight, 2002; Gildea, 2003; Chiang, 2005; Huang et al., 2006; Liu et al., 2006; Shen et al., 2008; Xie et al., 2011; Meng et al., 2013).",2.1 Grammar Definition,[0],[0]
"There are three types of rules in our system, namely induced rules, concept rules and graph glue rules.",2.2 Induced Rules,[0],[0]
"Here we first introduce induced rules, which are obtained by a two-step procedure on a training corpus.",2.2 Induced Rules,[0],[0]
"Shown in Algorithm 1, the first step is to extract a set of initial rules from training 〈sentence, AMR, ∼〉2 pairs (Line 2) using the phrase-to-graph-fragment extraction algorithm of Peng et al. (2015) (Line 3).",2.2 Induced Rules,[0],[0]
"Here an initial rule
2∼ denotes alignment between words and AMR labels.
",2.2 Induced Rules,[0],[0]
"contains only terminal symbols in both F and E. As a next step, we match between pairs of initial rules ri and rj , and generate rij by collapsing ri with rj , if ri contains rj (Line 6-8).",2.2 Induced Rules,[0],[0]
"Here ri contains rj , if rj .F is a subgraph of ri.F and rj .E is a sub-phrase of ri.",2.2 Induced Rules,[0],[0]
E.,2.2 Induced Rules,[0],[0]
"When collapsing ri with rj , we replace the corresponding subgraph in ri.F with a new non-terminal node, and the sub-phrase in ri.E with the same non-terminal.",2.2 Induced Rules,[0],[0]
"For example, we obtain rule (b) by collapsing (d) with (a) in Table 1.",2.2 Induced Rules,[0],[0]
"All initial and generated rules are stored in a rule list R (Lines 5 and 9), which will be further normalized to obtain the final induced rule set.",2.2 Induced Rules,[0],[0]
"In addition to induced rules, we adopt concept rules (Song et al., 2016) and graph glue rules to ensure existence of derivations.",2.3 Concept Rules and Glue Rules,[0],[0]
"For a concept rule, F is a single node in the input AMR graph, and E is a morphological string of the node concept.",2.3 Concept Rules and Glue Rules,[0],[0]
A concept rule is used in case no induced rule can cover the node.,2.3 Concept Rules and Glue Rules,[0],[0]
We refer to the verbalization list3 and AMR guidelines4 for creating more complex concept rules.,2.3 Concept Rules and Glue Rules,[0],[0]
"For example, one concept rule created from the verbalization list is “(k / keep-01 :ARG1 (p / peace)) |||",2.3 Concept Rules and Glue Rules,[0],[0]
"peacekeeping”.
",2.3 Concept Rules and Glue Rules,[0],[0]
"Inspired by Chiang (2005), we define graph glue rules to concatenate non-terminal nodes connected with an edge, when no induced rules can be applied.",2.3 Concept Rules and Glue Rules,[0],[0]
Three glue rules are defined for each type of edge label.,2.3 Concept Rules and Glue Rules,[0],[0]
"Taking the edge label “ARG0” as an example, we create the following glue rules:
ID.",2.3 Concept Rules and Glue Rules,[0],[0]
F E r1 (X1 / #X1# :ARG0 (X2 / #X2#)),2.3 Concept Rules and Glue Rules,[0],[0]
#X1# #X2# r2,2.3 Concept Rules and Glue Rules,[0],[0]
(X1 / #X1# :ARG0 (X2 / #X2#)),2.3 Concept Rules and Glue Rules,[0],[0]
"#X2# #X1# r3 (X1 / #X1# :ARG0 X1) #X1#
where for both r1 and r2, F contains two nonterminal nodes with a directed edge connecting them, and E is the concatenation the two nonterminals in either the monotonic or the inverse order.",2.3 Concept Rules and Glue Rules,[0],[0]
"For r3, F contains one non-terminal node with a self-pointing edge, and E is the nonterminal.",2.3 Concept Rules and Glue Rules,[0],[0]
"With concept rules and glue rules in our final rule set, it is easily guaranteed that there are legal derivations for any input AMR graph.",2.3 Concept Rules and Glue Rules,[0],[0]
We adopt a log-linear model for scoring search hypotheses.,3 Model,[0],[0]
"Given an input AMR graph, we find
3http://amr.isi.edu/download/lists/verbalization-listv1.06.txt
4https://github.com/amrisi/amr-guidelines
the highest scored derivation t∗ from all possible derivations t:
t∗ = argmax t
exp ∑
i
wifi(g, t), (1)
where g denotes the input AMR, fi(·, ·) and wi represent a feature and the corresponding weight, respectively.",3 Model,[0],[0]
"The feature set that we adopt includes phrase-to-graph and graph-to-phrase translation probabilities and their corresponding lexicalized translation probabilities (section 3.1), language model score, word count, rule count, reordering model score (section 3.2) and moving distance (section 3.3).",3 Model,[0],[0]
"The language model score, word count and phrase count features are adopted from SMT (Koehn et al., 2003; Chiang, 2005).
",3 Model,[0],[0]
We perform bottom-up search to transduce input AMRs to surface strings.,3 Model,[0],[0]
"Each hypothesis contains the current AMR graph, translations of collapsed subgraphs, the feature vector and the current model score.",3 Model,[0],[0]
"Beam search is adopted, where hypotheses with the same number of collapsed edges and nodes are put into the same beam.",3 Model,[0],[0]
Production rules serve as a basis for scoring hypotheses.,3.1 Translation Probabilities,[0],[0]
We associate each synchronous NRG rule n →,3.1 Translation Probabilities,[0],[0]
"(〈F,E〉,∼) with a set of probabilities.",3.1 Translation Probabilities,[0],[0]
"First, phrase-to-fragment translation probabilities are defined based on maximum likelihood estimation (MLE), as shown in Equation 2, where c〈F,E〉 is the fractional count of 〈F,E〉.
p(F |E) = c〈F,E〉∑ F ′ c〈F ′,E〉
(2)
",3.1 Translation Probabilities,[0],[0]
"In addition, lexicalized translation probabilities are defined as:
pw(F |E) = ∏
l∈F
∑ w∈E p(l|w) (3)
",3.1 Translation Probabilities,[0],[0]
"Here l is a label (including both edge labels such as “ARG0” and concept labels such as “want-01”) in the AMR fragment F , and w is a word in the phrase E. Equation 3 can be regarded as a “soft” version of the lexicalized translation probabilities adopted by SMT, which picks the alignment yielding the maximum lexicalized probability for each translation rule.",3.1 Translation Probabilities,[0],[0]
"In addition to p(F |E) and pw(F |E), we use features in the reverse direction, namely p(E|F ) and pw(E|F ), the definitions of which are omitted as they are consistent with
Equations 2 and 3, respectively.",3.1 Translation Probabilities,[0],[0]
The probabilities associated with concept rules and glue rules are manually set to 0.0001.,3.1 Translation Probabilities,[0],[0]
"Although the word order is defined for induced rules, it is not the case for glue rules.",3.2 Reordering Model,[0],[0]
We learn a reordering model that helps to decide whether the translations of the nodes should be monotonic or inverse given the directed connecting edge label.,3.2 Reordering Model,[0],[0]
"The probabilistic model using smoothed counts is defined as:
p(M |h, l, t) = 1.0 + ∑ h ∑ t c(h, l, t,M)
2.0 + ∑ o∈{M,I} ∑ h ∑ t c(h, l, t, o) (4)
c(h, l, t,M) is the count of monotonic translations of head h and tail t, connected by edge l.",3.2 Reordering Model,[0],[0]
"The moving distance feature captures the distances between the subgraph roots of two consecutive rule matches in the decoding process, which controls a bias towards collapsing nearby subgraphs consecutively.",3.3 Moving Distance,[0],[0]
"We use LDC2015E86 as our experimental dataset, which contains 16833 training, 1368 dev and 1371 test instances.",4.1 Setup,[0],[0]
"Each instance contains a sentence, an AMR graph and the alignment generated by a heuristic aligner.",4.1 Setup,[0],[0]
"Rules are extracted from the training data, and model parameters are tuned on the dev set.",4.1 Setup,[0],[0]
"For tuning and testing, we filter out sentences with more than 30 words, resulting in 1103 dev instances and 1055 test instances.",4.1 Setup,[0],[0]
"We train a 4-gram language model (LM) on gigaword (LDC2011T07), and use BLEU (Papineni et al., 2002) as the evaluation metric.",4.1 Setup,[0],[0]
"MERT is used (Och, 2003) to tune model parameters on k-best outputs on the devset, where k is set 50.
",4.1 Setup,[0],[0]
"We investigate the effectiveness of rules and features by ablation tests: “NoInducedRule” does not adopt induced rules, “NoConceptRule” does not adopt concept rules, “NoMovingDistance” does not adopt the moving distance feature, and “NoReorderModel” disables the reordering model.",4.1 Setup,[0],[0]
"Given an AMR graph, if NoConceptRule cannot produce a legal derivation, we concatenate
existing translation fragments into a final translation, and if a subgraph can not be translated, the empty string is used as the output.",4.1 Setup,[0],[0]
"We also compare our method with previous works, in particular JAMR-gen (Flanigan et al., 2016) and TSP-gen (Song et al., 2016), on the same dataset.",4.1 Setup,[0],[0]
The results are shown in Table 2.,4.2 Main results,[0],[0]
"First, All outperforms all baselines.",4.2 Main results,[0],[0]
"NoInducedRule leads to the greatest performance drop compared with All, demonstrating that induced rules play a very important role in our system.",4.2 Main results,[0],[0]
"On the other hand, NoConceptRule does not lead to much performance drop.",4.2 Main results,[0],[0]
This observation is consistent with the observation of Song et al. (2016) for their TSP-based system.,4.2 Main results,[0],[0]
"NoMovingDistance leads to a significant performance drop, empirically verifying the fact that the translations of nearby subgraphs are also close.",4.2 Main results,[0],[0]
"Finally, NoReorderingModel does not affect the performance significantly, which can be because the most important reordering patterns are already covered by the hierarchical induced rules.",4.2 Main results,[0],[0]
"Compared with TSP-gen and JAMR-gen, our final model All improves the BLEU from 22.44 and 23.00 to 25.62, showing the advantage of our model.",4.2 Main results,[0],[0]
"To our knowledge, this is the best result reported so far on the task.",4.2 Main results,[0],[0]
We have shown the effectiveness of our synchronous node replacement grammar (SNRG) on the AMR-to-text generation task.,4.3 Grammar analysis,[0],[0]
"Here we further analyze our grammar as it is relatively less studied than the hyperedge replacement grammar (HRG) (Drewes et al., 1997).
",4.3 Grammar analysis,[0],[0]
"Statistics on the whole rule set We first categorize our rule set by the number of terminals and nonterminals in the AMR fragment F , and show the percentages of each type in Figure 3.",4.3 Grammar analysis,[0],[0]
"Each rule contains at most 1 nonterminal, as we collapse each initial rule only once.",4.3 Grammar analysis,[0],[0]
"First
of all, the percentage of rules containing nonterminals are much more than those without nonterminals, as we collapse each pair of initial rules (in Algorithm 1) and the results can be quadratic the number of initial rules.",4.3 Grammar analysis,[0],[0]
"In addition, most rules are small containing 1 to 3 terminals, meaning that they represent small pieces of meaning and are easier to matched on a new AMR graph.",4.3 Grammar analysis,[0],[0]
"Finally, there are a few large rules, which represent complex meaning.
",4.3 Grammar analysis,[0],[0]
"Statistics on the rules used for decoding In addition, we collect the rules that our well-tuned system used for generating the 1-best output on the testset, and categorize them into 3 types: (1) glue rules, (2) nonterminal rules, which are not glue rules but contain nonterminals on the righthand side and (3) terminal rules, whose right-hand side only contain terminals.",4.3 Grammar analysis,[0],[0]
"Over the rules used on the 1-best result, more than 30% are non-terminal rules, showing that the induced rules play an important role.",4.3 Grammar analysis,[0],[0]
"On the other hand, 30% are glue rules.",4.3 Grammar analysis,[0],[0]
"The reason is that the data sparsity for graph grammars is more severe than string-based grammars (such as CFG), as the graph structures are more complex than strings.",4.3 Grammar analysis,[0],[0]
"Finally, terminal rules take the largest percentage, while most are induced rules, but not concept rules.
",4.3 Grammar analysis,[0],[0]
"Rule examples Finally, we show some rules in Table 4, where F and E are the right-hand-side AMR fragment and phrase, respectively.",4.3 Grammar analysis,[0],[0]
"For the first rule, the root of F is a verb (“give-01”) whose subject is a nonterminal and object is a AMR fragment “(p / person :ARG0-of (u / use-01))”, which means “user”.",4.3 Grammar analysis,[0],[0]
So it is easy to see that the corresponding phrase E conveys the same meaning.,4.3 Grammar analysis,[0],[0]
"For the second rule, “(s3 / stay-01 :accompanier (i / i))” means “stay
with me”, which is also covered by its phrase.",4.3 Grammar analysis,[0],[0]
"Finally, we show an example in Table 5, where the top is the input AMR graph, and the bottom is the generation result.",4.4 Generation example,[0],[0]
"Generally, most of the meaning of the input AMR are correctly translated, such as “:example”, which means “such as”, and “thing”, which is an abstract concept and should not be translated, while there are a few errors, such as “that” in the result should be “what”, and there should be an “in” between “tmt” and “fairfax”.",4.4 Generation example,[0],[0]
"We showed that synchronous node replacement grammar is useful for AMR-to-text generation by developing a system that learns a synchronous NRG in the training time, and applies a graph transducer to collapse input AMR graphs and generate output strings according to the learned grammar at test time.",5 Conclusion,[0],[0]
"Our method performs better than the previous systems, empirically proving the advantages of our graph-to-string rules.",5 Conclusion,[0],[0]
This work was funded by a Google Faculty Research Award.,Acknowledgement,[0],[0]
Yue Zhang is funded by NSFC61572245 and T2MOE201301 from Singapore Ministry of Education.,Acknowledgement,[0],[0]
This paper addresses the task of AMR-totext generation by leveraging synchronous node replacement grammar.,abstractText,[0],[0]
"During training, graph-to-string rules are learned using a heuristic extraction algorithm.",abstractText,[0],[0]
"At test time, a graph transducer is applied to collapse input AMRs and generate output sentences.",abstractText,[0],[0]
"Evaluated on a standard benchmark, our method gives the state-of-the-art result.",abstractText,[0],[0]
AMR-to-text Generation with Synchronous Node Replacement Grammar,title,[0],[0]
"We consider the design of adaptive, nonparametric statistical tests of dependence: that is, tests of whether a joint distribution Pxy factorizes into the product of marginals PxPy with the null hypothesis that H0 : X and Y are independent.",1. Introduction,[0],[0]
"While classical tests of dependence, such as Pearson’s correlation and Kendall’s τ , are able to detect monotonic relations between univariate variables, more modern tests can address complex interactions, for instance changes in variance of X with the value of Y .",1. Introduction,[0],[0]
Key to many recent tests is to examine covariance or correlation between data features.,1. Introduction,[0],[0]
"These interactions become significantly harder to detect, and the features are more difficult to design, when the data reside in high dimensions.
",1. Introduction,[0],[0]
Zoltán Szabó’s ORCID ID: 0000-0001-6183-7603.,1. Introduction,[0],[0]
Arthur Gretton’s ORCID ID: 0000-0003-3169-7624.,1. Introduction,[0],[0]
"1Gatsby Unit, University College London, UK. 2CMAP, École Polytechnique, France.",1. Introduction,[0],[0]
"Correspondence to: Wittawat Jitkrittum <wittawatj@gmail.com>.
",1. Introduction,[0],[0]
"Proceedings of the 34 th International Conference on Machine Learning, Sydney, Australia, PMLR 70, 2017.",1. Introduction,[0],[0]
"Copyright 2017 by the author(s).
",1. Introduction,[0],[0]
"A basic nonlinear dependence measure is the HilbertSchmidt Independence Criterion (HSIC), which is the Hilbert-Schmidt norm of the covariance operator between feature mappings of the random variables (Gretton et al., 2005; 2008).",1. Introduction,[0],[0]
Each random variable X and Y is mapped to a respective reproducing kernel Hilbert space Hk and Hl.,1. Introduction,[0],[0]
"For sufficiently rich mappings, the covariance operator norm is zero if and only if the variables are independent.",1. Introduction,[0],[0]
"A second basic nonlinear dependence measure is the smoothed difference between the characteristic function of the joint distribution, and that of the product of marginals.",1. Introduction,[0],[0]
"When a particular smoothing function is used, the statistic corresponds to the covariance between distances ofX and Y variable pairs (Feuerverger, 1993; Székely et al., 2007; Székely & Rizzo, 2009), yielding a simple test statistic based on pairwise distances.",1. Introduction,[0],[0]
It has been shown by Sejdinovic et al. (2013) that the distance covariance (and its generalization to semi-metrics) is an instance of HSIC for an appropriate choice of kernels.,1. Introduction,[0],[0]
