0,1,label2,summary_sentences
"The resulting 32- dimensional features are concatenated as the input
8We also kept the vectors of the top 400k words trained on Wikipedia and English Gigaword for a broader coverage of unseen words.
to a fixed-dimensional softmax classifier for transition decisions.
",A Model and Training Details,[0],[0]
"For arc-swift, we featurize for each arcinducing transition with the same composition function in Equation (1) with vhead of the head token and vdep of the dependent token of the arc to be induced.",A Model and Training Details,[0],[0]
"For Shift, we simply combine vhead and vdep of the leftmost token in the buffer with the biaffine combination, and obtain its score by computing the inner-product of the feature and a vector.",A Model and Training Details,[0],[0]
"At each step, the scores of all feasible transitions are normalized to a probability distribution by a softmax function.
",A Model and Training Details,[0],[0]
"In all of our experiments, the parsers are trained to maximize the log likelihood of the desired transition sequence, along with the tagger being trained to maximize the log likelihood of the correct POS tag for each token.
",A Model and Training Details,[0],[0]
"To train the parsers, we use the ADAM optimizer (Kingma and Ba, 2014), with β2 = 0.9, an initial learning rate of 0.001, and minibatches of size 32 sentences.",A Model and Training Details,[0],[0]
Parsers are trained for 10 passes through the dataset on PTB-SD.,A Model and Training Details,[0],[0]
We also find that annealing the learning rate by a factor of 0.5 for every pass after the 5th helped improve performance.,A Model and Training Details,[0],[0]
"For EN-UD, we train for 30 passes, and anneal the learning rate for every 3 passes after the 15th due to the smaller size of the dataset.",A Model and Training Details,[0],[0]
"For all of the biaffine combination layers and dense layers, we dropout their units with a small probability of 5%.",A Model and Training Details,[0],[0]
"Also during training time, we randomly replace 10% of the input words by an artificial 〈UNK〉 token, which is then used to replace
all unseen words in the development and test sets.",A Model and Training Details,[0],[0]
"Finally, we repeat each experiment with 3 independent random initializations, and use the average result for reporting and statistical significance tests.
",A Model and Training Details,[0],[0]
The code for the full specification of our models and aforementioned training details are available at https://github.com/qipeng/ arc-swift.,A Model and Training Details,[0],[0]
Transition-based dependency parsers often need sequences of local shift and reduce operations to produce certain attachments.,abstractText,[0],[0]
Correct individual decisions hence require global information about the sentence context and mistakes cause error propagation.,abstractText,[0],[0]
"This paper proposes a novel transition system, arc-swift, that enables direct attachments between tokens farther apart with a single transition.",abstractText,[0],[0]
This allows the parser to leverage lexical information more directly in transition decisions.,abstractText,[0],[0]
"Hence, arc-swift can achieve significantly better performance with a very small beam size.",abstractText,[0],[0]
Our parsers reduce error by 3.7–7.6% relative to those using existing transition systems on the Penn Treebank dependency parsing task and English Universal Dependencies.,abstractText,[0],[0]
Arc-swift: A Novel Transition System for Dependency Parsing,title,[0],[0]
