0,1,label2,summary_sentences
"Dependency parsing is a longstanding natural language processing task, with its outputs crucial to various downstream tasks including relation extraction (Schmitz et al., 2012; Angeli et al., 2015), language modeling (Gubbins and Vlachos, 2013), and natural logic inference (Bowman et al., 2016).
",1 Introduction,[0],[0]
"Attractive for their linear time complexity and amenability to conventional classification methods, transition-based dependency parsers have sparked much research interest recently.",1 Introduction,[0],[0]
"A transition-based parser makes sequential predictions of transitions between states under the restrictions of a transition system (Nivre, 2003).",1 Introduction,[0],[0]
"Transition-based parsers have been shown to excel at parsing shorter-range dependency structures, as well as languages where non-projective parses are less pervasive (McDonald and Nivre, 2007).
",1 Introduction,[0],[0]
"However, the transition systems employed in state-of-the-art dependency parsers usually define very local transitions.",1 Introduction,[0],[0]
"At each step, only one or two words are affected, with very local attachments made.",1 Introduction,[0],[0]
"As a result, distant attachments require long and not immediately obvious transition sequences (e.g., ate→chopsticks in Figure 1, which requires two transitions).",1 Introduction,[0],[0]
"This is further aggravated by the usually local lexical information leveraged to make transition predictions (Chen and Manning, 2014; Andor et al., 2016).
",1 Introduction,[0],[0]
"In this paper, we introduce a novel transition system, arc-swift, which defines non-local transitions that directly induce attachments of distance up to n (n = the number of tokens in the sentence).",1 Introduction,[1.0],"['In this paper, we introduce a novel transition system, arc-swift, which defines non-local transitions that directly induce attachments of distance up to n (n = the number of tokens in the sentence).']"
"Such an approach is connected to graph-based dependency parsing, in that it leverages pairwise scores between tokens in making parsing decisions (McDonald et al., 2005).
",1 Introduction,[0.9999999712005122],"['Such an approach is connected to graph-based dependency parsing, in that it leverages pairwise scores between tokens in making parsing decisions (McDonald et al., 2005).']"
We make two main contributions in this paper.,1 Introduction,[0],[0]
"Firstly, we introduce a novel transition system for dependency parsing, which alleviates the difficulty of distant attachments in previous systems by allowing direct attachments anywhere in the stack.",1 Introduction,[0],[0]
"Secondly, we compare parsers by the number of mistakes they make in common linguistic con-
ar X
iv :1
70 5.
04 43
4v 1
[ cs
.C",1 Introduction,[0],[0]
"L
] 1
2 M
ay 2
01 7
structions.",1 Introduction,[0],[0]
We show that arc-swift parsers reduce errors in attaching prepositional phrases and conjunctions compared to parsers using existing transition systems.,1 Introduction,[0],[0]
Transition-based dependency parsing is performed by predicting transitions between states (see Figure 1 for an example).,2 Transition-based Dependency Parsing,[0],[0]
"Parser states are usually written as (σ|i, j|β,A), where σ|i denotes the stack with token i on the top, j|β denotes the buffer with token j at its leftmost, and A the set of dependency arcs.",2 Transition-based Dependency Parsing,[1.0],"['Parser states are usually written as (σ|i, j|β,A), where σ|i denotes the stack with token i on the top, j|β denotes the buffer with token j at its leftmost, and A the set of dependency arcs.']"
"Given a state, the goal of a dependency parser is to predict a transition to a new state that would lead to the correct parse.",2 Transition-based Dependency Parsing,[1.0],"['Given a state, the goal of a dependency parser is to predict a transition to a new state that would lead to the correct parse.']"
"A transition system defines a set of transitions that are sound and complete for parsers, that is, every transition sequence would derive a well-formed parse tree, and every possible parse tree can also be derived from some transition sequence.1
Arc-standard (Nivre, 2004) is one of the first transition systems proposed for dependency parsing.",2 Transition-based Dependency Parsing,[0.999999934712731],"['A transition system defines a set of transitions that are sound and complete for parsers, that is, every transition sequence would derive a well-formed parse tree, and every possible parse tree can also be derived from some transition sequence.1 Arc-standard (Nivre, 2004) is one of the first transition systems proposed for dependency parsing.']"
"It defines three transitions: shift, left arc (LArc), and right arc (RArc) (see Figure 2 for definitions, same for the following transition systems), where all arc-inducing transitions operate on the stack.",2 Transition-based Dependency Parsing,[1.0],"['It defines three transitions: shift, left arc (LArc), and right arc (RArc) (see Figure 2 for definitions, same for the following transition systems), where all arc-inducing transitions operate on the stack.']"
"This system builds the parse bottom-up, i.e., a constituent is only attached to its head after it has received all of its dependents.",2 Transition-based Dependency Parsing,[0],[0]
"A potential drawback is that during parsing, it is difficult to predict if a constituent has consumed all of its right dependents.",2 Transition-based Dependency Parsing,[0],[0]
"Arc-eager (Nivre, 2003) remedies this drawback by defining arc-inducing transitions that operate between the stack and the buffer.",2 Transition-based Dependency Parsing,[0],[0]
"As a result, a constituent no longer needs to be complete
1We only focus on projective parses for the scope of this paper.
",2 Transition-based Dependency Parsing,[0],[0]
"before it can be attached to its head to the left, as a right arc doesn’t prevent the attached dependent from taking further dependents of its own.2 Kuhlmann et al. (2011) propose a hybrid system derived from a tabular parsing scheme, which they have shown both arc-standard and arc-eager can be derived from.",2 Transition-based Dependency Parsing,[0],[0]
"Arc-hybrid combines LArc from arc-eager and RArc from arc-standard to build dependencies bottom-up.
",2 Transition-based Dependency Parsing,[0],[0]
"3 Non-local Transitions with arc-swift
The traditional transition systems discussed in Section 2 only allow very local transitions affecting one or two words, which makes long-distance dependencies difficult to predict.",2 Transition-based Dependency Parsing,[0],[0]
"To illustrate the limitation of local transitions, consider parsing the following sentences:
I ate fish with ketchup.",2 Transition-based Dependency Parsing,[0.9999999648207467],"['To illustrate the limitation of local transitions, consider parsing the following sentences: I ate fish with ketchup.']"
"I ate fish with chopsticks.
",2 Transition-based Dependency Parsing,[0],[0]
"The two sentences have almost identical structures, with the notable difference that the prepositional phrase is complementing the direct object in the first case, and the main verb in the second.
",2 Transition-based Dependency Parsing,[1.0000000174644186],"['The two sentences have almost identical structures, with the notable difference that the prepositional phrase is complementing the direct object in the first case, and the main verb in the second.']"
"For arc-standard and arc-hybrid, the parser would have to decide between Shift and RArc when the parser state is as shown in Figure 3a, where ? stands for either “ketchup” or “chopsticks”.3 Similarly, an arc-eager parser would deal with the state shown in Figure 3b.",2 Transition-based Dependency Parsing,[0],[0]
"Making the correct transition requires information about context words “ate” and “fish”, as well as “?”.
",2 Transition-based Dependency Parsing,[0.9999999519235193],"['Making the correct transition requires information about context words “ate” and “fish”, as well as “?”.']"
2A side-effect of arc-eager is that there is sometimes spurious ambiguity between Shift and Reduce transitions.,2 Transition-based Dependency Parsing,[0],[0]
"For the example in Figure 1, the first Reduce can be inserted before the third Shift without changing the correctness of the resulting parse, i.e., both are feasible at that time.
",2 Transition-based Dependency Parsing,[0],[0]
"3For this example, we assume that the sentence is being parsed into Universal Dependencies.
",2 Transition-based Dependency Parsing,[0],[0]
"Parsers employing traditional transition systems would usually incorporate more features about the context in the transition decision, or employ beam search during parsing (Chen and Manning, 2014; Andor et al., 2016).
",2 Transition-based Dependency Parsing,[1.0000000968785876],"['Parsers employing traditional transition systems would usually incorporate more features about the context in the transition decision, or employ beam search during parsing (Chen and Manning, 2014; Andor et al., 2016).']"
"In contrast, inspired by graph-based parsers, we propose arc-swift, which defines non-local transitions as shown in Figure 2.",2 Transition-based Dependency Parsing,[1.0],"['In contrast, inspired by graph-based parsers, we propose arc-swift, which defines non-local transitions as shown in Figure 2.']"
"This allows direct comparison of different attachment points, and provides a direct solution to parsing the two example sentences.",2 Transition-based Dependency Parsing,[1.0],"['This allows direct comparison of different attachment points, and provides a direct solution to parsing the two example sentences.']"
"When the arc-swift parser encounters a state identical to Figure 3b, it could directly compare transitions RArc[1] and RArc[2] instead of evaluating between local transitions.",2 Transition-based Dependency Parsing,[0],[0]
"This results in a direct attachment much like that in a graph-based parser, informed by lexical information about affinity of the pairs of words.
",2 Transition-based Dependency Parsing,[0],[0]
Arc-swift also bears much resemblance to arceager.,2 Transition-based Dependency Parsing,[0],[0]
"In fact, an LArc[k] transition can be viewed as k− 1 Reduce operations followed by one LArc in arc-eager, and similarly for RArc[k].",2 Transition-based Dependency Parsing,[0],[0]
"Reduce is no longer needed in arc-swift as it becomes part of LArc[k] and RArc[k], removing the ambiguity in derived transitions in arc-eager.",2 Transition-based Dependency Parsing,[0],[0]
"arc-swift is also equivalent to arc-eager in terms of soundness and completeness.4 A caveat is that the worst-case time complexity of arc-swift is O(n2) instead of O(n), which existing transition-based parsers enjoy.",2 Transition-based Dependency Parsing,[0],[0]
"However, in practice the runtime is nearly
4This is easy to show because in arc-eager, all Reduce transitions can be viewed as preparing for a later LArc or RArc transition.",2 Transition-based Dependency Parsing,[0],[0]
"We also note that similar to arc-eager transitions, arc-swift transitions must also satisfy certain pre-conditions.",2 Transition-based Dependency Parsing,[0],[0]
"Specifically, an RArc[k] transition requires that the top k − 1 elements in the stack are already attached; LArc[k] additionally requires that the k-th element is unattached, resulting in no more than one feasible LArc candidate for any parser state.
",2 Transition-based Dependency Parsing,[0],[0]
"linear, thanks to the usually small number of reducible tokens in the stack.",2 Transition-based Dependency Parsing,[0],[0]
"We use the Wall Street Journal portion of Penn Treebank with standard parsing splits (PTBSD), along with Universal Dependencies v1.3 (Nivre et al., 2016) (EN-UD).",4.1 Data and Model,[1.0],"['We use the Wall Street Journal portion of Penn Treebank with standard parsing splits (PTBSD), along with Universal Dependencies v1.3 (Nivre et al., 2016) (EN-UD).']"
"PTB-SD is converted to Stanford Dependencies (De Marneffe and Manning, 2008) with CoreNLP 3.3.0 (Manning et al., 2014) following previous work.",4.1 Data and Model,[0],[0]
"We report labelled and unlabelled attachment scores (LAS/UAS), removing punctuation from all evaluations.
",4.1 Data and Model,[1.0000000110940879],"['We report labelled and unlabelled attachment scores (LAS/UAS), removing punctuation from all evaluations.']"
"Our model is very similar to that of (Kiperwasser and Goldberg, 2016), where features are extracted from tokens with bidirectional LSTMs, and concatenated for classification.",4.1 Data and Model,[1.0],"['Our model is very similar to that of (Kiperwasser and Goldberg, 2016), where features are extracted from tokens with bidirectional LSTMs, and concatenated for classification.']"
"For the three traditional transition systems, features of the top 3 tokens on the stack and the leftmost token in the buffer are concatenated as classifier input.",4.1 Data and Model,[1.0],"['For the three traditional transition systems, features of the top 3 tokens on the stack and the leftmost token in the buffer are concatenated as classifier input.']"
"For arc-swift, features of the head and dependent tokens for each arc-inducing transition are concatenated to compute scores for classification, and features of the leftmost buffer token is used for Shift.",4.1 Data and Model,[0],[0]
For other details we defer to Appendix A.,4.1 Data and Model,[0],[0]
The full specification of the model can also be found in our released code online at https://github.,4.1 Data and Model,[0],[0]
com/qipeng/arc-swift.,4.1 Data and Model,[0],[0]
"We use static oracles for all transition systems, and for arc-eager we implement oracles that always Shift/Reduce when ambiguity is present (arceager-S/R).",4.2 Results,[0],[0]
"We evaluate our parsers with greedy parsing (i.e., beam size 1).",4.2 Results,[0],[0]
"The results are shown in Table 1.5 Note that K&G 2016 is trained with a dynamic oracle (Goldberg and Nivre, 2012), Andor 2016 with a CRF-like loss, and both Andor 2016 and Weiss 2015 employed beam search (with sizes 32 and 8, respectively).
",4.2 Results,[1.0000000329392147],"['The results are shown in Table 1.5 Note that K&G 2016 is trained with a dynamic oracle (Goldberg and Nivre, 2012), Andor 2016 with a CRF-like loss, and both Andor 2016 and Weiss 2015 employed beam search (with sizes 32 and 8, respectively).']"
"For each pair of the systems we implemented, we studied the statistical significance of their difference by performing a paired test with 10,000 bootstrap samples on PTB-SD.",4.2 Results,[1.0],"['For each pair of the systems we implemented, we studied the statistical significance of their difference by performing a paired test with 10,000 bootstrap samples on PTB-SD.']"
"The resulting pvalues are analyzed with a 10-group BonferroniHolm test, with results shown in Table 2.",4.2 Results,[0],[0]
"We note
5In the interest of space, we abbreviate all transition systems (TS) as follows in tables: asw for arc-swift, asd for arcstandard, aeS/R for arc-eager-S/R, and ah for arc-hybrid.
",4.2 Results,[0],[0]
"that with almost the same implementation, arcswift parsers significantly outperform those using traditional transition systems.",4.2 Results,[0],[0]
We also analyzed the performance of parsers on attachments of different distances.,4.2 Results,[1.0],['We also analyzed the performance of parsers on attachments of different distances.']
"As shown in Figure 4, arc-swift is equally accurate as existing systems for short dependencies, but is more robust for longer ones.
",4.2 Results,[0],[0]
"While arc-swift introduces direct long-distance transitions, it also shortens the overall sequence necessary to induce the same parse.",4.2 Results,[0],[0]
"A parser could potentially benefit from both factors: direct attachments could make an easier classification task, and shorter sequences limit the effect of error propagation.",4.2 Results,[0],[0]
"However, since the two effects are correlated in a transition system, precise attribution of the gain is out of the scope of this paper.
",4.2 Results,[0],[0]
Computational efficiency.,4.2 Results,[0],[0]
"We study the computational efficiency of the arc-swift parser by
6https://github.com/tensorflow/models/ blob/master/syntaxnet/g3doc/universal.md
comparing it to an arc-eager parser.",4.2 Results,[0],[0]
"On the PTBSD development set, the average transition sequence length per sentence of arc-swift is 77.5% of that of arc-eager.",4.2 Results,[1.0],"['On the PTBSD development set, the average transition sequence length per sentence of arc-swift is 77.5% of that of arc-eager.']"
"At each step of parsing, arc-swift needs to evaluate only about 1.24 times the number of transition candidates as arc-eager, which results in very similar runtime.",4.2 Results,[0],[0]
"In contrast, beam search with beam size 2 for arc-eager requires evaluating 4 times the number of transition candidates compared to greedy parsing, which results in a UAS 0.14% worse and LAS 0.22% worse for arc-eager compared to greedily decoded arcswift.",4.2 Results,[1.0],"['In contrast, beam search with beam size 2 for arc-eager requires evaluating 4 times the number of transition candidates compared to greedy parsing, which results in a UAS 0.14% worse and LAS 0.22% worse for arc-eager compared to greedily decoded arcswift.']"
"We automatically extracted all labelled attachment errors by error type (incorrect attachment or relation), and categorized a few top parser errors by hand into linguistic constructions.",4.3 Linguistic Analysis,[1.0],"['We automatically extracted all labelled attachment errors by error type (incorrect attachment or relation), and categorized a few top parser errors by hand into linguistic constructions.']"
"Results on PTB-SD are shown in Table 3.7 We note that the arc-swift parser improves accuracy on prepositional phrase (PP) and conjunction attachments, while it remains comparable to other parsers on other common errors.",4.3 Linguistic Analysis,[1.0],"['Results on PTB-SD are shown in Table 3.7 We note that the arc-swift parser improves accuracy on prepositional phrase (PP) and conjunction attachments, while it remains comparable to other parsers on other common errors.']"
Analysis on EN-UD shows a similar trend.,4.3 Linguistic Analysis,[0],[0]
"As shown in the table, there are still many parser errors unaccounted for in our analysis.",4.3 Linguistic Analysis,[0],[0]
"We leave this to future work.
",4.3 Linguistic Analysis,[0],[0]
"7We notice that for some examples the parsers predicted a ccomp (complement clause) attachment to verbs “says” and “said”, where the CoreNLP output simply labelled the relation as dep (unspecified).",4.3 Linguistic Analysis,[0],[0]
For other examples the relation between the prepositions in “out of” is labelled as prep (preposition) instead of pcomp (prepositional complement).,4.3 Linguistic Analysis,[0],[0]
"We suspect this is due to the converter’s inability to handle certain corner cases, but further study is warranted.",4.3 Linguistic Analysis,[0],[0]
Previous work has also explored augmenting transition systems to facilitate longer-range attachments.,5 Related Work,[0],[0]
"Attardi (2006) extended the arcstandard system for non-projective parsing, with arc-inducing transitions that are very similar to those in arc-swift.",5 Related Work,[0],[0]
A notable difference is that their transitions retain tokens between the head and dependent.,5 Related Work,[0],[0]
"Fernández-González and GómezRodrı́guez (2012) augmented the arc-eager system with transitions that operate on the buffer, which shorten the transition sequence by reducing the number of Shift transitions needed.",5 Related Work,[0],[0]
"However, limited by the sparse feature-based classifiers used, both of these parsers just mentioned only allow direct attachments of distance up to 3 and 2, respectively.",5 Related Work,[0],[0]
"More recently, Sartorio et al. (2013) extended arc-standard with transitions that directly attach to left and right “spines” of the top two nodes in the stack.",5 Related Work,[0],[0]
"While this work shares very similar motivations as arc-swift, it requires additional data structures to keep track of the left and right spines of nodes.",5 Related Work,[0],[0]
"This transition system also introduces spurious ambiguity where multiple transition sequences could lead to the same correct parse, which necessitates easy-first training to achieve a more noticeable improvement over arcstandard.",5 Related Work,[0],[0]
"In contrast, arc-swift can be easily implemented given the parser state alone, and does not give rise to spurious ambiguity.
",5 Related Work,[0],[0]
"For a comprehensive study of transition systems for dependency parsing, we refer the reader to (Bohnet et al., 2016), which proposed a generalized framework that could derive all of the traditional transition systems we described by configuring the size of the active token set and the maximum arc length, among other control parameters.",5 Related Work,[0],[0]
"However, this framework does not cover
arc-swift in its original form, as the authors limit each of their transitions to reduce at most one token from the active token set (the buffer).",5 Related Work,[0],[0]
"On the other hand, the framework presented in (GómezRodrı́guez and Nivre, 2013) does not explicitly make this constraint, and therefore generalizes to arc-swift.",5 Related Work,[0],[0]
"However, we note that arc-swift still falls out of the scope of existing discussions in that work, by introducing multiple Reduces in a single transition.",5 Related Work,[0],[0]
"In this paper, we introduced arc-swift, a novel transition system for dependency parsing.",6 Conclusion,[1.0],"['In this paper, we introduced arc-swift, a novel transition system for dependency parsing.']"
We also performed linguistic analyses on parser outputs and showed arc-swift parsers reduce errors in conjunction and adverbial attachments compared to parsers using traditional transition systems.,6 Conclusion,[0],[0]
"We thank Timothy Dozat, Arun Chaganty, Danqi Chen, and the anonymous reviewers for helpful discussions.",Acknowledgments,[0],[0]
Stanford University gratefully acknowledges the support of the Defense Advanced Research Projects Agency (DARPA) Deep Exploration and Filtering of Text (DEFT) Program under Air Force Research Laboratory (AFRL) contract,Acknowledgments,[0],[0]
No. FA8750-13-2-0040.,Acknowledgments,[0],[0]
"Any opinions, findings, and conclusion or recommendations expressed in this material are those of the authors and do not necessarily reflect the view of the DARPA, AFRL, or the US government.",Acknowledgments,[0],[0]
"Our model setup is similar to that of (Kiperwasser and Goldberg, 2016)",A Model and Training Details,[0],[0]
(See Figure 5).,A Model and Training Details,[0],[0]
"We employ two blocks of bidirectional long short-term memory (BiLSTM) networks (Hochreiter and Schmidhuber, 1997) that share very similar structures, one for part-of-speech (POS) tagging, the other for parsing.",A Model and Training Details,[1.0],"['We employ two blocks of bidirectional long short-term memory (BiLSTM) networks (Hochreiter and Schmidhuber, 1997) that share very similar structures, one for part-of-speech (POS) tagging, the other for parsing.']"
"Both BiLSTMs have 400 hidden units in each direction, and the output of both are concatenated and fed into a dense layer of rectified linear units (ReLU) before 32-dimensional representations are derived as classification features.",A Model and Training Details,[0],[0]
"As the input to the tagger BiLSTM, we represent words with 100-dimensional word embeddings, initialized with GloVe vectors (Pennington et al., 2014).8",A Model and Training Details,[0],[0]
"The output distribution of the tagger classifier is used to compute a weighted sum of 32- dimensional POS embeddings, which is then concatenated with the output of the tagger BiLSTM",A Model and Training Details,[0],[0]
(800-dimensional per token) as the input to the parser BiLSTM.,A Model and Training Details,[0],[0]
"For the parser BiLSTM, we use two separate sets of dense layers to derive a “head” and a “dependent” representation for each token.",A Model and Training Details,[0],[0]
"These representations are later merged according to the parser state to make transition predictions.
",A Model and Training Details,[0.999999998498683],['These representations are later merged according to the parser state to make transition predictions.']
"For traditional transition systems, we follow (Kiperwasser and Goldberg, 2016) by featurizing the top 3 tokens on the stack and the leftmost token in the buffer.",A Model and Training Details,[1.0],"['For traditional transition systems, we follow (Kiperwasser and Goldberg, 2016) by featurizing the top 3 tokens on the stack and the leftmost token in the buffer.']"
"To derive features for each token, we take its head representation vhead and dependent representation vdep, and perform the following biaffine combination
vfeat,i =",A Model and Training Details,[0],[0]
"[f(vhead, vdep)]i = ReLU ( v>headWivdep +",A Model and Training Details,[0],[0]
b,A Model and Training Details,[0],[0]
>,A Model and Training Details,[0],[0]
"i vhead
+ c",A Model and Training Details,[0],[0]
">i vdep + di ) (1)
where Wi ∈ R32×32, bi, ci ∈ R32, and di is a scalar for i = 1, . . .",A Model and Training Details,[0],[0]
", 32.",A Model and Training Details,[0],[0]
