0,1,label2,summary_sentences
"However, this makes learning much more expensive as each update step requires multiple iterations of backpropagation.",3.2 Backpropagation in Graph LSTMs,[0],[0]
"Moreover, loopy backpropagation could suffer from the same problems encountered to in LBP, such as oscillation or failure to converge.
",3.2 Backpropagation in Graph LSTMs,[0],[0]
"We observe that dependencies such as coreference and discourse relations are generally sparse, so the backbone of a document graph consists of the linear chain and the syntactic dependency tree.",3.2 Backpropagation in Graph LSTMs,[0],[0]
"As in belief propagation, such structures can be leveraged to make backpropagation more efficient by replac-
ing synchronous updates, as in the unrolling strategy, with asynchronous updates, as in linear-chain LSTMs.",3.2 Backpropagation in Graph LSTMs,[0],[0]
"This opens up opportunities for a variety of strategies in ordering backpropagation updates.
",3.2 Backpropagation in Graph LSTMs,[0],[0]
"In this paper, we adopt a simple strategy that performed quite well in preliminary experiments, and leave further exploration to future work.",3.2 Backpropagation in Graph LSTMs,[0],[0]
"Specifically, we partition the document graph into two directed acyclic graphs (DAGs).",3.2 Backpropagation in Graph LSTMs,[0],[0]
"One DAG contains the left-to-right linear chain, as well as other forwardpointing dependencies.",3.2 Backpropagation in Graph LSTMs,[0],[0]
The other DAG covers the right-to-left linear chain and the backward-pointing dependencies.,3.2 Backpropagation in Graph LSTMs,[0],[0]
Figure 3 illustrates this strategy.,3.2 Backpropagation in Graph LSTMs,[0],[0]
"Effectively, we partition the original graph into the forward pass (left-to-right), followed by the backward pass (right-to-left), and construct the LSTMs accordingly.",3.2 Backpropagation in Graph LSTMs,[0],[0]
"When the document graph only contains linear chain edges, the graph LSTMs is exactly a bi-directional LSTMs (BiLSTMs).",3.2 Backpropagation in Graph LSTMs,[0],[0]
"A standard LSTM unit consists of an input vector (word embedding), a memory cell and an output vector (contextual representation), as well as several gates.",3.3 The Basic Recurrent Propagation Unit,[0],[0]
"The input gate and output gate control the information flowing into and out of the cell, whereas the forget gate can optionally remove information from the recurrent connection to a precedent unit.
",3.3 The Basic Recurrent Propagation Unit,[0],[0]
"In linear-chain LSTMs, each unit contains only one forget gate, as it has only one direct precedent (i.e., the adjacent-word edge pointing to the previous word).",3.3 The Basic Recurrent Propagation Unit,[0],[0]
"In graph LSTMs, however, a unit may have several precedents, including connections to the same word via different edges.",3.3 The Basic Recurrent Propagation Unit,[0],[0]
"We thus introduce a forget gate for each precedent, similar to the approach taken by Tai et al. (2015) for tree LSTMs.
",3.3 The Basic Recurrent Propagation Unit,[0],[0]
"Encoding rich linguistic analysis introduces many distinct edge types besides word adjacency, such as syntactic dependencies, which opens up many possibilities for parametrization.",3.3 The Basic Recurrent Propagation Unit,[0],[0]
"This was not considered in prior syntax-aware LSTM approaches (Tai et al., 2015; Miwa and Bansal, 2016).",3.3 The Basic Recurrent Propagation Unit,[0],[0]
"In this paper, we explore two schemes that introduce more fined-grained parameters based on the edge types.
",3.3 The Basic Recurrent Propagation Unit,[0],[0]
Full Parametrization,3.3 The Basic Recurrent Propagation Unit,[0],[0]
"Our first proposal simply introduces a different set of parameters for each edge type, with computation specified below.
",3.3 The Basic Recurrent Propagation Unit,[0],[0]
"it = σ(Wixt + ∑
j∈P (t) U
m(t,j) i hj + bi)
ot = σ(Woxt + ∑
j∈P (t) Um(t,j)o hj + bo) c̃t = tanh(Wcxt + ∑
j∈P (t) Um(t,j)c hj + bc)
ftj = σ(Wfxt",3.3 The Basic Recurrent Propagation Unit,[0],[0]
+,3.3 The Basic Recurrent Propagation Unit,[0],[0]
"U m(t,j) f hj + bf )",3.3 The Basic Recurrent Propagation Unit,[0],[0]
ct = it c̃t,3.3 The Basic Recurrent Propagation Unit,[0],[0]
"+ ∑
j∈P (t) ftj",3.3 The Basic Recurrent Propagation Unit,[0],[0]
"cj
ht = ot tanh(ct)
",3.3 The Basic Recurrent Propagation Unit,[0],[0]
"As in standard chain LSTMs, xt is the input word vector for node t, ht is the hidden state vector for node t, W ’s are the input weight matrices, and b’s are the bias vectors.",3.3 The Basic Recurrent Propagation Unit,[0],[0]
"σ, tanh, and represent the sigmoid function, the hyperbolic tangent function, and the Hadamard product (pointwise multiplication), respectively.",3.3 The Basic Recurrent Propagation Unit,[0],[0]
The main differences lie in the recurrence terms.,3.3 The Basic Recurrent Propagation Unit,[0],[0]
"In graph LSTMs, a unit might have multiple predecessors (P (t)), for each of which (j) there is a forget gate ftj , and a typed weight matrix Um(t,j), where m(t, j) signifies the connection type between t and j. The input and output gates (it, ot) depend on all predecessors, whereas the forget gate (ftj) only depends on the predecessor with which the gate is associated.",3.3 The Basic Recurrent Propagation Unit,[0],[0]
"ct and c̃t represent intermediate computation results within the memory cell, which take into account the input and forget gates, and will be combined with output gate to produce the hidden representation ht.
",3.3 The Basic Recurrent Propagation Unit,[0],[0]
"Full parameterization is straightforward, but it requires a large number of parameters when there are many edge types.",3.3 The Basic Recurrent Propagation Unit,[0],[0]
"For example, there are dozens of syntactic edge types, each corresponding to a Stanford dependency label.",3.3 The Basic Recurrent Propagation Unit,[0],[0]
"As a result, in our experiments we resort to using only the coarse-grained types: word adjacency, syntactic dependency, etc.",3.3 The Basic Recurrent Propagation Unit,[0],[0]
"Next, we will consider a more fine-grained approach by learning an edge-type embedding.
",3.3 The Basic Recurrent Propagation Unit,[0],[0]
"Edge-Type Embedding To reduce the number of parameters and leverage potential correlation among fine-grained edge types, we learned a lowdimensional embedding of the edge types, and conducted an outer product of the predecessor’s hidden vector and the edge-type embedding to generate a “typed hidden representation”, which is a matrix.",3.3 The Basic Recurrent Propagation Unit,[0],[0]
"The new computation is as follows:
it = σ(Wixt + ∑
j∈P (t) Ui ×T (hj ⊗ ej) + bi)
ftj = σ(Wfxt +",3.3 The Basic Recurrent Propagation Unit,[0],[0]
Uf ×T (hj ⊗ ej) + bf ),3.3 The Basic Recurrent Propagation Unit,[0],[0]
"ot = σ(Woxt + ∑
j∈P (t)",3.3 The Basic Recurrent Propagation Unit,[0],[0]
"Uo ×T (hj ⊗ ej) + bo) c̃t = tanh(Wcxt + ∑
j∈P (t) Uc ×T (hj ⊗ ej) + bc) ct",3.3 The Basic Recurrent Propagation Unit,[0],[0]
"= it c̃t + ∑
j∈P (t) ftj cj
ht = ot tanh(ct)
",3.3 The Basic Recurrent Propagation Unit,[0],[0]
U ’s are now l ×,3.3 The Basic Recurrent Propagation Unit,[0],[0]
"l × d tensors (l is the dimension of the hidden vector and d is the dimension for edgetype embedding), and hj ⊗ ej is a tensor product that produces an l × d matrix.",3.3 The Basic Recurrent Propagation Unit,[0],[0]
×T denotes a tensor dot product defined as T ×T,3.3 The Basic Recurrent Propagation Unit,[0],[0]
"A = ∑ d(T:,:,d · A:,d), which produces an l-dimensional vector.",3.3 The Basic Recurrent Propagation Unit,[0],[0]
The edgetype embedding ej is jointly trained with the other parameters.,3.3 The Basic Recurrent Propagation Unit,[0],[0]
The main advantages of a graph formulation are its generality and flexibility.,3.4 Comparison with Prior LSTM Approaches,[0],[0]
"As seen in Section 3.1, linear-chain LSTMs are a special case when the document graph is the linear chain of adjacent words.",3.4 Comparison with Prior LSTM Approaches,[0],[0]
"Similarly, Tree LSTMs (Tai et al., 2015) are a special case when the document graph is the parse tree.
",3.4 Comparison with Prior LSTM Approaches,[0],[0]
"In graph LSTMs, the encoding of linguistic knowledge is factored from the backpropagation strategy (Section 3.2), making it much more flexible, including introducing cycles.",3.4 Comparison with Prior LSTM Approaches,[0],[0]
"For example, Miwa and Bansal (2016) conducted joint entity and binary relation extraction by stacking a LSTM for relation extraction on top of another LSTM for entity recognition.",3.4 Comparison with Prior LSTM Approaches,[0],[0]
"In graph LSTMs, the two can be combined seamlessly using a document graph comprising both the word-adjacency chain and the dependency path between the two entities.
",3.4 Comparison with Prior LSTM Approaches,[0],[0]
The document graph can also incorporate other linguistic information.,3.4 Comparison with Prior LSTM Approaches,[0],[0]
"For example, coreference and discourse parsing are intuitively relevant for cross-sentence relation extraction.",3.4 Comparison with Prior LSTM Approaches,[0],[0]
"Although existing systems have not yet been shown to improve crosssentence relation extraction (Quirk and Poon, 2017), it remains an important future direction to explore incorporating such analyses, especially after adapting them to the biomedical domains (Bell et al., 2016).",3.4 Comparison with Prior LSTM Approaches,[0],[0]
"Multi-task learning has been shown to be beneficial in training neural networks (Caruana, 1998; Collobert and Weston, 2008; Peng and Dredze, 2016).",3.5 Multi-task Learning with Sub-relations,[0],[0]
"By learning contextual entity representations, our framework makes it straightforward to conduct multi-task learning.",3.5 Multi-task Learning with Sub-relations,[0],[0]
The only change is to add a separate classifier for each related auxiliary relation.,3.5 Multi-task Learning with Sub-relations,[0],[0]
"All classifiers share the same graph LSTMs representation learner and word embeddings, and can potentially help each other by pooling their supervision signals.
",3.5 Multi-task Learning with Sub-relations,[0],[0]
"In the molecular tumor board domain, we applied this paradigm to joint learning of both the ternary relation (drug-gene-mutation) and its binary sub-relation (drug-mutation).",3.5 Multi-task Learning with Sub-relations,[0],[0]
Experiment results show that this provides significant gains in both tasks.,3.5 Multi-task Learning with Sub-relations,[0],[0]
"We implemented our methods using the Theano library (Theano Development Team, 2016).",4 Implementation Details,[0],[0]
We used logistic regression for our relation classifiers.,4 Implementation Details,[0],[0]
Hyper parameters were set based on preliminary experiments on a small development dataset.,4 Implementation Details,[0],[0]
Training was done using mini-batched stochastic gradient descent (SGD) with batch size 8.,4 Implementation Details,[0],[0]
"We used a learning rate of 0.02 and trained for at most 30 epochs, with early stopping based on development data (Caruana et al., 2001; Graves et al., 2013).",4 Implementation Details,[0],[0]
"The dimension for the hidden vectors in LSTM units was set to 150, and the dimension for the edge-type embedding was set to 3.",4 Implementation Details,[0],[0]
"The word embeddings were initialized with the publicly available 100-dimensional GloVe word vectors trained on 6 billion words from Wikipedia and web text3 (Pennington et al., 2014).",4 Implementation Details,[0],[0]
"Other model parameters were initialized with random samples drawn uniformly from the range [−1, 1].
",4 Implementation Details,[0],[0]
"In multi-task training, we alternated among all tasks, each time passing through all data for one task4, and updating the parameters accordingly.",4 Implementation Details,[0],[0]
"This was repeated for 30 epochs.
3http://nlp.stanford.edu/projects/glove/ 4However, drug-gene pairs have much more data, so we subsampled the instances down to the same size as the main n-ary relation task.",4 Implementation Details,[0],[0]
"Our main experiments focus on extracting ternary interactions over drugs, genes and mutations, which is important for molecular tumor boards.",5 Domain: Molecular Tumor Boards,[0],[0]
A druggene-mutation interaction is broadly construed as an association between the drug efficacy and the mutation in the given gene.,5 Domain: Molecular Tumor Boards,[0],[0]
There is no annotated dataset for this problem.,5 Domain: Molecular Tumor Boards,[0],[0]
"However, due to the importance of such knowledge, oncologists have been painstakingly curating known relations from reading papers.",5 Domain: Molecular Tumor Boards,[0],[0]
"Such a manual approach cannot keep up with the rapid growth of the research literature, and the coverage is generally sparse and not up to date.",5 Domain: Molecular Tumor Boards,[0],[0]
"However, the curated knowledge can be used for distant supervision.",5 Domain: Molecular Tumor Boards,[0],[0]
"We obtained biomedical literature from PubMed Central5, consisting of approximately one million fulltext articles as of 2015.",5.1 Datasets,[0],[0]
Note that only a fraction of papers contain knowledge about drug-gene-mutation interactions.,5.1 Datasets,[0],[0]
Extracting such knowledge from the vast body of biomedical papers is exactly the challenge.,5.1 Datasets,[0],[0]
"As we will see in later subsections, distant supervision enables us to generate a sizable training set from a small number of manually curated facts, and the learned model was able to extract orders of magnitude more facts.",5.1 Datasets,[0],[0]
"In future work, we will explore incorporating more known facts for distant supervision and extracting from more full-text articles.
",5.1 Datasets,[0],[0]
"We conducted tokenization, part-of-speech tagging, and syntactic parsing using SPLAT (Quirk et al., 2012), and obtained Stanford dependencies (de Marneffe et al., 2006) using Stanford CoreNLP",5.1 Datasets,[0],[0]
"(Manning et al., 2014).",5.1 Datasets,[0],[0]
"We used the entity taggers from Literome (Poon et al., 2014) to identify drug, gene and mutation mentions.
",5.1 Datasets,[0],[0]
"We used the Gene Drug Knowledge Database (GDKD) (Dienstmann et al., 2015) and the Clinical Interpretations of Variants In Cancer (CIVIC) knowledge base6 for distant supervision.",5.1 Datasets,[0],[0]
"The knowledge bases distinguish fine-grained interaction types, which we do not use in this paper.
",5.1 Datasets,[0],[0]
5http://www.ncbi.nlm.nih.gov/pmc/ 6http://civic.genome.wustl.edu,5.1 Datasets,[0],[0]
"After identifying drug, gene and mutation mentions in the text, co-occurring triples with known interactions were chosen as positive examples.",5.2 Distant Supervision,[0],[0]
"However, unlike the single-sentence setting in standard distant supervision, care must be taken in selecting the candidates.",5.2 Distant Supervision,[0],[0]
"Since the triples can reside in different sentences, an unrestricted selection of text spans would risk introducing many obviously wrong examples.",5.2 Distant Supervision,[0],[0]
"We thus followed Quirk and Poon (2017) in restricting the candidates to those occurring in a minimal span, i.e., we retain a candidate only if is no other co-occurrence of the same entities in an overlapping text span with a smaller number of consecutive sentences.",5.2 Distant Supervision,[0],[0]
"Furthermore, we avoid picking unlikely candidates where the triples are far apart in the document.",5.2 Distant Supervision,[0],[0]
"Specifically, we considered entity triples within K consecutive sentences, ignoring paragraph boundaries.",5.2 Distant Supervision,[0],[0]
K = 1 corresponds to the baseline of extraction within single sentences.,5.2 Distant Supervision,[0],[0]
"We explored K ≤ 3, which captured a large fraction of candidates without introducing many unlikely ones.
",5.2 Distant Supervision,[0],[0]
Only 59 distinct drug-gene-mutation triples from the knowledge bases were matched in the text.,5.2 Distant Supervision,[0],[0]
"Even from such a small set of unique triples, we obtained 3,462 ternary relation instances that can serve as positive examples.",5.2 Distant Supervision,[0],[0]
"For multi-task learning, we also considered drug-gene and drug-mutation sub-relations, which yielded 137,469 drug-gene and 3,192 drugmutation relation instances as positive examples.
",5.2 Distant Supervision,[0],[0]
"We generate negative examples by randomly sampling co-occurring entity triples without known interactions, subject to the same restrictions above.",5.2 Distant Supervision,[0],[0]
We sampled the same number as positive examples to obtain a balanced dataset7.,5.2 Distant Supervision,[0],[0]
"To compare the various models in our proposed framework, we conducted five-fold cross-validation, treating the positive and negative examples from distant supervision as gold annotation.",5.3 Automatic Evaluation,[0],[0]
"To avoid traintest contamination, all examples from a document were assigned to the same fold.",5.3 Automatic Evaluation,[0],[0]
"Since our datasets are balanced by construction, we simply report average test accuracy on held-out folds.",5.3 Automatic Evaluation,[0],[0]
"Obviously, the
7We will release the dataset at http://hanover.azurewebsites.net.
results could be noisy (e.g., entity triples not known to have an interaction might actually have one), but this evaluation is automatic and can quickly evaluate the impact of various design choices.
",5.3 Automatic Evaluation,[0],[0]
We evaluated two variants of graph LSTMs: “Graph LSTM-FULL” with full parametrization and “Graph LSTM-EMBED” with edge-type embedding.,5.3 Automatic Evaluation,[0],[0]
"We compared graph LSTMs with three strong baseline systems: a well-engineered feature-based classifier (Quirk and Poon, 2017), a convolutional neural network (CNN)",5.3 Automatic Evaluation,[0],[0]
"(Zeng et al., 2014; Santos et al., 2015; Wang et al., 2016), and a bi-directional LSTM (BiLSTM).",5.3 Automatic Evaluation,[0],[0]
"Following Wang et al. (2016), we used input attention for the CNN and a input window size of 5.",5.3 Automatic Evaluation,[0],[0]
Quirk and Poon (2017) only extracted binary relations.,5.3 Automatic Evaluation,[0],[0]
"We extended it to ternary relations by deriving features for each entity pair (with added annotation to signify the two entity types), and pooling the features
from all pairs.",5.3 Automatic Evaluation,[0],[0]
"For binary relation extraction, prior syntax-aware approaches are directly applicable.",5.3 Automatic Evaluation,[0],[0]
"So we also compared with a state-of-the-art tree LSTM system (Miwa and Bansal, 2016) and a BiLSTM on the shortest dependency path between the two entities (BiLSTM-Shortest-Path) (Xu et al., 2015b).
",5.3 Automatic Evaluation,[0],[0]
"Table 1 shows the results for cross-sentence, ternary relation extraction.",5.3 Automatic Evaluation,[0],[0]
"All neural-network based models outperformed the feature-based classifier, illustrating their advantage in handling sparse linguistic patterns without requiring intense feature engineering.",5.3 Automatic Evaluation,[0],[0]
"All LSTMs significantly outperformed CNN in the cross-sentence setting, verifying the importance in capturing long-distance dependencies.
",5.3 Automatic Evaluation,[0],[0]
"The two variants of graph LSTMs perform on par with each other, though Graph LSTM-FULL has a small advantage, suggesting that further exploration of parametrization schemes could be beneficial.",5.3 Automatic Evaluation,[0],[0]
"In particular, the edge-type embedding might improve by pretraining on unlabeled text with syntactic parses.
",5.3 Automatic Evaluation,[0],[0]
"Both graph variants significantly outperformed BiLSTMs (p < 0.05 by McNemar’s chi-square test), though the difference is small.",5.3 Automatic Evaluation,[0],[0]
This result is intriguing.,5.3 Automatic Evaluation,[0],[0]
"In Quirk and Poon (2017), the best system incorporated syntactic dependencies and outperformed the linear-chain variant (Base) by a large margin.",5.3 Automatic Evaluation,[0],[0]
"So why didn’t graph LSTMs make an equally substantial gain by modeling syntactic dependencies?
",5.3 Automatic Evaluation,[0],[0]
One reason is that linear-chain LSTMs can already captured some of the long-distance dependencies available in syntactic parses.,5.3 Automatic Evaluation,[0],[0]
"BiLSTMs substantially outperformed the feature-based classifier, even without explicit modeling of syntactic dependencies.",5.3 Automatic Evaluation,[0],[0]
"The gain cannot be entirely attributed to word embedding as LSTMs also outperformed CNNs.
",5.3 Automatic Evaluation,[0],[0]
Another reason is that syntactic parsing is less accurate in the biomedical domain.,5.3 Automatic Evaluation,[0],[0]
"Parse errors confuse the graph LSM learner, limiting the potential for gain.",5.3 Automatic Evaluation,[0],[0]
"In Section 6, we show supporting evidence in a domain when gold parses are available.
",5.3 Automatic Evaluation,[0],[0]
"We also reported accuracy on instances within single sentences, which exhibited a broadly similar set of trends.",5.3 Automatic Evaluation,[0],[0]
"Note that single-sentence and crosssentence accuracies are not directly comparable, as the test sets are different (one subsumes the other).
",5.3 Automatic Evaluation,[0],[0]
We conducted the same experiments on the binary sub-relation between drug-mutation pairs.,5.3 Automatic Evaluation,[0],[0]
"Table 2
shows the results, which are similar to the ternary case: Graph LSTM-FULL consistently performed the best for both single sentence and cross-sentence instances.",5.3 Automatic Evaluation,[0],[0]
"BiLSTMs on the shortest path substantially underperformed BiLSTMs or graph LSTMs, losing between 4-5 absolute points in accuracy, which could be attributed to the lower parsing quality in the biomedical domain.",5.3 Automatic Evaluation,[0],[0]
"Interestingly, the state-of-the-art tree LSTMs (Miwa and Bansal, 2016) also underperformed graph LSTMs, even though they encoded essentially the same linguistic structures (word adjacency and syntactic dependency).",5.3 Automatic Evaluation,[0],[0]
"We attributed the gain to the fact that Miwa and Bansal (2016) used separate LSTMs for the linear chain and the dependency tree, whereas graph LSTMs learned a single representation for both.
",5.3 Automatic Evaluation,[0],[0]
"To evaluate whether joint learning with subrelations can help, we conducted multi-task learning using Graph LSTM-FULL to jointly train extractors for both the ternary interaction and the drug-mutation, drug-gene sub-relations.",5.3 Automatic Evaluation,[0],[0]
Table 3 shows the results.,5.3 Automatic Evaluation,[0],[0]
Multi-task learning resulted in a significant gain for both the ternary interaction and the drug-mutation interaction.,5.3 Automatic Evaluation,[0],[0]
"Interestingly, the advantage of graph LSTMs over BiLSTMs is reduced with multi-task learning, suggesting that with more supervision signal, even linear-chain LSTMs can learn to capture long-range dependencies that are were made evident by parse features in graph LSTMs.",5.3 Automatic Evaluation,[0],[0]
"Note that there are many more instances for drug-gene interaction than others, so we only sampled a subset of comparable size.",5.3 Automatic Evaluation,[0],[0]
"Therefore, we do not evaluate the performance gain for drug-gene interaction, as in practice, one would simply learn from all available data, and the sub-sampled results are not competitive.
",5.3 Automatic Evaluation,[0],[0]
We included coreference and discourse relations in our document graph.,5.3 Automatic Evaluation,[0],[0]
"However, we didn’t observe any significant gains, similar to the observation in
Quirk and Poon (2017).",5.3 Automatic Evaluation,[0],[0]
We leave further exploration to future work.,5.3 Automatic Evaluation,[0],[0]
Our ultimate goal is to extract all knowledge from available text.,5.4 PubMed-Scale Extraction,[0],[0]
"We thus retrained our model using the best system from automatic evaluation (i.e., Graph LSTM-FULL) on all available data.",5.4 PubMed-Scale Extraction,[0],[0]
"The resulting model was then used to extract relations from all PubMed Central articles.
",5.4 PubMed-Scale Extraction,[0],[0]
Table 4 shows the number of candidates and extracted interactions.,5.4 PubMed-Scale Extraction,[0],[0]
"With as little as 59 unique druggene-mutation triples from the two databases8, we learned to extract orders of magnitude more unique interactions.",5.4 PubMed-Scale Extraction,[0],[0]
"The results also highlight the benefit of cross-sentence extraction, which yields 3 to 5 times more relations than single-sentence extraction.
",5.4 PubMed-Scale Extraction,[0],[0]
"Table 5 conducts a similar comparison on unique number of drugs, genes, and mutations.",5.4 PubMed-Scale Extraction,[0],[0]
"Again, machine reading covers far more unique entities, especially with cross-sentence extraction.",5.4 PubMed-Scale Extraction,[0],[0]
"Our automatic evaluations are useful for comparing competing approaches, but may not reflect the true classifier precision as the labels are noisy.",5.5 Manual Evaluation,[0],[0]
"Therefore, we randomly sampled extracted relation instances and asked three researchers knowledgeable in precision medicine to evaluate their correctness.",5.5 Manual Evaluation,[0],[0]
"For each instance, the annotators were presented with the provenance: sentences with the drug, gene, and mutation highlighted.",5.5 Manual Evaluation,[0],[0]
"The annotators determined in
8There are more in the databases, but these are the only ones for which we found matching instances in the text.",5.5 Manual Evaluation,[0],[0]
