0,1,label2,summary_sentences
"Proceedings of the 2017 Conference on Empirical Methods in Natural Language Processing, pages 2832–2838 Copenhagen, Denmark, September 7–11, 2017. c©2017 Association for Computational Linguistics",text,[0],[0]
"Bidirectional Long Short-Term Memory (BLSTM) based models (Graves and Schmidhuber, 2005), along with word embeddings and character embeddings, have shown competitive performance on Part-of-Speech (POS) tagging given sufficient amount of training examples (Ling et al., 2015; Lample et al., 2016; Plank et al., 2016; Yang et al., 2017).
",1 Introduction,[0],[0]
"Given insufficient training examples, we can improve the POS tagging performance by cross-
lingual POS tagging, which exploits affluent POS tagging corpora from other source languages.",1 Introduction,[0],[0]
"This approach usually requires linguistic knowledge or resources about the relation between the source language and the target language such as parallel corpora (Täckström et al., 2013; Duong et al., 2013; Kim et al., 2015a; Zhang et al., 2016), morphological analyses (Hana et al., 2004), dictionaries (Wisniewski et al., 2014), and gaze features (Barrett et al., 2016).
",1 Introduction,[0],[0]
"Given no linguistic resources between the source language and the target language, transfer learning methods can be utilized instead.",1 Introduction,[0],[0]
"Transfer learning for cross-lingual cases is a type of transductive transfer learning, where the input domains of the source and the target are different (Pan and Yang, 2010) since each language has its own vocabulary space.",1 Introduction,[0],[0]
"When the input space is the same, lower layers of hierarchical models can be shared for knowledge transfer (Collobert et al., 2011; Kim et al., 2015b; Yang et al., 2017), but that approach is not directly applicable when the input spaces differ.
",1 Introduction,[0],[0]
Yang et al. (2017) used shared character embeddings for different languages as a cross-lingual transfer method while using different word embeddings for different languages.,1 Introduction,[0],[0]
"Although the approach showed improved performance on Named Entity Recognition, it is limited to character-level representation transfer and it is not applicable for knowledge transfer between languages without overlapped alphabets.
",1 Introduction,[0],[0]
"In this work, we introduce a cross-lingual transfer learning model for POS tagging requiring no cross-lingual resources, where knowledge transfer is made in the BLSTM layers on top of word embeddings and character embeddings.",1 Introduction,[0],[0]
"Inspired by Kim et al. (2016)’s multi-task slot-filling model, our model utilizes a common BLSTM for representing language-generic information, which al-
2832
lows knowledge transfer from other languages, and private BLSTMs for representing languagespecific information.",1 Introduction,[0],[0]
"The common BLSTM is additionally encouraged to be language-agnostic with language-adversarial training (Chen et al., 2016) so that the language-general representations to be more compatible among different languages.
",1 Introduction,[0],[0]
"Evaluating on POS datasets from 14 different target languages with English as the source language in the Universal Dependencies corpus 1.4 (Nivre et al., 2016), the proposed model showed significantly better performance when the source language and the target language are in the same language family, and competitive performance when the language families are different.",1 Introduction,[0],[0]
Cross-Lingual Training Figure 1 shows the overall architecture of the proposed model.,2 Model,[0],[0]
"The baseline POS tagging model is similar to Plank et al. (2016)’s model, and it corresponds to having only word+char embeddings, common BLSTM, and Softmax Output in Figure 1.",2 Model,[0],[0]
"Given an input
word sequence, a BLSTM is used for the character sequence of each word, where the outputs of the ends of the character sequences from the forward LSTM and the backward LSTM are concatenated to the word vector of the current word to supplement the word representation.",2 Model,[0],[0]
"These serve as an input to a BLSTM, and an output layer are used for POS tag prediction.
",2 Model,[0],[0]
"For the cross-lingual transfer learning, the character embedding, the BLSTM with the character embedding (Yang et al., 2017),1 and the common BLSTM are shared for all the given languages while word embeddings and private BLSTMs have different parameters for different languages.
",2 Model,[0],[0]
The outputs of the common BLSTM and the private BLSTM of the current language are summed to be used as the input to the softmax layer to predict the POS tags of given word sequences.,2 Model,[0],[0]
"The loss function of the POS tagging can be formulate as:
Lp = − S∑
i=1",2 Model,[0],[0]
"N∑ j=1 pi,j log (p̂i,j) , (1)
where S is the number of sentences in the current minibatch,N is the number of words in the current sentence, pi,j is the label of the j-th tag of the i-th sentence in the minibatch, and p̂i,j is the predicted tag.",2 Model,[0],[0]
"In addition to this main objective, two more objectives for improving the transfer learning are described in the following subsections.
",2 Model,[0],[0]
"Language-Adversarial Training We encourage the outputs of the common BLSTM to be language-agnostic by using language-adversarial training (Chen et al., 2016) inspired by domainadversarial training (Ganin et al., 2016; Bousmalis et al., 2016).",2 Model,[0],[0]
"First, we encode a BLSTM output sequence as a single vector using a CNN/MaxPool encoder, which is implemented the same as a CNN for text classification (Kim, 2014).",2 Model,[0],[0]
"The encoder is with three convolution filters whose sizes are 3, 4, and 5.",2 Model,[0],[0]
"For each filter, we pass the BLSTM output sequence as the input sequence and obtain a single vector from the filter output by using max pooling, and then tanh activation function is used for transforming the vector.",2 Model,[0],[0]
"Then, the vector outputs of the three filters are concatenated and forwarded to the language discriminator through the gradient reversal layer.",2 Model,[0],[0]
"The discriminator is implemented
1We also tried isolated character-level modules but the overall performance was worse.
as a fully-connected neural network with a single hidden layer, whose activation function is Leaky ReLU (Maas et al., 2013), where we multiply 0.2 to negative input values as the outputs.
",2 Model,[0],[0]
"Since the gradient reversal layer is below the language classifier, the gradients minimizing language classification errors are passed back with opposed sign to the sentence encoder, which adversarially encourages the sentence encoder to be language-agnostic.",2 Model,[0],[0]
"The loss function of the language classifier is formulated as:
La = − S∑
i=1
li log l̂i, (2)
where S is the number of sentences, li is the language of the i-th sentence, and l̂i is the softmax output of the tagging.",2 Model,[0],[0]
"Note that though the language classifier is optimized to minimize the language classification error, the gradient from the language classifier is negated so that the bottom layers are trained to be language-agnostic.
",2 Model,[0],[0]
"Bidirectional Language Modeling Rei (2017) showed the effectiveness of the bidirectional language modeling objective, where each time step of the forward LSTM outputs predicts the word of the next time step, and each of the backward LSTM outputs predicts the previous word.",2 Model,[0],[0]
"For example, if the current sentence is “I am happy”, the forward LSTM predicts “am happy <eos>” and the backward LSTM predicts “<bos> I am”.",2 Model,[0],[0]
"This objective encourages the BLSTM layers and the embedding layers to learn linguistically general-purpose representations, which are also useful for specific downstream tasks (Rei, 2017).",2 Model,[0],[0]
"We adopted the bidirectional language modeling objective, where the sum of the common BLSTM and the private BLSTM is used as the input to the language modeling module.",2 Model,[0],[0]
"It can be formulated as:
Ll = − S∑
i=1",2 Model,[0],[0]
N∑ j=1 log (P (wj+1|fj)),2 Model,[0],[0]
"+
log (P (wj−1|bj)) , (3)
where fj and bj represent the j-th outputs of the forward direction and the backward direction, respectively, given the output sum of the common BLSTM and the private BLSTM.
",2 Model,[0],[0]
"All the three loss functions are added to be optimized altogether as:
L = ws",2 Model,[0],[0]
"(Lp + λLa + λLl) , (4)
where λ is gradually increased from 0 to 1 as epoch increases so that the model is stably trained with auxiliary objectives (Ganin et al., 2016).",2 Model,[0],[0]
ws is used to give different weights to the source language and the target language.,2 Model,[0],[0]
"Since the source language has a larger train set and we are focusing on improving the performance of the target language, ws is set to 1 when training the target language.",2 Model,[0],[0]
"For the source language, instead, it is set as the size of the target train set divided by the size of the source train set.",2 Model,[0],[0]
"For the evaluation, we used the POS datasets from 14 different languages in Universal Dependencies corpus 1.4 (Nivre et al., 2016).",3 Experiments,[0],[0]
"We used English as the source language, which is with 12,543 training sentences.2",3 Experiments,[0],[0]
We chose datasets with 1k to 14k training sentences.,3 Experiments,[0],[0]
"The number of tag labels differs for each language from 15 to 18 though most of them are overlapped within the languages.
",3 Experiments,[0],[0]
"Table 1 shows the POS tagging accuracies of different transfer learning models when we limited the number of training sentences of the target languages to be the same as 1,280 for fair comparison among different languages.",3 Experiments,[0],[0]
The remainder training examples of the target languages are still used for both language-adversarial training and bidirectional language modeling since the objectives do not require tag labels.,3 Experiments,[0],[0]
Training with only the train sets in the target languages (c) showed 91.61% on average.,3 Experiments,[0],[0]
"When bidirectional language modeling objective is used (c, l), the accuracies were significantly increased to 92.82% on average.",3 Experiments,[0],[0]
"Therefore, we used the bidirectional language modeling for all the transfer learning evaluations.
",3 Experiments,[0],[0]
"With transfer learning, the three cases of using only the common BLSTM (c), using only the private BLSTMs (p), and using both (c, p) were evaluated.",3 Experiments,[0],[0]
"They showed better average accuracies than target only cases, but they showed mixed results.",3 Experiments,[0],[0]
"However, our proposed model (c, p, l + a), which utilizes both the common BLSTM with language-adversarial training and the private BLSTMs, showed the highest average score, 93.26%.",3 Experiments,[0],[0]
"For all the Germanic languages, where the source language also belongs to, the accuracies are significantly higher than those of
2The accuracies of English POS tagging are 94.01 and 94.33 for models without the bidirectional language modeling and with it, respectively.
",3 Experiments,[0],[0]
other transfer learning models.,3 Experiments,[0],[0]
"For the languages belonging to Slavic, Romance, or Indo-Iranian, our model shows competitive performance with the highest average accuracies among the compared models.",3 Experiments,[0],[0]
"Since languages in the same family are more likely to be similar and compatible, it is expected that the gain from the knowledge transfer to the languages in the same family to be higher than transferring to the languages in different families, which was shown in the results.",3 Experiments,[0],[0]
"This shows that utilizing both language-general representations that are encouraged to be more language-agnostic and language-specific representations effectively helps improve the POS tagging performance with transfer learning.
",3 Experiments,[0],[0]
Table 2 shows the results when using 320 taglabeled training sentences.,3 Experiments,[0],[0]
"In this case, transfer learning methods still show better accuracies than target-only approaches on average.",3 Experiments,[0],[0]
"However, the performance gain is weakened compared to using 1,280 labeled training sentences and there are some mixed results.",3 Experiments,[0],[0]
"In several cases, just utilizing private BLSTMs without the common BLSTM showed better accuracies than utilizing the common BLSTM.
",3 Experiments,[0],[0]
"When training with only 32 tag-labeled sentences, which is an extremely low-resourced setting, transfer learning methods still showed better accuracies than target-only methods on average.",3 Experiments,[0],[0]
"However, not using the common BLSTM
in transfer learning models showed better performance than using it on average.3",3 Experiments,[0],[0]
The main reason would be that we are not given a sufficient number of labeled training sentences to train both the common BLSTM and the private BLSTMs.,3 Experiments,[0],[0]
"In this case, just having private BLSTMs without the common BLSTM can show better performance.",3 Experiments,[0],[0]
"We also evaluated the opposite cases, which use all the tag-labeled training sentences in the target languages, and they showed mixed results.",3 Experiments,[0],[0]
"For example, the accuracy of German with the target only model is 93.31% while that of the proposed model is 93.04%.",3 Experiments,[0],[0]
"This is expected since transfer learning is effective when the target train set is small.
",3 Experiments,[0],[0]
An extension of this work is utilizing multiple languages as the source languages.,3 Experiments,[0],[0]
"Since we have four languages for each of Germanic, Slavic, and Romance language families, we evaluated the performance of those languages using the other languages in the same families as the source languages expecting that languages in the same language family are more likely to be helpful each other.",3 Experiments,[0],[0]
"For the efficiency, we performed multi-task learning for multiple languages rather than differentiating the targets from sources.",3 Experiments,[0],[0]
"When we tried to use 1,280, 320, and 32 tag-labeled training sentences for each language in the multi-source settings, the results showed noticeably better per-
3The results in detail are shown in the first authors dissertation Kim (2017).
formance than the results of using English as a single source language.",3 Experiments,[0],[0]
"Considering that utilizing 1,280*3=3,840, 320*3=960, or 32*3=96 tag labels from three other languages showed better results than using 12,543 English tag labels as the source, we can see that the knowledge transfer from multiple languages can be more helpful than that from single resource-rich source language.",3 Experiments,[0],[0]
"We also tried to use Wasserstein distance (Arjovsky et al., 2017) for the adversarial training in the multi-source settings, but there were no significant differences on average.4
Implementation Details All the models were optimized using ADAM (Kingma and Ba, 2015)5 with minibatch size 32 for total 100 epochs and we picked the parameters showing the best accuracy on the development set to report the score on the test set.",3 Experiments,[0],[0]
The dimensionalites of all the BLSTM related layers follow Plank et al. (2016)’s model.,3 Experiments,[0],[0]
Each word vector is 128 dimensional and each character vector is 100 dimensional.,3 Experiments,[0],[0]
"They are randomly initialized with Xavier initialization (Glorot and Bengio, 2010).",3 Experiments,[0],[0]
"For stable training, we use gradient clipping, where the threshold is set to 5.",3 Experiments,[0],[0]
"The dimensionality of each hidden output of LSTMs is 100, and the hidden outputs of both forward LSTM and backward LSTM are concatenated, thereby the output of each BLSTM for each time step is 200.",3 Experiments,[0],[0]
"Therefore, the input to the common BLSTM and the private BLSTM is 128+200=328
4The extended work in detail are shown in Kim (2017).",3 Experiments,[0],[0]
"5learning rate=0.001, β1 = 0.9, β2 = 0.999, = 1e− 8.
dimensional.",3 Experiments,[0],[0]
"The inputs and the outputs of the BLSTMs are regularized with dropout rate 0.5 (Pham et al., 2014).",3 Experiments,[0],[0]
"For the consistent dropout usages, we let the dropout masks to be identical for all the time steps of each sentence (Gal and Ghahramani, 2016).",3 Experiments,[0],[0]
"For all the BLSTMs, forget biases are initialized with 1 (Jozefowicz et al., 2015) and the other biases are initialized with 0.",3 Experiments,[0],[0]
"Each convolution filter output for the sentence encoding is 64 dimensional, and the three filter outputs are concatenated to represent each sentence with a 192 dimensional vector.",3 Experiments,[0],[0]
We introduced a cross-lingual transfer learning model for POS tagging which uses separate BLSTMs for language-general and languagespecific representations.,4 Conclusion,[0],[0]
"Evaluating on 14 different languages, including the source language improved tagging accuracies in almost all the cases.",4 Conclusion,[0],[0]
"Specifically, our model showed noticeably better performance when the source language and the target languages belong to the same language family, and competitively performed with the highest average accuracies for target languages in different families.",4 Conclusion,[0],[0]
We thank the anonymous reviewers for their helpful comments.,Acknowledgments,[0],[0]
All the experiments in this work were conducted with machines at Ohio Supercomputer Center (1987).,Acknowledgments,[0],[0]
Training a POS tagging model with crosslingual transfer learning usually requires linguistic knowledge and resources about the relation between the source language and the target language.,abstractText,[0],[0]
"In this paper, we introduce a cross-lingual transfer learning model for POS tagging without ancillary resources such as parallel corpora.",abstractText,[0],[0]
"The proposed cross-lingual model utilizes a common BLSTM that enables knowledge transfer from other languages, and private BLSTMs for language-specific representations.",abstractText,[0],[0]
The cross-lingual model is trained with language-adversarial training and bidirectional language modeling as auxiliary objectives to better represent language-general information while not losing the information about a specific target language.,abstractText,[0],[0]
"Evaluating on POS datasets from 14 languages in the Universal Dependencies corpus, we show that the proposed transfer learning model improves the POS tagging performance of the target languages without exploiting any linguistic knowledge between the source language and the target language.",abstractText,[0],[0]
Cross-Lingual Transfer Learning for POS Tagging without Cross-Lingual Resources,title,[0],[0]
"Proceedings of the 52nd Annual Meeting of the Association for Computational Linguistics, pages 998–1008, Baltimore, Maryland, USA, June 23-25 2014. c©2014 Association for Computational Linguistics",text,[0],[0]
"Discourse structure, logical flow of sentences, and context play a large part in ordering medical events based on temporal relations within a clinical narrative.",1 Introduction,[0],[0]
"However, cross-narrative temporal relation ordering is a challenging task as it is difficult to learn temporal relations among medical events which are not part of the logically coherent discourse of a single narrative.",1 Introduction,[0],[0]
"Resolving crossnarrative temporal relationships between medical events is essential to the task of generating an event timeline from across unstructured clinical narratives such as admission notes, radiology reports, history and physical reports and discharge summaries.",1 Introduction,[0],[0]
"Such a timeline has multiple applications in clinical trial recruitment (Luo et al., 2011), medical document summarization (Bramsen et al.,
2006, Reichert et al., 2010) and clinical decision making (Demner-Fushman et al., 2009).
",1 Introduction,[0],[0]
"Given multiple temporally ordered medical event sequences generated from each clinical narrative in a patient record, how can we combine the events to create a timeline across all the narratives?",1 Introduction,[0],[0]
"The tendency to copy-paste text and summarize past information in newly generated clinical narratives leads to multiple mentions of the same medical event across narratives (Cohen et al., 2013).",1 Introduction,[0],[0]
These cross-narrative coreferences act as important anchors for reasoning with information across narratives.,1 Introduction,[0],[0]
We leverage crossnarrative coreference information along with confident cross-narrative temporal relation predictions and learn to align and temporally order medical event sequences across longitudinal clinical narratives.,1 Introduction,[0],[0]
We model the problem as a sequence alignment task and propose solving this using two approaches.,1 Introduction,[0],[0]
"First, we use weighted finite state machines to represent medical events sequences, thus enabling composition and search to obtain the most probable combined sequence of medical events.",1 Introduction,[0],[0]
"As a contrast, we adapt dynamic programming algorithms (Needleman et al., 1970, Smith and Waterman, 1981) used to produce global and local alignments for aligning sequences of medical events across narratives.",1 Introduction,[0],[0]
"We also compare the proposed methods with an Integer Linear Programming (ILP) based method for timeline construction (Do et al., 2012).",1 Introduction,[0],[0]
"The cross-narrative coreference and temporal relation scores used in both these approaches are learned from a corpus of patient narratives from The Ohio State University Wexner Medical Center.
",1 Introduction,[0],[0]
The main contribution of this paper is a general framework that allows aligning multiple event sequences using cascaded weighted finite state transducers (WFSTs) with the help of efficient composition and decoding.,1 Introduction,[0],[0]
"Moreover, we demonstrate that this method can be used for more accurate multiple sequence alignment when compared to
998
dynamic programming or other ILP-based methods proposed in literature.",1 Introduction,[0],[0]
"In the areas of summarization and text-to-text generation, there has been prior work on several ordering strategies to order pieces of information extracted from different input documents (Barzilay et al., 2002, Lapata, 2003, Bollegala et al., 2010).",2 Related Work,[0],[0]
"In this paper, we focus on temporal ordering of information, as discussed next.
",2 Related Work,[0],[0]
"Recent state-of-the art research has focused on the problem of temporal relation learning within the same document, and in many cases within the same sentence (Mani et al., 2006, Verhagen et al., 2009, Lapata and Lascarides, 2011).",2 Related Work,[0],[0]
"Chambers and Jurafsky (2009) describe a process to induce a partially ordered set of events related by a common protagonist by using an unsupervised distributional method to learn relations between events sharing coreferring arguments, followed by temporal classification to induce partial order.",2 Related Work,[0],[0]
"The task was carried out on the Timebank newswire corpus, but was limited to an intra-document setting.",2 Related Work,[0],[0]
"More recently, (Do et al., 2012) proposed an ILP-based method to combine the outputs of an event-interval and an event-event classifier for timeline construction on the ACE 2005 corpus.",2 Related Work,[0],[0]
"However, this approach is also restricted to events within documents and requires annotations for event intervals.",2 Related Work,[0],[0]
We empirically compare our methods for timeline creation from longitudinal clinical narratives to such an ILP-based approach in Section 7.,2 Related Work,[0],[0]
"While a lot of this work has been done in the news domain, there is also some recent work in rule-based algorithms (Zhou et al., 2006) and machine learning (Roberts et al., 2008) applied to temporal relations between medical events in clinical text.",2 Related Work,[0],[0]
"Clinical narratives are written in a distinct sub-language with domain specific terminology and temporal characteristics, making them markedly different from newswire text.
",2 Related Work,[0],[0]
There is limited prior work in learning relations across documents.,2 Related Work,[0],[0]
"Ji and Grishman (2008) extended the one sense per discourse idea (Yarowsky, 1995) to multiple topically related documents and propagate consistent event arguments across sentences and documents.",2 Related Work,[0],[0]
Barzilay and McKeown (2005) propose a text-to-text generation technique for synthesizing common information across documents using sentence fusion.,2 Related Work,[0],[0]
"This involves multisequence dependency tree alignment to identify phrases conveying sim-
ilar information and statistical generation to combine common phrases into a sentence.",2 Related Work,[0],[0]
"Along with syntactic features, they combine knowledge from resources like WordNet to find similar sentences.",2 Related Work,[0],[0]
"In case of clinical narratives and medical event alignment, the objective is to identify a unique sequence of temporally ordered medical events from across longitudinal clinical data.
",2 Related Work,[0],[0]
"To the best of our knowledge, there is no prior work on cross-document alignment of event sequences.",2 Related Work,[0],[0]
"Multiple sequence alignment is a problem that arises in a variety of domains including gene/protein alignments in bioinformatics (Notredame, 2002), word alignments in machine translation (Kumar and Byrne, 2003), and sentence alignments for summarization (Lacatusu et al., 2004).",2 Related Work,[0],[0]
