0,1,label2,summary_sentences
"Varying the degree of reward sparsity: We consider three setups with “dense”, “sparse” and “very-sparse” rewards (see Figure 4b).",4.1. Sparse Extrinsic Reward Setting,[0],[0]
"In these settings, the reward is always terminal and the episode terminates upon reaching goal or after a maximum of 2100 steps.",4.1. Sparse Extrinsic Reward Setting,[0],[0]
"In the “dense” reward case, the agent is randomly spawned in any of the 17 possible spawning locations uniformly distributed across the map.",4.1. Sparse Extrinsic Reward Setting,[0],[0]
This is not a hard exploration task because sometimes the agent is randomly initialized close to the goal and therefore by random -greedy exploration it can reach the goal with reasonably high probability.,4.1. Sparse Extrinsic Reward Setting,[0],[0]
"In the “sparse” and “very sparse” reward cases, the agent is always spawned in Room-13 and Room-17 respectively which are 270 and 350 steps away from the goal under an optimal policy.",4.1. Sparse Extrinsic Reward Setting,[0],[0]
"A long sequence of directed actions is required to reach the goals from these rooms, making these settings hard goal directed exploration problems.
",4.1. Sparse Extrinsic Reward Setting,[0],[0]
"Results shown in Figure 5 indicate that while the performance of the baseline A3C degrades with sparser rewards, curious A3C agents are superior in all cases.",4.1. Sparse Extrinsic Reward Setting,[0],[0]
"In the “dense” reward case, curious agents learn much faster indicating more efficient exploration of the environment as compared to -greedy exploration of the baseline agent.",4.1. Sparse Extrinsic Reward Setting,[0],[0]
One possible explanation of the inferior performance of ICM-pixels in comparison to ICM is that in every episode the agent is spawned in one out of seventeen rooms with different textures.,4.1. Sparse Extrinsic Reward Setting,[0],[0]
"It is hard to learn a pixel-prediction model as the number of textures increases.
",4.1. Sparse Extrinsic Reward Setting,[0],[0]
"In the “sparse” reward case, as expected, the baseline A3C agent fails to solve the task, while the curious A3C agent is able to learn the task quickly.",4.1. Sparse Extrinsic Reward Setting,[0],[0]
"Note that ICM-pixels and ICM have similar convergence because, with a fixed spawning location of the agent, the ICM-pixels encounters the same textures at the starting of each episode which makes learning the pixel-prediction model easier as compared to the “dense” reward case.",4.1. Sparse Extrinsic Reward Setting,[0],[0]
"Finally, in the “very sparse” reward case, both the A3C agent and ICM-pixels never succeed, while the ICM agent achieves a perfect score in 66% of the random runs.",4.1. Sparse Extrinsic Reward Setting,[0],[0]
"This indicates that ICM is better suited than ICM-pixels and vanilla A3C for hard goal directed exploration tasks.
",4.1. Sparse Extrinsic Reward Setting,[0],[0]
"Robustness to uncontrollable dynamics For testing the robustness of the proposed ICM formulation to changes in the environment that do not affect the agent, we augmented the agent’s observation with a fixed region of white noise which made up 40% of the image (see Figure 3b).",4.1. Sparse Extrinsic Reward Setting,[0],[0]
"In VizDoom 3-D navigation, ideally the agent should be unaffected by this noise as the noise does not affect the agent in anyway and is merely a nuisance.",4.1. Sparse Extrinsic Reward Setting,[0],[0]
Figure 6 compares the performance of ICM against some baseline methods on the “sparse” reward setup described above.,4.1. Sparse Extrinsic Reward Setting,[0],[0]
"While, the proposed ICM agent achieves a perfect score, ICM-pixels suffers significantly despite having succeeded at the “sparse reward” task when the inputs were not augmented with any noise (see Figure 5b).",4.1. Sparse Extrinsic Reward Setting,[0],[0]
"This indicates that in contrast to ICM-pixels, ICM is insensitive to nuisance changes in the environment.
",4.1. Sparse Extrinsic Reward Setting,[0],[0]
"Comparison to TRPO-VIME We now compare our curious agent against variational information maximization agent trained with TRPO (Houthooft et al., 2016) for the
VizDoom “sparse” reward setup described above.",4.1. Sparse Extrinsic Reward Setting,[0],[0]
TRPO is in general more sample efficient than A3C but takes a lot more wall-clock time.,4.1. Sparse Extrinsic Reward Setting,[0],[0]
We do not show these results in plots because TRPO and A3C have different setups.,4.1. Sparse Extrinsic Reward Setting,[0],[0]
"The hyperparameters and accuracy for the TRPO and VIME results follow from the concurrent work (Fu et al., 2017).",4.1. Sparse Extrinsic Reward Setting,[0],[0]
"Despite the sample efficiency of TRPO, we see that our ICM agents work significantly better than TRPO and TRPO-VIME, both in terms of convergence rate and accuracy.",4.1. Sparse Extrinsic Reward Setting,[0],[0]
"Results are shown in the Table below:
Method Mean (Median) Score (“sparse” reward setup) (at convergence)
TRPO 26.0 % ( 0.0 %) A3C 0.0 % ( 0.0 %) VIME + TRPO 46.1 % ( 27.1 %)
",4.1. Sparse Extrinsic Reward Setting,[0],[0]
"ICM + A3C 100.0 % (100.0 %)
",4.1. Sparse Extrinsic Reward Setting,[0],[0]
"As a sanity check, we replaced the curiosity network with random noise sources and used them as the curiosity reward.",4.1. Sparse Extrinsic Reward Setting,[0],[0]
"We performed systematic sweep across different distribution parameters in the “sparse” reward case: uniform, Gaussian and Laplacian.",4.1. Sparse Extrinsic Reward Setting,[0],[0]
We found that none of these agents were able to reach the goal showing that our curiosity module does not learn degenerate solutions.,4.1. Sparse Extrinsic Reward Setting,[0],[0]
A good exploration policy is one which allows the agent to visit as many states as possible even without any goals.,4.2. No Reward Setting,[0],[0]
"In the case of 3-D navigation, we expect a good exploration policy to cover as much of the map as possible; in the case of playing a game, we expect it to visit as many game states as possible.",4.2. No Reward Setting,[0],[0]
"In order to test if our agent can learn a good exploration policy, we trained it on VizDoom and Mario without any rewards from the environment.",4.2. No Reward Setting,[0],[0]
"We then evaluated what portion of the map was explore (for VizDoom), and how much progress it made (for Mario) in this setting.",4.2. No Reward Setting,[0],[0]
"To our surprise, we have found that in both cases, the noreward agent was able to perform quote well (see video at http://pathak22.github.io/noreward_rl/).
",4.2. No Reward Setting,[0],[0]
VizDoom: Coverage during Exploration.,4.2. No Reward Setting,[0],[0]
"An agent trained with no extrinsic rewards was able to learn to navigate corridors, walk between rooms and explore many rooms in the 3-D Doom environment.",4.2. No Reward Setting,[0],[0]
On many occasions the agent traversed the entire map and reached rooms that were farthest away from the room it was initialized in.,4.2. No Reward Setting,[0],[0]
"Given that the episode terminates in 2100 steps and farthest rooms are over 250 steps away (for an optimally-moving agent), this result is quite remarkable, demonstrating that it is possible to learn useful skills without the requirement of any external supervision of rewards.",4.2. No Reward Setting,[0],[0]
Example explorations are shown in Figure 7.,4.2. No Reward Setting,[0],[0]
"The first 3 maps show our agent ex-
plore a much larger state space without any extrinsic signal, compared to a random exploration agent (last two maps), which often has hard time getting around local minima of state spaces, e.g. getting stuck against a wall and not able to move (see video).
",4.2. No Reward Setting,[0],[0]
Mario: Learning to play with no rewards.,4.2. No Reward Setting,[0],[0]
We train our agent in the Super Mario World using only curiosity based signal.,4.2. No Reward Setting,[0],[0]
"Without any extrinsic reward from environment, our Mario agent can learn to cross over 30% of Level-1.",4.2. No Reward Setting,[0],[0]
"The agent received no reward for killing or dodging enemies or avoiding fatal events, yet it automatically discovered these behaviors (see video).",4.2. No Reward Setting,[0],[0]
"One possible reason is because getting killed by the enemy will result in only seeing a small part of the game space, making its curiosity saturate.",4.2. No Reward Setting,[0],[0]
"In order to remain curious, it is in the agent’s interest to learn how to kill and dodge enemies so that it can reach new parts of the game space.",4.2. No Reward Setting,[0],[0]
"This suggests that curiosity provides indirect supervision for learning interesting behaviors.
",4.2. No Reward Setting,[0],[0]
"To the best of our knowledge, this is the first demonstration where the agent learns to navigate in a 3D environment and discovers how to play a game by making use of relatively complex visual imagery directly from pixels, without any extrinsic rewards.",4.2. No Reward Setting,[0],[0]
"There are several prior works that use reinforcement learning to navigate in 3D environments from pixel inputs or playing ATARI games such as (Mirowski et al., 2017; Mnih et al., 2015; 2016), but they rely on intermediate external rewards provided by the environment.",4.2. No Reward Setting,[0],[0]
In the previous section we showed that our agent learns to explore large parts of the space where its curiosity-driven exploration policy was trained.,4.3. Generalization to Novel Scenarios,[0],[0]
"However, it remains unclear whether the agent has done this by learning “generalized skills” for efficiently exploring its environment, or if it simply memorized the training set.",4.3. Generalization to Novel Scenarios,[0],[0]
"In other words we would like to know, when exploring a space, how much of the learned behavior is specific to that particular space and how much is general enough to be useful in novel scenar-
ios?",4.3. Generalization to Novel Scenarios,[0],[0]
"To investigate this question, we train a no reward exploratory behavior in one scenario (e.g. Level-1 of Mario) and then evaluate the resulting exploration policy in three different ways: a) apply the learned policy “as is” to a new scenario; b) adapt the policy by fine-tuning with curiosity reward only; c) adapt the policy to maximize some extrinsic reward.",4.3. Generalization to Novel Scenarios,[0],[0]
"Happily, in all three cases, we observe some promising generalization results:
Evaluate “as is”: We evaluate the policy trained by maximizing curiosity on Level-1 of Mario on subsequent levels without adapting the learned policy in any way.",4.3. Generalization to Novel Scenarios,[0],[0]
"We measure the distance covered by the agent as a result of executing this policy on Levels 1, 2, and 3, as shown in Table 1.",4.3. Generalization to Novel Scenarios,[0],[0]
"We note that the policy performs surprisingly well on Level 3, suggesting good generalization, despite the fact that Level-3 has different structures and enemies compared to Level-1.",4.3. Generalization to Novel Scenarios,[0],[0]
"However, note that the running “as is” on Level2 does not do well.",4.3. Generalization to Novel Scenarios,[0],[0]
"At first, this seems to contradict the generalization results on Level-3.",4.3. Generalization to Novel Scenarios,[0],[0]
"However, note that Level-3 has similar global visual appearance (day world with sunlight) to Level-1, whereas Level-2 is significantly different (night world).",4.3. Generalization to Novel Scenarios,[0],[0]
"If this is indeed the issue, then it should be possible to quickly adapt the exploration policy to Level-2 with a little bit of “fine-tuning”.",4.3. Generalization to Novel Scenarios,[0],[0]
"We will explore this below.
",4.3. Generalization to Novel Scenarios,[0],[0]
Fine-tuning with curiosity only: From Table 1 we see that when the agent pre-trained (using only curiosity as reward) on Level-1 is fine-tuned (using only curiosity as reward) on Level-2 it quickly overcomes the mismatch in global visual appearance and achieves a higher score than training from scratch with the same number of iterations.,4.3. Generalization to Novel Scenarios,[0],[0]
"Interestingly, training “from scratch” on Level-2 is worse than the fine-tuned policy, even when training for more iterations than pre-training + fine-tuning combined.",4.3. Generalization to Novel Scenarios,[0],[0]
"One possible reason is that Level-2 is more difficult than Level1, so learning the basic skills such as moving, jumping, and killing enemies from scratch is much more dangerous than in the relative “safety” of Level-1.",4.3. Generalization to Novel Scenarios,[0],[0]
"This result, therefore might suggest that first pre-training on an earlier level
and then fine-tuning on a later one produces a form of curriculum which aids learning and generalization.",4.3. Generalization to Novel Scenarios,[0],[0]
"In other words, the agent is able to use the knowledge it acquired by playing Level-1 to better explore the subsequent levels.",4.3. Generalization to Novel Scenarios,[0],[0]
"Of course, the game designers do this on purpose to allow the human players to gradually learn to play the game.
",4.3. Generalization to Novel Scenarios,[0],[0]
"However, interestingly, fine-tuning the exploration policy pre-trained on Level-1 to Level-3 deteriorates the performance, compared to running “as is”.",4.3. Generalization to Novel Scenarios,[0],[0]
This is because Level3 is very hard for the agent to cross beyond a certain point – the agent hits a curiosity blockade and is unable to make any progress.,4.3. Generalization to Novel Scenarios,[0],[0]
"As the agent has already learned about parts of the environment before the hard point, it receives almost no curiosity reward and as a result it attempts to update its policy with almost zero intrinsic rewards and the policy slowly degenerates.",4.3. Generalization to Novel Scenarios,[0],[0]
"This behavior is vaguely analogous to boredom, where if the agent is unable to make progress it gets bored and stops exploring.
",4.3. Generalization to Novel Scenarios,[0],[0]
"Fine-tuning with extrinsic rewards: If it is the case that the agent has actually learned useful exploratory behavior, then it should be able to learn quicker than starting from scratch even when external rewards are provided by environment.",4.3. Generalization to Novel Scenarios,[0],[0]
We perform this evaluation on VizDoom where we pre-train the agent using curiosity reward on a map showed in Figure 4a.,4.3. Generalization to Novel Scenarios,[0],[0]
"We then test on the “very sparse” reward setting of ‘DoomMyWayHome-v0’ environment which uses a different map with novel textures (see Figure 4b) as described earlier in Section 4.1.
",4.3. Generalization to Novel Scenarios,[0],[0]
Results in Figure 8 show that the ICM agent pre-trained only with curiosity and then fine-tuned with external reward learns faster and achieves higher reward than an ICM agent trained from scratch to jointly maximize curiosity and the external rewards.,4.3. Generalization to Novel Scenarios,[0],[0]
This result confirms that the learned exploratory behavior is also useful when the agent is required to achieve goals specified by the environment.,4.3. Generalization to Novel Scenarios,[0],[0]
It is also worth noting that ICM-pixels does not generalize to this test environment.,4.3. Generalization to Novel Scenarios,[0],[0]
This indicates that the proposed mechanism of measuring curiosity is significantly better for learning skills that generalize as compared to measuring curiosity in the raw sensory space.,4.3. Generalization to Novel Scenarios,[0],[0]
"Curiosity-driven exploration is a well studied topic in the reinforcement learning literature and a good summary can be found in (Oudeyer & Kaplan, 2009; Oudeyer et al., 2007).",5. Related Work,[0],[0]
Schmidhuber (1991; 2010) and Sun et al. (2011) use surprise and compression progress as intrinsic rewards.,5. Related Work,[0],[0]
Classic work of Kearns et al. (1999) and Brafman et al. (2002) propose exploration algorithms polynomial in the number of state space parameters.,5. Related Work,[0],[0]
"Others have used empowerment, which is the information gain based on entropy of actions, as intrinsic rewards (Klyubin et al., 2005; Mohamed & Rezende, 2015).",5. Related Work,[0],[0]
Stadie et al. (2015) use prediction error in the feature space of an auto-encoder as a measure of interesting states to explore.,5. Related Work,[0],[0]
"State visitation counts have also been investigated for exploration (Bellemare et al., 2016; Oh et al., 2015; Tang et al., 2016).",5. Related Work,[0],[0]
"Osband et al. (2016) train multiple value functions and makes
use of bootstrapping and Thompson sampling for exploration.",5. Related Work,[0],[0]
"Many approaches measure information gain for exploration (Little & Sommer, 2014; Still & Precup, 2012; Storck et al., 1995).",5. Related Work,[0],[0]
Houthooft et al. (2016) use an exploration strategy that maximizes information gain about the agent’s belief of the environment’s dynamics.,5. Related Work,[0],[0]
"Our approach of jointly training forward and inverse models for learning a feature space has similarities to (Agrawal et al., 2016; Jordan & Rumelhart, 1992; Wolpert et al., 1995), but these works use the learned models of dynamics for planning a sequence of actions instead of exploration.",5. Related Work,[0],[0]
"The idea of using a proxy task to learn a semantic feature embedding has been used in a number of works on self-supervised learning in computer vision (Agrawal et al., 2015; Doersch et al., 2015; Goroshin et al., 2015; Jayaraman & Grauman, 2015; Pathak et al., 2016; Wang & Gupta, 2015).
",5. Related Work,[0],[0]
Concurrent work: A number of interesting related papers have appeared on Arxiv while the present work was in submission.,5. Related Work,[0],[0]
Sukhbaatar et al. (2017) generates supervision for pre-training via asymmetric self-play between two agents to improve data efficiency during fine-tuning.,5. Related Work,[0],[0]
"Several methods propose improving data efficiency of RL algorithms using self-supervised prediction based auxiliary tasks (Jaderberg et al., 2017; Shelhamer et al., 2017).",5. Related Work,[0],[0]
"Fu et al. (2017) learn discriminative models, and Gregor et al. (2017) use empowerment based measure to tackle exploration in sparse reward setups.",5. Related Work,[0],[0]
"In this work we propose a mechanism for generating curiosity-driven intrinsic reward signal that scales to high dimensional visual inputs, bypasses the difficult problem of predicting pixels and ensures that the exploration strategy of the agent is unaffected by nuisance factors in the environment.",6. Discussion,[0],[0]
"We demonstrate that our agent significantly outperforms the baseline A3C with no curiosity, a recently proposed VIME (Houthooft et al., 2016) formulation for exploration, and a baseline pixel-predicting formulation.
",6. Discussion,[0],[0]
In VizDoom our agent learns the exploration behavior of moving along corridors and across rooms without any rewards from the environment.,6. Discussion,[0],[0]
In Mario our agent crosses more than 30% of Level-1 without any rewards from the game.,6. Discussion,[0],[0]
One reason why our agent is unable to go beyond this limit is the presence of a pit at 38% of the game that requires a very specific sequence of 15-20 key presses in order to jump across it.,6. Discussion,[0],[0]
"If the agent is unable to execute this sequence, it falls in the pit and dies, receiving no further rewards from the environment.",6. Discussion,[0],[0]
Therefore it receives no gradient information indicating that there is a world beyond the pit that could potentially be explored.,6. Discussion,[0],[0]
"This issue is somewhat orthogonal to developing models of curiosity, but presents a challenging problem for policy learning.
",6. Discussion,[0],[0]
It is common practice to evaluate reinforcement learning approaches in the same environment that was used for training.,6. Discussion,[0],[0]
"However, we feel that it is also important to evaluate on a separate “testing set” as well.",6. Discussion,[0],[0]
"This allows us to gauge how much of what has been learned is specific to the training environment (i.e. memorized), and how much might constitute “generalizable skills” that could be applied to new settings.",6. Discussion,[0],[0]
"In this paper, we evaluate generalization in two ways: 1) by applying the learned policy to a new scenario “as is” (no further learning), and 2) by finetuning the learned policy on a new scenario (we borrow the pre-training/fine-tuning nomenclature from the deep feature learning literature).",6. Discussion,[0],[0]
We believe that evaluating generalization is a valuable tool and will allow the community to better understand the performance of various reinforcement learning algorithms.,6. Discussion,[0],[0]
"To further aid in this effort, we will make the code for our algorithm, as well as testing and environment setups freely available online.
",6. Discussion,[0],[0]
"An interesting direction of future research is to use the learned exploration behavior/skill as a motor primitive/lowlevel policy in a more complex, hierarchical system.",6. Discussion,[0],[0]
"For example, our VizDoom agent learns to walk along corridors instead of bumping into walls.",6. Discussion,[0],[0]
"This could be a useful primitive for a navigation system.
",6. Discussion,[0],[0]
"While the rich and diverse real world provides ample opportunities for interaction, reward signals are sparse.",6. Discussion,[0],[0]
Our approach excels in this setting and converts unexpected interactions that affect the agent into intrinsic rewards.,6. Discussion,[0],[0]
However our approach does not directly extend to the scenarios where “opportunities for interactions” are also rare.,6. Discussion,[0],[0]
"In theory, one could save such events in a replay memory and use them to guide exploration.",6. Discussion,[0],[0]
"However, we leave this extension for future work.
",6. Discussion,[0],[0]
"Acknowledgements: We would like to thank Sergey Levine, Evan Shelhamer, Saurabh Gupta, Phillip Isola and other members of the BAIR lab for fruitful discussions and comments.",6. Discussion,[0],[0]
We thank Jacob Huh for help with Figure 2 and Alexey Dosovitskiy for VizDoom maps.,6. Discussion,[0],[0]
"This work was supported in part by NSF IIS-1212798, IIS-1427425, IIS1536003, IIS-1633310, ONR MURI N00014-14-1-0671, Berkeley DeepDrive, equipment grant from Nvidia, and the Valrhona Reinforcement Learning Fellowship.",6. Discussion,[0],[0]
"In many real-world scenarios, rewards extrinsic to the agent are extremely sparse, or absent altogether.",abstractText,[0],[0]
"In such cases, curiosity can serve as an intrinsic reward signal to enable the agent to explore its environment and learn skills that might be useful later in its life.",abstractText,[0],[0]
We formulate curiosity as the error in an agent’s ability to predict the consequence of its own actions in a visual feature space learned by a self-supervised inverse dynamics model.,abstractText,[0],[0]
"Our formulation scales to high-dimensional continuous state spaces like images, bypasses the difficulties of directly predicting pixels, and, critically, ignores the aspects of the environment that cannot affect the agent.",abstractText,[0],[0]
"The proposed approach is evaluated in two environments: VizDoom and Super Mario Bros. Three broad settings are investigated: 1) sparse extrinsic reward, where curiosity allows for far fewer interactions with the environment to reach the goal; 2) exploration with no extrinsic reward, where curiosity pushes the agent to explore more efficiently; and 3) generalization to unseen scenarios (e.g. new levels of the same game) where the knowledge gained from earlier experience helps the agent explore new places much faster than starting from scratch.",abstractText,[0],[0]
Curiosity-driven Exploration by Self-supervised Prediction,title,[0],[0]
"Biological organisms can learn to perform tasks (and often do) by observing a sequence of labeled events, just like supervised machine learning.",1. Introduction,[0],[0]
"But unlike machine learning, in human learning supervision is often accompanied by a curriculum.",1. Introduction,[0],[0]
Thus the order of presented examples is rarely random when a human teacher teaches another human.,1. Introduction,[0],[0]
"Likewise, the task may be divided by the teacher into smaller sub-tasks, a process sometimes called shaping (Krueger & Dayan, 2009) and typically studied in the context of rein-
1School of Computer Science and Engineering, The Hebrew University of Jerusalem, Jerusalem 91904, Israel.",1. Introduction,[0],[0]
"Correspondence to: Daphna Weinshall <daphna@mail.huji.ac.il>.
",1. Introduction,[0],[0]
"Proceedings of the 35 th International Conference on Machine Learning, Stockholm, Sweden, PMLR 80, 2018.",1. Introduction,[0],[0]
"Copyright 2018 by the author(s).
",1. Introduction,[0],[0]
"forcement learning (e.g. Graves et al., 2017).",1. Introduction,[0],[0]
"Although it remained for the most part in the fringes of machine learning research, curriculum learning has been identified as a key challenge for machine learning throughout (e.g., Mitchell, 1980; 2006; Wang & Cottrell, 2015).
",1. Introduction,[0],[0]
"We focus here on curriculum learning based on ranking (or weighting as in (Bengio et al., 2009)) of the training examples, which is used to guide the order of presentation of examples to the learner.",1. Introduction,[0],[0]
