0,1,label2,summary_sentences
"Using the importance weighting, we determine the final, weighted hidden output state s as
αt ∝ fattention(h(t),p) (3) s = n∑ t=1",4.1 Integrating topic information,[0],[0]
h(t)αt .,4.1 Integrating topic information,[0],[0]
"(4)
Finally, we feed s into a dense layer with a softmax activation function to get predictions for our twoor three-label setups.
",4.1 Integrating topic information,[0],[0]
Contextual BiLSTM (biclstm).,4.1 Integrating topic information,[0],[0]
"A more direct approach to integrating an argument’s topic is the contextual LSTM (CLSTM) architecture (Ghosh et al., 2016), where topic information is added as another term to all four gates of an LSTM cell.",4.1 Integrating topic information,[0],[0]
"We, however, hypothesize that topic information is more relevant at the i- and c-gates, the former because it has the biggest impact on how a new token is processed and the latter because it is closely linked
to how the sequence seen so far is to be interpreted and stored.",4.1 Integrating topic information,[0],[0]
"To this end, we experimented with severalmodifications to the original CLSTMsuch as removing peepholes—i.e., removing gates’ access to the cell state c",4.1 Integrating topic information,[0],[0]
"(Gers and Schmidhuber, 2000)— and removing topic information from one or more gates.",4.1 Integrating topic information,[0],[0]
"Empirical results on the validation set show that topic integration at the i- and c-gates only, and removal of all peephole connections, does indeed outperform the original CLSTM on our task by 1 percentage point.",4.1 Integrating topic information,[0],[0]
"Our modified CLSTM (Fig. 2) is defined as
i t = σ(W xi x t",4.1 Integrating topic information,[0],[0]
+,4.1 Integrating topic information,[0],[0]
"W hiht−1 + bi + Wpi p ) (5)
f t = σ(W x f x t",4.1 Integrating topic information,[0],[0]
+W h f ht−1 + b f ),4.1 Integrating topic information,[0],[0]
"(6) ct = f tct−1 + i tσc(W xc x t +W hcht−1
+bc + Wpc p ) (7)
ot = σ(W xox t",4.1 Integrating topic information,[0],[0]
+,4.1 Integrating topic information,[0],[0]
W hoht−1 + bo) (8) ht = otσc(ct ).,4.1 Integrating topic information,[0],[0]
"(9)
Here i , f , and o represent the input, forget, and output gates; c the cell memory; x t the embedded token of a sentence at timestep t; ht−1 the previous hidden state; and b the bias.",4.1 Integrating topic information,[0],[0]
σ,4.1 Integrating topic information,[0],[0]
"and σc are the activation and recurrent activation functions, respectively.",4.1 Integrating topic information,[0],[0]
The novel terms for topic integration are outlined.,4.1 Integrating topic information,[0],[0]
"We use this model bidirectionally, as we did with our BiLSTM network, and hence refer to it as biclstm.",4.1 Integrating topic information,[0],[0]
"As we want to classify arguments related to specific topics, leveraging information that supports the classifier in the decision of topic-relation is crucial.",4.2 Leveraging additional data,[0],[0]
The multi-task learning (mtl) and transfer learning (trl) models are able to make use of auxiliary data that can potentially improve the results on the main task.,4.2 Leveraging additional data,[0],[0]
"Thus, we extend our previously described models by integrating them into mtl and trl setups.",4.2 Leveraging additional data,[0],[0]
"We also choose to integrate two corpora
from which we expect to learn (a) topic-relevance and (b) the capability to distinguish between supporting and attacking arguments.",4.2 Leveraging additional data,[0],[0]
"The first corpus, DIP2016 (Habernal et al., 2016), consists of 49 queries from the educational domain and 100 documents for each query.",4.2 Leveraging additional data,[0],[0]
Each document has its sentences annotated for relevance (true/false) to the query.4,4.2 Leveraging additional data,[0],[0]
"The second corpus, from SemEval-2016 Task 6 (Mohammad et al., 2016), consists of around 5000 multi-sentence tweets, a corresponding topic (e.g., “atheism”), and the author’s stance on the topic (for/against/neither).
",4.2 Leveraging additional data,[0],[0]
"For our mtl and trl approaches, we consider every possible pairing of a model (biclstm, outer-att, and the bilstm baseline we introduce in §5) with an auxiliary corpus (DIP2016, SemEval).",4.2 Leveraging additional data,[0],[0]
"We formalize our datasets as Sk = {(xki ,pki , yki )|i = 0, . . .",4.2 Leveraging additional data,[0],[0]
", |Sk |}, where k can be either our main dataset or an auxiliary dataset, xki denotes a single sentence as a sequence of word embeddings and yki its corresponding label in k, and pki represents the corresponding averaged topic vector.
",4.2 Leveraging additional data,[0],[0]
Transfer learning (trl).,4.2 Leveraging additional data,[0],[0]
"For trl, we use the approach of parameter transfer (Pan andYang, 2010)— i.e., we do not modify the model used.",4.2 Leveraging additional data,[0],[0]
"Instead, we train the model twice: the first time, we train the model on the chosen auxiliary corpus, and the second time, we keep the trained model’s weights and train it with our own corpus.",4.2 Leveraging additional data,[0],[0]
"For the threelabel setting, we have to modify the transfer model slightly for the DIP2016 corpus, since it provides only two labels for each training sample.",4.2 Leveraging additional data,[0],[0]
"In this case, we simply add a layer with two neurons on top of the layer with three neurons for training with the DIP2016 corpus and remove it afterwards for training with our corpus.
4We only use 300K of the corpus’s 600K samples to ease hyperparameter tuning for our computation-heavy models.
",4.2 Leveraging additional data,[0],[0]
Multi-task learning (mtl).,4.2 Leveraging additional data,[0],[0]
"For mtl, we use a shared–private model (Liu et al., 2017), which showed promising results for text classification and word segmentation (Chen et al., 2017).",4.2 Leveraging additional data,[0],[0]
"(We also experimented with their adversarial approach to learn topic-invariant features, but abandoned this due to low scores.)",4.2 Leveraging additional data,[0],[0]
"The mtl base model consists of a private recurrent neural network (RNN) for both the auxiliary dataset and our dataset, plus a shared RNN that both datasets use (Fig. 3).",4.2 Leveraging additional data,[0],[0]
The last hidden states of the RNNs are concatenated and fed through a dense layer and a softmax activation function.,4.2 Leveraging additional data,[0],[0]
"The model is trained in an alternating fashion—i.e., after each epoch the loss for the other dataset is minimized until each dataset has run for the set number of epochs, where the last epoch is always executed on our dataset.",4.2 Leveraging additional data,[0],[0]
"At prediction time, only the private RNN trained on our dataset and the shared RNN are used.",4.2 Leveraging additional data,[0],[0]
"The core idea is that the shared RNN learns what is relevant for both tasks, while the private ones learn only the task-specific knowledge.
",4.2 Leveraging additional data,[0],[0]
"For the cases of mtl+bilstm+corpus, mtl+biclstm+ corpus, and mtl+outer-att+corpus, we simply switch the RNN with our bilstm, biclstm, and outer-att, respectively.",4.2 Leveraging additional data,[0],[0]
"For mtl+outer-att+corpus, we add the outer attention mechanism (see §4.1), modified for use with the mtl model, after each of the private RNNs, while additionally feeding it a second topic vector—the last hidden state of the shared RNN:
m(t) =",4.2 Leveraging additional data,[0],[0]
tanh(W rhr (t) +,4.2 Leveraging additional data,[0],[0]
W shs,4.2 Leveraging additional data,[0],[0]
"+W pp) (10) fattention(hr (t),hs,p) = exp(wTmm(t))∑ t exp(wTmm(t))",4.2 Leveraging additional data,[0],[0]
"(11)
",4.2 Leveraging additional data,[0],[0]
αt ∝,4.2 Leveraging additional data,[0],[0]
"fattention(hr (t),hs,p) (12)
s = n∑ t=1 hr (t)αt (13)
",4.2 Leveraging additional data,[0],[0]
"whereW r ,W s, andW p are trainable weight matrices, hr (t) is the hidden state of the private bilstm at timestep t, hs is the last hidden state of the shared model, and p is the average of all word embeddings of topic words v1, . . .",4.2 Leveraging additional data,[0],[0]
", vnτ .",4.2 Leveraging additional data,[0],[0]
"To evaluate the robustness of the models, we conduct cross-topic experiments to evaluate how well the models generalize to an unknown topic.",5 Evaluation,[0],[0]
"To this end, we combine training (70%) and validation
data (10%) of seven topics for training and parameter tuning, and use the test data (20%) of the eighth topic for testing.",5 Evaluation,[0],[0]
"For encoding the words of sentence ς and topic τ , we use 300-dimensional word embeddings trained on the Google News dataset by Mikolov et al. (2013).",5 Evaluation,[0],[0]
"To handle out-of-vocabulary words, we create separate random word vectors for each.5 Since reporting single performance scores is insufficient to compare non-deterministic learning approaches like neural networks (Reimers and Gurevych, 2017), we report all results as averages over ten runs with different random seeds.",5 Evaluation,[0],[0]
"As evaluation measures, we report the average macro F1, as well as the precision and the recall for the argument class (Parg, Rarg).",5 Evaluation,[0],[0]
"For the three-label approach, we split the precision and recall for predicting supporting (Parg+, Rarg+) and attacking arguments (Parg−, Rarg−).",5 Evaluation,[0],[0]
"As baselines, we use a simple bidirectional LSTM (Hochreiter and Schmidhuber, 1997), as well as a logistic regression model with lowercased unigram features, which has been shown to be a strong baseline for various other AM tasks (Daxenberger et al., 2017; Stab and Gurevych, 2017).",5 Evaluation,[0],[0]
"We refer to these models as bilstm and lr-uni, respectively.",5 Evaluation,[0],[0]
"All neural networks are trained using the Adam optimizer (Kingma and Ba, 2015) and cross-entropy loss function.",5 Evaluation,[0],[0]
"For finding the best model, we run each for ten epochs and take the best model based on the lowest validation loss.",5 Evaluation,[0],[0]
"In addition to that, we tune the hyperparameters of all
5Each dimension is set to a random number between −0.01 and 0.01.",5 Evaluation,[0],[0]
"Digits are mapped to the same random word vector.
neural networks (see Appendix A).",5 Evaluation,[0],[0]
"To accelerate training, we truncate sentences at 60 words.6",5 Evaluation,[0],[0]
Two-label setup.,5.1 Results,[0],[0]
The results in Table 4 show that all our models outperform the baselines for two-label prediction.7 F1 for biclstm improves by 3.5 percentage points over the bilstm baseline and by 5.6 over lr-uni.,5.1 Results,[0],[0]
A main reason for this proves to be the substantial increase in recall for our topic-integrating models—outer-att and especially biclstm—in comparison to our baselines.,5.1 Results,[0],[0]
These results show that knowledge of the argument’s topic has a strong impact on argument prediction capability.,5.1 Results,[0],[0]
"Further, we observe that integrating biclstm in a multi-task learning setup in order to draw knowledge about topic relevance from the DIP2016 corpus (mtl+biclstm+dip2016) improves F1 by an additional 2.5 percentage points.",5.1 Results,[0],[0]
"It achieves an F1 of 0.6662, which is 19.48 percentage points less than the human upper bound of 0.861.",5.1 Results,[0],[0]
"When using the SemEval corpus, which holds less task-relevant knowledge for our two-label approach, we are able to gain only 1 percentage point when integrating it into mtl+biclstm+corpus.
",5.1 Results,[0],[0]
"For the transfer learning models that integrate the topic (tr+biclstm+corpus and tr+outer-att+corpus), the parameter transfer is mostly ineffective.",5.1 Results,[0],[0]
"If no topic is provided (tr+bilstm+corpus), the transfer learning models are able to improve over the baseline bilstm.",5.1 Results,[0],[0]
"This shows that the parameter transfer
6Only 244 of our sentences (<1%) exceed this length.",5.1 Results,[0],[0]
"7Detailed results per topic are given in Appendix B.
itself can be of use, but confuses the model when combined with topic integration.
",5.1 Results,[0],[0]
"In general, we observe an overall lower score for trl models that use the DIP2016 corpus compared to those using the SemEval corpus.",5.1 Results,[0],[0]
"In contrast to the mtl model, for trl models all parameters are transferred to the main task, not just parameters that represent shared knowledge.",5.1 Results,[0],[0]
"Thus, we suspect the lower scores of the trl models with DIP2016 are due to overfitting on the vast number of samples which shape the parameters much more than the comparatively small SemEval corpus could.
",5.1 Results,[0],[0]
Three-label setup.,5.1 Results,[0],[0]
"For the three-label approach, we observe overall lower scores due to the additional difficulty in distinguishing supporting from opposing arguments.",5.1 Results,[0],[0]
"As already observed in the two-label setup, biclstm outperforms both the bilstm and lr-uni baselines; here, the former by 4.5 and the latter by 4.2 percentage points in F1.",5.1 Results,[0],[0]
"Again, this is caused by a substantial increase in recall and shows the impact that the available topic information has on the classifier’s predictive power.",5.1 Results,[0],[0]
"For transfer learning, we see similar results as for the two-label approach; both the DIP2016 and SemEval corpora have a generally negative impact when compared to the respective base models.",5.1 Results,[0],[0]
The SemEval corpus does not provide the knowledge required to distinguish supporting from attacking arguments.,5.1 Results,[0],[0]
"We conclude that the original purpose of the SemEval task, stance recognition, is too different from our own.",5.1 Results,[0],[0]
"But in multi-task learning, where only the shared parameters are taken, we observe slight improvements when using biclstm with DIP2016; this correlates with the same model in the two-label setup.",5.1 Results,[0],[0]
"To understand the errors of our best model, mtlbiclstm-dip, and the nature of this task, we manually analyzed 100 sentences randomly sampled from the false positive and false negative arguments of the three-label experiments (combining supporting and attacking arguments).",5.2 Error analysis,[0],[0]
"Among the false positives, we found 48 off-topic sentences that were wrongly classified as arguments.",5.2 Error analysis,[0],[0]
The 52 on-topic false positives consist of non-argumentative background information or mere opinions without evidence (as with the first and fourth examples of Table 1) and questions about the topic.,5.2 Error analysis,[0],[0]
"Among the false negatives, we found 65 arguments that did not explicitly refer to the topic but to related aspects that
depend on background knowledge.",5.2 Error analysis,[0],[0]
"For instance, the model fails to establish an argumentative link between the topic “gun control” and the Second Amendment to the US Constitution.",5.2 Error analysis,[0],[0]
"Lastly, we inspected arguments that are incorrectly classified as supporting and/or opposing a topic.",5.2 Error analysis,[0],[0]
We found several samples in which the term “against” is not correctly interpreted and the argument is classified as supporting a topic.,5.2 Error analysis,[0],[0]
"Similarly, for arguments incorrectly classified as attacking, we find various samples where the word “oppose” is used not to oppose the topic but to strengthen a supporting argument, as in “There is reason even for people who oppose the use of marijuana to support its legalization. . . ”",5.2 Error analysis,[0],[0]
"To evaluate the performance of the models in datascarce scenarios, we gradually add target topic data to the training data and analyze the model performance on the target test set.",5.3 Adapting to new topics,[0],[0]
"Figure 4 shows model performance (F1, Parg, and Rarg) on the “marijuana legalization” topicwhen adding different amounts of randomly sampled topic-specific data to the training data (x-axes).8",5.3 Adapting to new topics,[0],[0]
"As the results show, the models that integrate the topic achieve higher recall when adding target topic data to the training data.",5.3 Adapting to new topics,[0],[0]
"For bilstm, we observe a drastic difference when compared to the other models; the recall for arguments stays at around 30% and rises only when integrating more than 60% target topic data.",5.3 Adapting to new topics,[0],[0]
"In strong contrast, topic-integrating models retrieve a much higher number of actual arguments at target topic augmentation levels as low as 20%.",5.3 Adapting to new topics,[0],[0]
"Further, and equally important, this does not come at the cost of precision; on the contrary, the precision is mostly steady and slowly rising after around 20% of target topic integration, leading to an overall higher F1 for these models.",5.3 Adapting to new topics,[0],[0]
"Finally, in comparing F1 between topic-integrating models and bilstm, we conclude that the former need much less target topic data to substantially improve their score, making them more robust in situations of data scarcity.",5.3 Adapting to new topics,[0],[0]
We have presented a new approach for searching a document collection for arguments relevant to a given topic.,6 Conclusion,[0],[0]
"First, we introduced an annotation scheme suited to the information-seeking perspec-
8Each data point in the plot is the average score of ten runs with different random samples of target topic data.
",6 Conclusion,[0],[0]
tive of argument search and showed that it is cheaply but reliably applicable by untrained annotators to arbitrary Web texts.,6 Conclusion,[0],[0]
"Second, we presented a new corpus, including over 25,000 instances over eight topics, that allows for cross-topic experiments using heterogeneous text types.",6 Conclusion,[0],[0]
"Third, we conducted cross-topic experiments and showed that integrating topic information of arguments with our contextual BiLSTM leads to better generalization to unknown topics.",6 Conclusion,[0],[0]
"Fourth, by leveraging knowledge from similar datasets and integrating our contextual BiLSTM into a multi-task learning setup, we were able to gain an improvement over our strongest baseline of 5.9 percentage points in F1 in the two-label setup and 4.6 in the three-label setup.",6 Conclusion,[0],[0]
"Finally, by gradually adding target topic data to our training set, we showed that, when available, even small amounts of target topic data (20%) have a strong positive influence on the recall of arguments.
",6 Conclusion,[0],[0]
"In a separate, simultaneously written paper (Stab et al., 2018) we evaluate our models in real-world application scenarios by applying them to a large document collection and comparing the results to a manually produced gold standard.",6 Conclusion,[0],[0]
"An online argument search engine implementing our approach is now available for noncommercial use at https://www.argumentsearch.com/. Furthermore, we are experimenting with language adaptation and plan to extend the tool to the German language.",6 Conclusion,[0],[0]
Preliminary results are presented in Stahlhut (2018).,6 Conclusion,[0],[0]
We also intend to investigate methods for grouping similar arguments.,6 Conclusion,[0],[0]
This work has been supported by the German Federal Ministry of Education and Research (BMBF) under the promotional reference 03VP02540,Acknowledgements,[0],[0]
"(Ar-
gumenText) and the DFG-funded research training group “Adaptive Preparation of Information form Heterogeneous Sources” (AIPHES, GRK 1994/1).",Acknowledgements,[0],[0]
Argument mining is a core technology for automating argument search in large document collections.,abstractText,[0],[0]
"Despite its usefulness for this task, most current approaches are designed for use onlywith specific text types and fall short when applied to heterogeneous texts.",abstractText,[0],[0]
"In this paper, we propose a new sentential annotation scheme that is reliably applicable by crowd workers to arbitrary Web texts.",abstractText,[0],[0]
"We source annotations for over 25,000 instances covering eight controversial topics.",abstractText,[0],[0]
We show that integrating topic information into bidirectional long short-termmemory networks outperforms vanilla BiLSTMs by more than 3 percentage points in F1 in twoand three-label cross-topic settings.,abstractText,[0],[0]
We also show that these results can be further improved by leveraging additional data for topic relevance using multi-task learning.,abstractText,[0],[0]
Cross-topic Argument Mining from Heterogeneous Sources,title,[0],[0]
"Crowdsourcing is an omnipresent phenomenon: it has emerged as an integral part of the machine learning pipeline in recent years, and one reason for the great advances in deep learning is the presence of large data sets that have been labeled by the crowd (e.g., Deng et al., 2009; Krizhevsky, 2009).",1. Introduction,[0],[0]
"Crowdsourcing is also at the heart of peer grading systems (e.g., Alfaro & Shavlovsky, 2014), which help with rising enrollment at universities, and online rating systems (e.g., Liao et al., 2014), which many of us rely on when choosing the next restaurant, to provide just a few examples.
",1. Introduction,[0],[0]
A crowdsourcing scenario consists of a set of workers and a set of tasks that need to be solved.,1. Introduction,[0],[0]
A data curator utilizing crowdsourcing can aim at estimating various quantities of interest.,1. Introduction,[0],[0]
The first goal might be to estimate the true labels or answers for the tasks at hand.,1. Introduction,[0],[0]
"Typically, additional constraints are involved here such as a worker not being willing
1Department of Computer Science, Rutgers University, Piscataway Township, New Jersey, USA.",1. Introduction,[0],[0]
Correspondence to: Matthäus,1. Introduction,[0],[0]
"Kleindessner <matthaeus.kleindessner@rutgers.edu>, Pranjal Awasthi <pranjal.awasthi@rutgers.edu>.
Proceedings of the 35 th International Conference on Machine Learning, Stockholm, Sweden, PMLR 80, 2018.",1. Introduction,[0],[0]
"Copyright 2018 by the author(s).
to solve too many tasks and the data curator wanting to get high-quality labels at a low price.",1. Introduction,[0],[0]
The canonical example of this case is the Amazon Mechanical TurkTM.,1. Introduction,[0],[0]
There one cannot track specific workers as they are fleeting.,1. Introduction,[0],[0]
"However, in scenarios such as peer grading or online rating systems, a second goal might be to estimate worker qualities, especially if workers can be reused at a later time.
",1. Introduction,[0],[0]
"In a seminal paper, Dawid & Skene (1979) proposed a formal model that involves worker quality parameters for crowdsourcing scenarios in the context of classification.",1. Introduction,[0],[0]
"The Dawid-Skene model has become a standard theoretical framework and has led to a flurry of research over the past few years (Liu et al., 2012; Raykar & Yu, 2012; Li et al., 2013; Gao et al., 2016; Zhang et al., 2016; Khetan et al., 2017), in particular in its special symmetric form usually referred to as one-coin model (Ghosh et al., 2011; Karger et al., 2011a;b; Dalvi et al., 2013; Gao & Zhou, 2013; Karger et al., 2014; Bonald & Combes, 2017; Ma et al., 2017).",1. Introduction,[0],[0]
"In its general form for binary classification problems, the DawidSkene model assumes that for each worker, the probability of providing the wrong label only depends on the true label of the task, but not on the task itself.",1. Introduction,[0],[0]
"Moreover, given the true label, the responses provided by different workers are independent.",1. Introduction,[0],[0]
"The one-coin model additionally assumes that for each worker, the probability of providing the wrong label is the same for both classes.",1. Introduction,[0],[0]
We will formally introduce the one-coin model in Section 2.,1. Introduction,[0],[0]
"A discussion of prior work work is provided in Section 5 and Appendix A.
The crucial limitation of the Dawid-Skene and one-coin model is the assumption that workers’ error probabilities are task-independent.",1. Introduction,[0],[0]
"In particular, this excludes the possibility of colluding adversaries (other than those that provide the wrong label all of the time), which might make these models a poor approximation of the real world encountered in such applications as peer grading or online rating.",1. Introduction,[0],[0]
"In this paper, we study a significant extension of the one-coin model that allows for arbitrary, highly colluding adversaries.",1. Introduction,[0],[0]
We provide an algorithm for estimating the workers’ error probabilities and prove that it asymptotically recovers the true error probabilities.,1. Introduction,[0],[0]
"Using our estimates of the error probabilities in weighted majority votes, we also provide strategies to estimate ground-truth labels of the tasks.",1. Introduction,[0],[0]
Experiments on both synthetic and real data show that our approach clearly outperforms existing methods in the presence of adversaries.,1. Introduction,[0],[0]
"We first describe a general model for crowdsourcing with non-adaptive workers and binary classification tasks: there are n workers w1, . . .",2. Setup and problem formulation,[0],[0]
", wn and an i.i.d. sample of m tasklabel pairs ((xi, yi))mi=1 ∼",2. Setup and problem formulation,[0],[0]
"Dm, where D is a joint probability distribution over tasks x ∈ X and corresponding labels y ∈ {−1,+1}.",2. Setup and problem formulation,[0],[0]
"There is a variable gij ∈ {0, 1},",2. Setup and problem formulation,[0],[0]
i ∈,2. Setup and problem formulation,[0],[0]
"[m], j ∈",2. Setup and problem formulation,[0],[0]
